ID;Codigo;Link;Nombre;Descripcion/Obervaciones;Tipo;ProcedenciaOC;EsTratoDirecto;EsCompraAgil;CodigoTipo;CodigoAbreviadoTipoOC;DescripcionTipoOC;codigoEstado;Estado;codigoEstadoProveedor;EstadoProveedor;FechaCreacion;FechaEnvio;FechaSolicitudCancelacion;fechaUltimaModificacion;FechaAceptacion;FechaCancelacion;tieneItems;PromedioCalificacion;CantidadEvaluacion;MontoTotalOC;TipoMonedaOC;MontoTotalOC_PesosChilenos;Impuestos;TipoImpuesto;Descuentos;Cargos;TotalNetoOC;CodigoUnidadCompra;RutUnidadCompra;UnidadCompra;CodigoOrganismoPublico;OrganismoPublico;sector;ActividadComprador;CiudadUnidadCompra;RegionUnidadCompra;PaisUnidadCompra;CodigoSucursal;RutSucursal;Sucursal;CodigoProveedor;NombreProveedor;ActividadProveedor;ComunaProveedor;RegionProveedor;PaisProveedor;Financiamiento;PorcentajeIva;Pais;TipoDespacho;FormaPago;CodigoLicitacion;Codigo_ConvenioMarco;IDItem;codigoCategoria;Categoria;codigoProductoONU;NombreroductoGenerico;RubroN1;RubroN2;RubroN3;EspecificacionComprador;EspecificacionProveedor;cantidad;UnidadMedida;monedaItem;precioNeto;totalCargos;totalDescuentos;totalImpuestos;totalLineaNeto;Forma de Pago
43464892;2332-240-SE21;http://www.mercadopublico.cl/PurchaseOrder/Modules/PO/DetailsPurchaseOrder.aspx?codigoOC=2332-240-SE21;FARMACOS FARMACIA CIUDADANA, REQ125;"D.e.2008,req125,cer156 
Todos los productos adquiridos en esta OC deben contar con rotulado, indicar vencimiento y lote, Resolución Sanitaria vigente de elaboración, distribución y almacenaje para cada caso si es fármaco o insumo (clínico o dental).  De ";SE;Contratación con titulares de derecho de propiedad intelectual o industrial;Si;No;8;SE;Sin emisión automática;6;Aceptada;4;Aceptada;2021-02-23;2021-03-02;2021-03-02;2021-03-04;2021-03-11;;1;4,82222222222222;9;1522367;CLP;1522367;243067;IVA;0;0;1279300;3325;69.220.100-0;Oficina de Adquisiciones del Departamento de Salud;86507;I MUNICIPALIDAD DE PUERTO MONTT;Municipalidades;GOBIERNO CENTRAL;Puerto Montt;Región de los Lagos ;CL;21978;79.802.770-0;Eurofarma Chile S. A.;22491;Eurofarma Chile S. A.;FABRICACION DE PRODUCTOS FARMACEUTICOS, SUSTANCIAS;Cerrillos;Región Metropolitana de Santiago;Chile;2152204004005;19;CL;7;2;;;115394671.0;51141800.0;Medicamentos y productos farmacéuticos / Medicamentos para el sistema nervioso central / Hipnóticos;51141810.0;Zopiclona;Medicamentos y productos farmacéuticos;Medicamentos para el sistema nervioso central;Hipnóticos;ZOPERIL 7,5 MG X 30 COMP. RECUB.;ZOPERIL 7,5 MG X 30 COMP. RECUB.;100;Unidad;CLP;999;0;0;0.0;99900;30 dias contra la recepcion conforme de la factura
43464941;1058095-376-SE21;http://www.mercadopublico.cl/PurchaseOrder/Modules/PO/DetailsPurchaseOrder.aspx?codigoOC=1058095-376-SE21;ORDEN DE COMPRA DESDE 1058095-6-LE21;"LICITACIÓN PÚBLICA, REPOSICIÓN MEDICAMENTOS HASTA FEBRERO (4) 2021.
I.P.: 220400400102. 

UNA VEZ ACEPTADA LA ORDEN DE COMPRA FAVOR DESPACHAR INMEDIATAMENTE Y EN SU TOTALIDAD

FACTURA DEBE INDICAR NUMERO DE ORDEN DE COMPRA y ser enviada a Casilla de ";SE;Proveniente de licitación pública;No;No;8;SE;Sin emisión automática;12;Recepcion Conforme;7;Recepcion Conforme;2021-02-23;2021-03-01;2021-02-24;2021-02-24;2021-03-02;;1;3,89333333333333;15;4568172;CLP;4568172;729372;IVA;0;0;3838800;1058095;61.608.502-6;Fármarcos;7320;COMPLEJO ASISTENCIAL DR. SOTERO DEL RIO;Salud;Servicio Público;Puente Alto;Región Metropolitana de Santiago;CL;829754;76.389.383-9;DROGUERIA GLOBAL PHARMA SPA;1426099;DROGUERIA GLOBAL PHARMA SPA;FARMACIA Y PERFUMERIA ;Cerrillos;Región Metropolitana de Santiago;Chile;;19;CL;7;2;1058095-6-LE21;;115333210.0;51141800.0;Medicamentos y productos farmacéuticos / Medicamentos para el sistema nervioso central / Hipnóticos;51141810.0;Zopiclona;Medicamentos y productos farmacéuticos;Medicamentos para el sistema nervioso central;Hipnóticos;"50-214-600-015-00 TIAMAZOL 10MG CMP
";"
";3750;Comprimido;CLP;330;0;0;0.0;1237500;30 dias contra la recepcion conforme de la factura
43479278;748201-263-SE21;http://www.mercadopublico.cl/PurchaseOrder/Modules/PO/DetailsPurchaseOrder.aspx?codigoOC=748201-263-SE21;TD: Eurofarma Chile S.A. Stgo. Citrix 46.542;"CITRIX N°46.542
RESOLUCION N°488 FECHA 02-03-2021
FACTURAR: CAPREDENA
GIRO: VENTA AL POR MENOR DE PRODUCTOS FARMACÉUTICOS Y MEDICINALES EN COMERCIOS ESPECIALIZADOS.
DIRECCION FACTURA: PASEO BULNES 284 STGO
DESPACHO: PASEO BULNES N°284
MENCIONAR OC E";SE;Costo de evaluación desproporcionado, y por monto de contratación inferior a 100 UTM;Si;No;8;SE;Sin emisión automática;12;Recepcion Conforme;7;Recepcion Conforme;2021-02-25;2021-03-02;2021-03-02;2021-03-02;2021-03-11;;1;4,82222222222222;9;1229870,95;CLP;1229870,95;196365,95;IVA;0;0;1033505;748201;61.108.000-k;Unidad de Compras Farmacia;7175;CAJA DE PREVISION DE LA DEFENSA NACIONAL;Gob. Central, Universidades;FARMACIAS INDEPENDIENTES| COMERCIO AL POR MENOR DE;Santiago;Región Metropolitana de Santiago;CL;21978;79.802.770-0;Eurofarma Chile S. A.;22491;Eurofarma Chile S. A.;FABRICACION DE PRODUCTOS FARMACEUTICOS, SUSTANCIAS;Cerrillos;Región Metropolitana de Santiago;Chile;;19;CL;7;39;;;115373246.0;51141800.0;Medicamentos y productos farmacéuticos / Medicamentos para el sistema nervioso central / Hipnóticos;51141810.0;Zopiclona;Medicamentos y productos farmacéuticos;Medicamentos para el sistema nervioso central;Hipnóticos;ZOPERIL 7.5 MG 30 COMP. REC.;ZOPERIL 7.5 MG 30 COMP. REC.;150;Caja;CLP;999;0;0;0.0;149850;Otro, Ver Instrucciones
43485555;2258-1519-SE21;http://www.mercadopublico.cl/PurchaseOrder/Modules/PO/DetailsPurchaseOrder.aspx?codigoOC=2258-1519-SE21;ORDEN DE COMPRA DESDE 2258-284-LR20;"COMPRA PROGRAMA FARMACIA PROVEEDOR EN LICIATCION
COMPRIMIDOS VARIOS DESDE 2258-284-LR20, SE SOLICITA DESAPCHO URGENTE.";SE;Proveniente de licitación pública;No;No;8;SE;Sin emisión automática;6;Aceptada;4;Aceptada;2021-02-26;2021-03-03;2021-03-03;2021-03-03;2021-03-04;;1;3,27027027027027;37;968660;CLP;968660;154660;IVA;0;0;814000;3252;61.606.201-8;Abastecimiento Principal;7451;SERVICIO DE SALUD ANTOFAGASTA HOSPITAL L;Salud;;Antofagasta;Región de Antofagasta ;CL;275627;76.956.140-4;ETHON PHARMACEUTICALS SPA.;269948;ETHON PHARMACEUTICALS  COMERCIALIZADORA  IMP EXP Y DIST SPA;VENTA AL POR MAYOR DE ARTICULOS DE PERFUMERIA, COS;Rancagua;Región del Libertador General Bernardo O´Higgins;Chile;;19;CL;7;48;2258-284-LR20;;115390279.0;51141800.0;Medicamentos y productos farmacéuticos / Medicamentos para el sistema nervioso central / Hipnóticos;51141810.0;Zopiclona;Medicamentos y productos farmacéuticos;Medicamentos para el sistema nervioso central;Hipnóticos;214-0134 ZOPICLONA CM 7,5 MG. ENVASADO EN BLISTER;"ZPCL07.5COMP. BEZOPICLONA 7.5MG X 1000 COMP.REC.. MINTLAB. ZOPICLONA. REG ISP F-12586 - VTO 11-2022 - LOTE K201537
Entrega en 48 horas. Se adjunta ISP, CANJE y anexos técnicos. Sin costo por flete. Pedido mínimo 50.000.";37000;Comprimido;CLP;22;0;0;0.0;814000;
43487909;4075-90-SE21;http://www.mercadopublico.cl/PurchaseOrder/Modules/PO/DetailsPurchaseOrder.aspx?codigoOC=4075-90-SE21;ORDEN DE COMPRA DESDE 4075-5-L121;COMPRA DE FÁRMACOS Y SUEROS PARA CESFAM FRANCISCO DESDE 4075-5-L121, DESPACHO A CESFAM CALLE LA CONCEPCIO N° 275 YUMBEL ESTACION ;SE;Proveniente de licitación pública;No;No;8;SE;Sin emisión automática;6;Aceptada;4;Aceptada;2021-03-01;2021-03-01;2021-03-01;2021-03-01;2021-03-01;;1;3,69354838709677;62;299880;CLP;299880;47880;IVA;0;0;252000;4995;69.150.901-K;Depto. Salud Municipal;120004;I MUNICIPALIDAD DE YUMBEL;Municipalidades;;Yumbel;Región del Biobío ;CL;261744;76.830.090-9;Caribean Pharma Ltda;256360;FARMACEUTICA CARIBEAN LTDA;VENTA AL POR MAYOR DE ARTICULOS DE PERFUMERIA, COS;Renca;Región Metropolitana de Santiago;Chile;2204004;19;CL;7;2;4075-5-L121;;115395244.0;51141800.0;Medicamentos y productos farmacéuticos / Medicamentos para el sistema nervioso central / Hipnóticos;51141810.0;Zopiclona;Medicamentos y productos farmacéuticos;Medicamentos para el sistema nervioso central;Hipnóticos;ZOPICLONA COMP 7,5 MG;MIN0215 ZOPICLONA 7,5  COMP. CAJA X1000 B  Entrega 24-48 HR ZOPICLONA F-12586 MINTLAB  VENC. 31-10-2022   ;12000;Comprimido;CLP;21;0;0;0.0;252000;30 dias contra la recepcion conforme de la factura
43488055;1552-236-SE21;http://www.mercadopublico.cl/PurchaseOrder/Modules/PO/DetailsPurchaseOrder.aspx?codigoOC=1552-236-SE21;Adquisición de Medicamentos beneficiario Prais;Adquisición de medicamentos beneficiario Prais según resolución exenta N°682/24.02.2021;SE;Costo de evaluación desproporcionado, y por monto de contratación inferior a 100 UTM;Si;No;8;SE;Sin emisión automática;12;Recepcion Conforme;7;Recepcion Conforme;2021-03-01;2021-03-01;2021-03-01;2021-03-01;2021-03-03;;1;0;0;228299,99703;CLP;228299,99703;36451,26003;IVA;0;0;191848,737;2548;61.606.300-6;Servicio de Salud Atacama;7409;SERVICIO DE SALUD ATACAMA;Salud;-;Copiapó;Región de Atacama ;CL;665633;76.159.906-2;farmacia la botika;1267723;SOCIEDAD FARMACEUTICA Y PERFUMERIA LA BOTIKA LIMITADA;-;Copiapó;Región de Atacama ;Chile;828;19;CL;12;2;;;115395676.0;51141800.0;Medicamentos y productos farmacéuticos / Medicamentos para el sistema nervioso central / Hipnóticos;51141810.0;Zopiclona;Medicamentos y productos farmacéuticos;Medicamentos para el sistema nervioso central;Hipnóticos;ZOMETIC 7,5 MG;ZOMETIC 7,5 MG;3;Caja;CLP;5126,05;0;0;0.0;15378,15;30 dias contra la recepcion conforme de la factura
43488423;2762-193-SE21;http://www.mercadopublico.cl/PurchaseOrder/Modules/PO/DetailsPurchaseOrder.aspx?codigoOC=2762-193-SE21;ADQUISICIÓN FÁRMACOS FARMACIA MUNICIPAL;"Decreto Alcaldicio N°1.261 del 15 de Febrero de 2020, Que autoriza compra directa
Solicitud de Materiales N°43, Farmacia Municipal de Coronel
";SE;Confianza y seguridad de los proveedores, derivados de su experiencia;Si;No;8;SE;Sin emisión automática;6;Aceptada;4;Aceptada;2021-03-01;2021-03-01;2021-03-01;2021-03-01;2021-03-11;;1;4,82222222222222;9;295705,48;CLP;295705,48;47213,48;IVA;0;0;248492;3751;69.151.202-9;DEPARTAMENTO ADMINISTRACION SALUD MUNICIPAL;100448;I MUNICIPALIDAD DE CORONEL;Municipalidades;GOBIERNO CENTRAL Y ADMINISTRACION PUBLICA;Coronel;Región del Biobío ;CL;21978;79.802.770-0;Eurofarma Chile S. A.;22491;Eurofarma Chile S. A.;FABRICACION DE PRODUCTOS FARMACEUTICOS, SUSTANCIAS;Cerrillos;Región Metropolitana de Santiago;Chile;05-47/2021;19;CL;7;2;;;115398153.0;51141800.0;Medicamentos y productos farmacéuticos / Medicamentos para el sistema nervioso central / Hipnóticos;51141810.0;Zopiclona;Medicamentos y productos farmacéuticos;Medicamentos para el sistema nervioso central;Hipnóticos;ZOPERIL 7,5 MG X 30 COMPRIMIDOS;ZOPERIL 7,5 MG X 30 COMPRIMIDOS;8;Caja;CLP;999;0;0;0.0;7992;30 dias contra la recepcion conforme de la factura
43489441;3766-39-SE21;http://www.mercadopublico.cl/PurchaseOrder/Modules/PO/DetailsPurchaseOrder.aspx?codigoOC=3766-39-SE21;ORDEN DE COMPRA DESDE 3766-4-L121;ADQUISICION DE MEDICAMENTOS PARA DEPTO SALUD DESDE 3766-4-L121;SE;Proveniente de licitación pública;No;No;8;SE;Sin emisión automática;12;Recepcion Conforme;7;Recepcion Conforme;2021-03-01;2021-03-01;2021-03-01;2021-03-01;2021-03-01;;1;3,69354838709677;62;498967;CLP;498967;79667;IVA;0;0;419300;4686;69.110.600-4;Salud;116729;I MUNICIPALIDAD DE PELARCO;Municipalidades;;Pelarco;Región del Maule ;CL;261744;76.830.090-9;Caribean Pharma Ltda;256360;FARMACEUTICA CARIBEAN LTDA;VENTA AL POR MAYOR DE ARTICULOS DE PERFUMERIA, COS;Renca;Región Metropolitana de Santiago;Chile;;19;CL;7;2;3766-4-L121;;115399548.0;51141800.0;Medicamentos y productos farmacéuticos / Medicamentos para el sistema nervioso central / Hipnóticos;51141810.0;Zopiclona;Medicamentos y productos farmacéuticos;Medicamentos para el sistema nervioso central;Hipnóticos;ZOPICLONA 7,5 MG;MIN0215 ZOPICLONA 7,5  COMP. CAJA X1000 B  Entrega 24-48 HR ZOPICLONA F-12586 MINTLAB  VENC. 31-10-2022   ;10000;Unidad;CLP;21;0;0;0.0;210000;30 dias contra la recepcion conforme de la factura
43491478;3983-61-SE21;http://www.mercadopublico.cl/PurchaseOrder/Modules/PO/DetailsPurchaseOrder.aspx?codigoOC=3983-61-SE21;ORDEN DE COMPRA DESDE 3983-3-LE21;MEDICAMENTOS PARA FARMACIA COMUNITARIA PAREDONES  DESDE 3983-3-LE21;SE;Proveniente de licitación pública;No;No;8;SE;Sin emisión automática;6;Aceptada;4;Aceptada;2021-03-01;2021-03-01;2021-03-01;2021-03-01;2021-03-30;;1;4,66666666666667;3;9226748,3;CLP;9226748,3;1473178,3;IVA;0;0;7753570;4903;69.090.900-6;Salud;118971;I MUNICIPALIDAD DE PAREDONES;Municipalidades;;Paredones;Región del Libertador General Bernardo O´Higgins;CL;1001738;76.031.071-9;Distribuidora Salcobrand;14555;SALCOBRAND S.A;Farmacia;San Bernardo;Región Metropolitana de Santiago;;215.22.04.004.002.011;19;CL;12;2;3983-3-LE21;;115405350.0;42171900.0;Equipamiento y suministros médicos / Artículos médicos para urgencias y atención en terreno / Contenedores de almacenaje para servicios médicos de urgencia;42171903.0;Cajas de medicamentos de servicios médicos de urgencia;Equipamiento y suministros médicos;Artículos médicos para urgencias y atención en terreno;Contenedores de almacenaje para servicios médicos de urgencia;ESZOPICLONA 3 MG X 30 COMPRIMIDOS.;SB2818877 - NOVO INSOMNIUM 3mg X30COM.REC., ESZOPICLONA 3mg COMPRIMIDOS RECUBIERTOS. ISP: F-18878-16. Fabricante: GADORPHARMA SPA. Vencimiento mayor a 12 meses. Valor cotizado por caja. Unidad mínima de venta CAJA X 30 COMPRIMIDOS. Mínimo de facturación 8;10;Unidad;CLP;3667;0;0;0.0;36670;30 dias contra la recepcion conforme de la factura
43492756;2777-224-SE21;http://www.mercadopublico.cl/PurchaseOrder/Modules/PO/DetailsPurchaseOrder.aspx?codigoOC=2777-224-SE21;ORDEN DE COMPRA DESDE 2777-42-LE20;Orden para formalización de contrato Suministro de Medicamentos para Farmacia Popular DESDE 2777-42-LE20 FAVOR NO DESPACHAR;SE;Proveniente de licitación pública;No;No;8;SE;Sin emisión automática;6;Aceptada;4;Aceptada;2021-03-01;2021-03-03;2021-03-01;2021-03-01;2021-03-10;;1;3,27027027027027;37;1643628;CLP;1643628;262428;IVA;0;0;1381200;3766;69.081.200-2;ADQUISICION MUNI-SALUD;100555;I MUNICIPALIDAD DE RENGO;Municipalidades;GOBIERNO CENTRAL Y ADMINISTRACION PUBLICA;Rengo;Región del Libertador General Bernardo O´Higgins;CL;275627;76.956.140-4;ETHON PHARMACEUTICALS SPA.;269948;ETHON PHARMACEUTICALS  COMERCIALIZADORA  IMP EXP Y DIST SPA;VENTA AL POR MAYOR DE ARTICULOS DE PERFUMERIA, COS;Rancagua;Región del Libertador General Bernardo O´Higgins;Chile;215.22.04.004.001.006.01.01;19;CL;7;2;2777-42-LE20;;115409044.0;42171900.0;Equipamiento y suministros médicos / Artículos médicos para urgencias y atención en terreno / Contenedores de almacenaje para servicios médicos de urgencia;42171903.0;Cajas de medicamentos de servicios médicos de urgencia;Equipamiento y suministros médicos;Artículos médicos para urgencias y atención en terreno;Contenedores de almacenaje para servicios médicos de urgencia;ESZOPICLONA 3 MG , ENVASE COMERCIAL ;"ESZP0003COMP. PLESSIR 3 MG X 30 COMP.REC.. MEDIPHARM. ESZOPICLONA. REG ISP F-17564 - VTO 4-2023 - LOTE 0408820
Vigencia de la Oferta 60 días ";10;Unidad;CLP;5325;0;0;0.0;53250;30 dias contra la recepcion conforme de la factura
43494184;2628-70-SE21;http://www.mercadopublico.cl/PurchaseOrder/Modules/PO/DetailsPurchaseOrder.aspx?codigoOC=2628-70-SE21;MEDICAMENTOS FARMACIA MUNICIPAL;Se requiere compra de medicamentos para la farmacia Municipal.-;SE;Contratación con titulares de derecho de propiedad intelectual o industrial;Si;No;8;SE;Sin emisión automática;6;Aceptada;4;Aceptada;2021-03-01;2021-03-02;2021-03-01;2021-03-02;2021-03-11;;1;4,82222222222222;9;1055125,4;CLP;1055125,4;168465,4;IVA;0;0;886660;3617;69.050.700-5;DEPARTAMENTO DE SALUD ;98280;I MUNICIPALIDAD DE PUTAENDO;Municipalidades;GOBIERNO CENTRAL Y ADMINISTRACION PUBLICA| OTROS SERVICIOS DE DIVERSION Y ESPARCIMIENTOS N.C.P.;Putaendo;Región de Valparaíso ;CL;21978;79.802.770-0;Eurofarma Chile S. A.;22491;Eurofarma Chile S. A.;FABRICACION DE PRODUCTOS FARMACEUTICOS, SUSTANCIAS;Cerrillos;Región Metropolitana de Santiago;Chile;00068/21;19;CL;7;2;;;115414350.0;51141800.0;Medicamentos y productos farmacéuticos / Medicamentos para el sistema nervioso central / Hipnóticos;51141810.0;Zopiclona;Medicamentos y productos farmacéuticos;Medicamentos para el sistema nervioso central;Hipnóticos;Zoperil 7.5 Mg. x 30 comp.;Zoperil 7.5 Mg. x 30 comp.;60;Caja;CLP;999;0;0;0.0;59940;30 dias contra la recepcion conforme de la factura
43496309;1979-491-SE21;http://www.mercadopublico.cl/PurchaseOrder/Modules/PO/DetailsPurchaseOrder.aspx?codigoOC=1979-491-SE21;"FARMACOS EN CONVENIO DESDE ID 1979-104-LQ20;1979-14-LQ20;1979-77-LQ20 ";"SOLICITUD BODEGA FARMACIA 
RESOL. EXENTA N°426
DESDE ID 1979-104-LQ20;1979-14-LQ20;1979-77-LQ20
VENCIMIENTO NO MENOR A 12 MESES
*RECEPCION DE PRODUCTOS EN BODEGA
LUNES A VIERNES DESDE LAS 08:00 HASTA LAS 14:00 HRS.
";SE;Proveniente de licitación pública;No;No;8;SE;Sin emisión automática;12;Recepcion Conforme;7;Recepcion Conforme;2021-03-02;2021-03-02;2021-03-02;2021-03-04;2021-03-02;;1;3,8375;16;892535,7;CLP;892535,7;142505,7;IVA;0;0;750030;2974;61.607.401-6;Hospital Nueva Imperial;7060;SERVICIO DE SALUD ARAUCANIA SUR HOSPITAL DE NUEVA IMPERIAL;Salud;;Nueva Imperial;Región de la Araucanía ;CL;26581;91.637.000-8;LABORATORIOS RECALCINE S.A;26786;LABORATORIOS RECALCINE SA;FABRICACION DE PRODUCTOS FARMACEUTICOS, SUSTANCIAS;Providencia;Región Metropolitana de Santiago;Chile;;19;CL;7;2;;;115420801.0;51161800.0;Medicamentos y productos farmacéuticos / Medicamentos para el tracto respiratorio / Productos para tos, resfriados y antialérgicos;51161812.0;Combinación clorfeniramina-acetaminofeno;Medicamentos y productos farmacéuticos;Medicamentos para el tracto respiratorio;Productos para tos, resfriados y antialérgicos;"ESZOPICLONA 3 MG CM
";"ESZOPICLONA 3 MG CM
";1770;Unidad no definida;CLP;65;0;0;0.0;115050;30 dias contra la recepcion conforme de la factura
43497197;1952-326-SE21;http://www.mercadopublico.cl/PurchaseOrder/Modules/PO/DetailsPurchaseOrder.aspx?codigoOC=1952-326-SE21;1175-252-LQ18 ZOPICLONA 7,5 MG COMPRIMIDO;"RESOLUCIÓNEXENTA DE COMPRA N° 232/02.03.2021 HOSPITAL VILLARRICA, ADJUDICADA EN RES. EXENTA N° 02908/04.04.2019 
RES EXENTA N°03792/16.03.2020 QUE AUTORIZA PRORROGA DE CONTRATO SEGUN ID 1175-252-LQ18.
""SE SOLICITA ACEPTAR ORDEN DE COMPRA EN EL PORTAL AN";SE;Proveniente de licitación pública;No;No;8;SE;Sin emisión automática;12;Recepcion Conforme;7;Recepcion Conforme;2021-03-02;2021-03-04;2021-03-02;2021-06-01;2021-03-04;;1;3,27027027027027;37;85680;CLP;85680;13680;IVA;0;0;72000;2947;61.602.248-2;Hospital Villarrica;7132;Hospital Villarrica;Salud;Salud;Villarrica;Región de la Araucanía ;CL;275627;76.956.140-4;ETHON PHARMACEUTICALS SPA.;269948;ETHON PHARMACEUTICALS  COMERCIALIZADORA  IMP EXP Y DIST SPA;VENTA AL POR MAYOR DE ARTICULOS DE PERFUMERIA, COS;Rancagua;Región del Libertador General Bernardo O´Higgins;Chile;949;19;CL;7;2;;;115424096.0;51141800.0;Medicamentos y productos farmacéuticos / Medicamentos para el sistema nervioso central / Hipnóticos;51141810.0;Zopiclona;Medicamentos y productos farmacéuticos;Medicamentos para el sistema nervioso central;Hipnóticos;"ZOPICLONA 7,5 MG COMPRIMIDO
";"ZOPICLONA 7,5 MG COMPRIMIDO
";3000;Comprimido;CLP;24;0;0;0.0;72000;30 dias contra la recepcion conforme de la factura
43498847;2085-199-SE21;http://www.mercadopublico.cl/PurchaseOrder/Modules/PO/DetailsPurchaseOrder.aspx?codigoOC=2085-199-SE21;MEDICAMENTOS Marzo 2021;"CONVENIO DE SUMINISTRO DE MEDICAMENTOS PARA EL HOS DESDE 2085-30-LQ20
MEDICAMENTOS Marzo 2021";SE;Proveniente de licitación pública;No;No;8;SE;Sin emisión automática;12;Recepcion Conforme;7;Recepcion Conforme;2021-03-02;2021-03-03;2021-03-02;2021-03-02;2021-03-04;;1;3,69354838709677;62;323641,92;CLP;323641,92;51673,92;IVA;0;0;271968;3080;61.602.226-1;Hospital Traiguén;7384;SERVICIO DE SALUD ARAUCANIA HOSPITAL DE TRAIGUEN;Salud;HOSPITALES Y CLINICAS;Traiguén;Región de la Araucanía ;CL;261744;76.830.090-9;Caribean Pharma Ltda;256360;FARMACEUTICA CARIBEAN LTDA;VENTA AL POR MAYOR DE ARTICULOS DE PERFUMERIA, COS;Renca;Región Metropolitana de Santiago;Chile;;19;CL;7;2;2085-30-LQ20;;115427868.0;51141800.0;Medicamentos y productos farmacéuticos / Medicamentos para el sistema nervioso central / Hipnóticos;51141810.0;Zopiclona;Medicamentos y productos farmacéuticos;Medicamentos para el sistema nervioso central;Hipnóticos;CM	ZOPICLONA CM 7,5  MG;MIN0215 ZOPICLONA 7,5  COMP. CAJA X1000 B  Entrega 24-48 HR ZOPICLONA F-12586 MINTLAB  VENC. 31-10-2022   ;10000;Unidad;CLP;23;0;0;0.0;230000;30 dias contra la recepcion conforme de la factura
43501968;1058001-141-SE21;http://www.mercadopublico.cl/PurchaseOrder/Modules/PO/DetailsPurchaseOrder.aspx?codigoOC=1058001-141-SE21;Zopiclona 7,5 Mg ;"Incluir al Momento de la Facturación
1. Campo 801 Folio de Referencia"" informar OC sin anteponer números ni palabras : xxxxxxx-xx-xx21
2.-Enviar archivo XML a la casilla de intercambio: dipresrecepcion@custodium.com";SE;Proveniente de licitación pública;No;No;8;SE;Sin emisión automática;12;Recepcion Conforme;7;Recepcion Conforme;2021-03-03;2021-03-03;2021-03-03;2021-03-03;2021-03-03;;1;3,27027027027027;37;273700;CLP;273700;43700;IVA;0;0;230000;1058001;61.602.229-6;Fármarcos;7288;SERVICIO SALUD ARAUCANIA NORTE HOSPITAL VICTORIA;Salud;Servicio Público;Victoria;Región de la Araucanía ;CL;275627;76.956.140-4;ETHON PHARMACEUTICALS SPA.;269948;ETHON PHARMACEUTICALS  COMERCIALIZADORA  IMP EXP Y DIST SPA;VENTA AL POR MAYOR DE ARTICULOS DE PERFUMERIA, COS;Rancagua;Región del Libertador General Bernardo O´Higgins;Chile;;19;CL;7;39;1058001-3-LQ20;;115436845.0;42171900.0;Equipamiento y suministros médicos / Artículos médicos para urgencias y atención en terreno / Contenedores de almacenaje para servicios médicos de urgencia;42171903.0;Cajas de medicamentos de servicios médicos de urge;Equipamiento y suministros médicos;Artículos médicos para urgencias y atención en terreno;Contenedores de almacenaje para servicios médicos de urgencia;ZPCL07.5COMP. BE ZOPICLONA 7.5MG X 1000 COMP.REC.. MINTLAB. ZOPICLONA. REG ISP F-12586 - VTO 10-2021 - LOTE J190754 Entrega en 24 horas. Se adjunta ISP, CANJE y anexos tÃ©cnicos. Validez de la oferta 60 dÃ­as. Sin costo por flete. Monto mÃ­nimo de despach;ZOPLICONA CM O CM RECUBIERTOS 7,5 MG;10000;Unidad no definida;CLP;23;0;0;0.0;230000;Otro, Ver Instrucciones
43506532;2669-123-AG21;http://www.mercadopublico.cl/PurchaseOrder/Modules/PO/DetailsPurchaseOrder.aspx?codigoOC=2669-123-AG21;COMPRA AGIL - PTR N°S-91 DEL 22.02.2021 - ADQUISICION DE MEDICAMENTOS CORRESPONDIENTE A LA CANASTA DEL PROGRAMA DE SALUD MENTAL ;COORDINAR ENTREGA CON SR. ALEX BACIGALUPO AL FONO 227561136 O EMAIL: ABACIGALUPO@VITACURA.CL O AL SR. JOHNNY VALLADARES AL FONO 227561177 - SE RECEPCIONA SOLO CON GUIA DE DESPACHO Y COPIA DE O/C., ACEPTAR O/C EN EL PORTAL MERCADO PÚBLICO. RECEPCIÓN DE FAC;AG;Adquisición igual o inferior a 30 UTM (Debe presentar 3 cotizaciones);Si;Si;13;AG;Compra Ágil;6;Aceptada;4;Aceptada;2021-03-03;2021-03-08;2021-03-08;2021-03-08;2021-03-08;;1;3,8375;16;297500;CLP;297500;47500;IVA;0;0;250000;3658;69.255.600-3;SALUD;98462;I MUNICIPALIDAD DE VITACURA;Municipalidades;-;Vitacura;Región Metropolitana de Santiago;CL;26581;91.637.000-8;LABORATORIOS RECALCINE S.A;26786;LABORATORIOS RECALCINE SA;FABRICACION DE PRODUCTOS FARMACEUTICOS, SUSTANCIAS;Providencia;Región Metropolitana de Santiago;Chile;OP N°30/123;19;CL;7;2;;;115449595.0;51141800.0;Medicamentos y productos farmacéuticos / Medicamentos para el sistema nervioso central / Hipnóticos;51141810.0;Zopiclona;Medicamentos y productos farmacéuticos;Medicamentos para el sistema nervioso central;Hipnóticos;ESZOPICLONA 3MG, COMPRIMIDOS.;;2500;Comprimido;CLP;100;0;0;0.0;250000;30 dias contra la recepcion conforme de la factura
43507643;1514-679-SE21;http://www.mercadopublico.cl/PurchaseOrder/Modules/PO/DetailsPurchaseOrder.aspx?codigoOC=1514-679-SE21;ORDEN DE COMPRA DESDE 1514-25-LQ20	;"CONVENIO DE SUMINISTRO DE MEDICAMENTOS PARA EL SERVICIO DE SALUD MENTAL Y PSIQUIATRIA DESDE 1514-25-LQ20
Se requiere comprar medicamentos según programación farmacia 2020
Ítem 22-04-004-001.02
De conformidad con el Art.3 Nº 2, de la Ley 19.983, el Hos";SE;Proveniente de licitación pública;No;No;8;SE;Sin emisión automática;12;Recepcion Conforme;7;Recepcion Conforme;2021-03-03;2021-03-05;2021-03-03;2021-03-03;2021-03-05;;1;3,8375;16;267750;CLP;267750;42750;IVA;0;0;225000;2510;61.602.275-k;Hospital de Castro;16223;SERVICIO DE SALUD CHILOE;Salud;Hospitales y Clinicas;Castro;Región de los Lagos ;CL;26581;91.637.000-8;LABORATORIOS RECALCINE S.A;26786;LABORATORIOS RECALCINE SA;FABRICACION DE PRODUCTOS FARMACEUTICOS, SUSTANCIAS;Providencia;Región Metropolitana de Santiago;Chile;928;19;CL;7;48;1514-25-LQ20;;115452840.0;51141600.0;Medicamentos y productos farmacéuticos / Medicamentos para el sistema nervioso central / Antidepresivos;51141619.0;Clorhidrato de sertralina;Medicamentos y productos farmacéuticos;Medicamentos para el sistema nervioso central;Antidepresivos;"ESZOPICLONA CM 3 MG
";"881851 VALNOC COMP. REC. 3 MG X 30
REGISTRO ISP F-1673518
";3000;Comprimido;CLP;75;0;0;0.0;225000;
