43509995;948356-645-SE21;http://www.mercadopublico.cl/PurchaseOrder/Modules/PO/DetailsPurchaseOrder.aspx?codigoOC=948356-645-SE21;ETHON PHARMACEUTICALS COMERCIALIZADORA IMP EXP Y D;Despacho Inmediato ;SE;Proveniente de licitación pública;No;No;8;SE;Sin emisión automática;12;Recepcion Conforme;7;Recepcion Conforme;2021-03-04;2021-03-04;2021-03-04;2021-03-04;2021-03-04;;1;3,27027027027027;37;80920;CLP;80920;12920;IVA;0;0;68000;948356;61.513.003-6;Unidad de Compras Fármacos y Reactivos;220665;FONDO HOSPITAL DE LA DIRECCION DE PREVISION DE CARABINEROS DE CHILE;FFAA;;Las Condes;Región Metropolitana de Santiago;CL;275627;76.956.140-4;ETHON PHARMACEUTICALS SPA.;269948;ETHON PHARMACEUTICALS  COMERCIALIZADORA  IMP EXP Y DIST SPA;VENTA AL POR MAYOR DE ARTICULOS DE PERFUMERIA, COS;Rancagua;Región del Libertador General Bernardo O´Higgins;Chile;13416;19;CL;7;2;948356-2-LE19;;115458970.0;51141800.0;Medicamentos y productos farmacéuticos / Medicamentos para el sistema nervioso central / Hipnóticos;51141810.0;Zopiclona;Medicamentos y productos farmacéuticos;Medicamentos para el sistema nervioso central;Hipnóticos;"ZOPICLONA COMP. 7.5 MG HOSDIP AA4221
";"ZOPICLONA COMP. 7.5 MG HOSDIP AA4221
";2000;Comprimido;CLP;34;0;0;0.0;68000;30 dias contra la recepcion conforme de la factura
43511773;2780-254-SE21;http://www.mercadopublico.cl/PurchaseOrder/Modules/PO/DetailsPurchaseOrder.aspx?codigoOC=2780-254-SE21;COMPRA DE MEDICAMENTOS PARA FARMACIA POPULAR DE VALLE HERMOSO;COMPRA DE FARMACOS FARMACIA POPULAR VALLE HERMOSO DESDE 2780-23-L121;SE;Proveniente de licitación pública;No;No;8;SE;Sin emisión automática;6;Aceptada;4;Aceptada;2021-03-04;2021-03-04;2021-03-04;2021-03-04;2021-03-04;;1;3,69354838709677;62;151677,4;CLP;151677,4;24217,4;IVA;0;0;127460;3769;69.050.100-7;DEPARTAMENTO DE SALUD MUNICIPAL;100648;I MUNICIPALIDAD DE LA LIGUA;Municipalidades;VENTA AL POR MAYOR DE OTROS PRODUCTOS N.C.P.| COMPRA, VENTA Y ALQUILER (EXCEPTO AMOBLADOS) DE INMUEBLES PROPIOS O AR| OTRAS ACTIVIDADES EMPRESARIALES N.C.P.| GOBIERNO CENTRAL;La Ligua;Región de Valparaíso ;CL;261744;76.830.090-9;Caribean Pharma Ltda;256360;FARMACEUTICA CARIBEAN LTDA;VENTA AL POR MAYOR DE ARTICULOS DE PERFUMERIA, COS;Renca;Región Metropolitana de Santiago;Chile;;19;CL;7;2;2780-23-L121;;115464059.0;42171900.0;Equipamiento y suministros médicos / Artículos médicos para urgencias y atención en terreno / Contenedores de almacenaje para servicios médicos de urgencia;42171903.0;Cajas de medicamentos de servicios médicos de urgencia;Equipamiento y suministros médicos;Artículos médicos para urgencias y atención en terreno;Contenedores de almacenaje para servicios médicos de urgencia;ZOPICLONA 7.5 MG X 1000 COMP. REC;MIN0215 ZOPICLONA 7,5  COMP. CAJA X1000 B  Entrega 24-48 HR ZOPICLONA F-12586 MINTLAB  VENC. 30-11-2022   ;1;Caja;CLP;22000;0;0;0.0;22000;30 dias contra la recepcion conforme de la factura
43512708;525800-87-SE21;http://www.mercadopublico.cl/PurchaseOrder/Modules/PO/DetailsPurchaseOrder.aspx?codigoOC=525800-87-SE21;MEDICAMENTOS PARA LA FARMACIA MUNICIPAL NP N°72;"ADQUISICION DE MEDICAMENTOS PARA LA FARMACIA MUNICIPAL 
DESPACHAR A CALLE SALINAS Nº 1211
HORARIOS DE LUNES A JUEVES DE 09:00 A 17:00 Y VIERNES DE 09:00 A 14:00 hRS
TELEFONO 3232244952";SE;Contratación con titulares de derecho de propiedad intelectual o industrial;Si;No;8;SE;Sin emisión automática;12;Recepcion Conforme;7;Recepcion Conforme;2021-03-04;2021-03-04;2021-03-04;2021-03-04;2021-03-11;;1;4,82222222222222;9;693730,73;CLP;693730,73;110763,73;IVA;0;0;582967;525800;69.050.600-9;Cesfam Segismundo Iturra Taito;100158;I MUNICIPALIDAD DE SAN FELIPE;Municipalidades;GOBIERNO CENTRAL Y ADMINISTRACION PUBLICA| EXPLOTACION DE INSTALACIONES ESPECIALIZADAS PARA PRACTICAS DEPORTIVAS;San Felipe;Región de Valparaíso ;CL;21978;79.802.770-0;Eurofarma Chile S. A.;22491;Eurofarma Chile S. A.;FABRICACION DE PRODUCTOS FARMACEUTICOS, SUSTANCIAS;Cerrillos;Región Metropolitana de Santiago;Chile;;19;CL;7;2;;;115467126.0;51141800.0;Medicamentos y productos farmacéuticos / Medicamentos para el sistema nervioso central / Hipnóticos;51141810.0;Zopiclona;Medicamentos y productos farmacéuticos;Medicamentos para el sistema nervioso central;Hipnóticos;ZOPERIL 7,5 MG ;ZOPERIL 7,5 MG ;133;Unidad no definida;CLP;999;0;0;0.0;132867;30 dias contra la recepcion conforme de la factura
43513753;3251-133-SE21;http://www.mercadopublico.cl/PurchaseOrder/Modules/PO/DetailsPurchaseOrder.aspx?codigoOC=3251-133-SE21;MEDICAMENTOS RECALCINE;ABASTECER BODEGA DE FARMACIA DEL DEPARTAMENTO DE SALUD MUNICIPAL DE PELLUHUE;SE;Proveniente de licitación pública;No;No;8;SE;Sin emisión automática;6;Aceptada;4;Aceptada;2021-03-04;2021-03-04;2021-03-04;2021-03-04;2021-03-04;;1;3,8375;16;535500;CLP;535500;85500;IVA;0;0;450000;4172;69.252.700-3;Departamento de Salud;113978;I MUNICIPALIDAD DE PELLUHUE;Municipalidades;GOBIERNO CENTRAL Y ADMINISTRACION PUBLICA;Pelluhue;Región del Maule ;CL;26581;91.637.000-8;LABORATORIOS RECALCINE S.A;26786;LABORATORIOS RECALCINE SA;FABRICACION DE PRODUCTOS FARMACEUTICOS, SUSTANCIAS;Providencia;Región Metropolitana de Santiago;Chile;presupuesto de salud;19;CL;7;2;3251-18-LP20;;115469260.0;42171900.0;Equipamiento y suministros médicos / Artículos médicos para urgencias y atención en terreno / Contenedores de almacenaje para servicios médicos de urgencia;42171903.0;Cajas de medicamentos de servicios médicos de urge;Equipamiento y suministros médicos;Artículos médicos para urgencias y atención en terreno;Contenedores de almacenaje para servicios médicos de urgencia;Eszopiclona 3mg.;"881851 VALNOC COMP. REC. 3 MG, VENCIMIENTO: 02-10-2022; Plazo de entrega 48 horas hábiles; políticas de canje: cambio de producto 30 días antes y 30 días después de la fecha de vencimiento; Presentación caja 30 comprimidos; valor cotizado es por comp";6000;Unidad no definida;CLP;75;0;0;0.0;450000;30 dias contra la recepcion conforme de la factura
43515005;4769-33-SE21;http://www.mercadopublico.cl/PurchaseOrder/Modules/PO/DetailsPurchaseOrder.aspx?codigoOC=4769-33-SE21;ORDEN DE COMPRA DESDE 4769-3-LE21;Adquisición de Medicamentos CESFAM La Estrella DESDE 4769-3-LE21;SE;Proveniente de licitación pública;No;No;8;SE;Sin emisión automática;6;Aceptada;4;Aceptada;2021-03-04;2021-03-05;2021-03-05;2021-03-05;2021-03-05;;1;4,08;10;157080;CLP;157080;25080;IVA;0;0;132000;5684;69.091.400-K;Departamento Salud;165285;Ilustre Municipalidad de La Estrella;Municipalidades;;La Estrella;Región del Libertador General Bernardo O´Higgins;CL;26897;96.026.000-7;Chemopharma S.A.;27062;CHEMOPHARMA S A;FABRICACION DE PRODUCTOS FARMACEUTICOS, SUSTANCIAS;Santiago;Región Metropolitana de Santiago;Chile;Presupuesto municipal;19;CL;7;2;4769-3-LE21;;115472591.0;51141800.0;Medicamentos y productos farmacéuticos / Medicamentos para el sistema nervioso central / Hipnóticos;51141810.0;Zopiclona;Medicamentos y productos farmacéuticos;Medicamentos para el sistema nervioso central;Hipnóticos;Zopiclona 7,5 mg comprimido;C-PT4741 ZOPICLONA. ZOMETIC 7,5 MG ENV. 30 COMP. (BIOEQUIVALENTE) N° DE REGISTRO ISP:F-8783/16 FECHA DE VENCIMIENTO:31-07-2023;6000;Unidad;CLP;22;0;0;0.0;132000;30 dias contra la recepcion conforme de la factura
43516135;2832-297-SE21;http://www.mercadopublico.cl/PurchaseOrder/Modules/PO/DetailsPurchaseOrder.aspx?codigoOC=2832-297-SE21;COMPRA MEDICAMENTOS FARMACIA COMUNAL, LIC. 2832-14-LR20;COMPRA MEDICAMENTOS FARMACIA COMUNAL POR CONVENIO DE SUMINISTRO 2832-14-LR20;SE;Proveniente de licitación pública;No;No;8;SE;Sin emisión automática;12;Recepcion Conforme;7;Recepcion Conforme;2021-03-04;2021-03-11;2021-03-11;2021-03-12;2021-03-11;;1;3,8375;16;20026986;CLP;20026986;3197586;IVA;0;0;16829400;3818;69.260.400-8;DEPARTAMENTO DE SALUD;88203;I MUNICIPALIDAD DE QUILLOTA;Municipalidades;MUNICIPALIDADES;Quillota;Región de Valparaíso ;CL;26581;91.637.000-8;LABORATORIOS RECALCINE S.A;26786;LABORATORIOS RECALCINE SA;FABRICACION DE PRODUCTOS FARMACEUTICOS, SUSTANCIAS;Providencia;Región Metropolitana de Santiago;Chile;2152204004001;19;CL;7;2;2832-14-LR20;;115476300.0;51141800.0;Medicamentos y productos farmacéuticos / Medicamentos para el sistema nervioso central / Hipnóticos;51141810.0;Zopiclona;Medicamentos y productos farmacéuticos;Medicamentos para el sistema nervioso central;Hipnóticos;eszopiclona 2mg comprimidos recubiertos ;VALNOC COMP. REC. 2 MG, ;1500;Comprimido;CLP;80;0;0;0.0;120000;30 dias contra la recepcion conforme de la factura
43518095;4779-162-AG21;http://www.mercadopublico.cl/PurchaseOrder/Modules/PO/DetailsPurchaseOrder.aspx?codigoOC=4779-162-AG21;SSA - Eszopiclona 3mg comprimido - Marzo 2021;"Reposición y refuerzo stock medicamento del arsenal farmacológico, bodega farmacia. No llegó a través de Intermediación Cenabast mes de Febrero 2021.
Adjunto cotizaciones.
ESTA ORDEN DE COMPRA TIENE UNA VALIDEZ MÁXIMA DE 40 DIAS, DE ACUERDO A ANEXO EXPL";AG;Adquisición igual o inferior a 30 UTM (Debe presentar 3 cotizaciones);Si;Si;13;AG;Compra Ágil;12;Recepcion Conforme;7;Recepcion Conforme;2021-03-05;2021-03-11;2021-03-10;2021-03-10;2021-03-11;;1;0;0;142800;CLP;142800;22800;IVA;0;0;120000;5694;61.602.280-6;Bodega Farmacia HR Coyhaique;7340;SERVICIO NACIONAL DE SALUD HOSPITAL DE C;Salud;HOSPITALES Y CLINICAS;Coyhaique;Región Aysén del General Carlos Ibáñez del Campo;CL;951192;76.453.466-2;GADORPHARMA SPA;1544085;GADORPHARMA SPA;COMERCIALIZACIÓN DE PRODUCTOS FARMACÉUTICOS;;;;;19;CL;20;2;;;115481785.0;51141800.0;Medicamentos y productos farmacéuticos / Medicamentos para el sistema nervioso central / Hipnóticos;51141810.0;Zopiclona;Medicamentos y productos farmacéuticos;Medicamentos para el sistema nervioso central;Hipnóticos;ESZOPICLONA 3 MG COMPRIMIDO.;ESZOPICLONA 3 MG COMPRIMIDO.;1200;Comprimido;CLP;100;0;0;0.0;120000;30 dias contra la recepcion conforme de la factura
43518357;2381-309-SE21;http://www.mercadopublico.cl/PurchaseOrder/Modules/PO/DetailsPurchaseOrder.aspx?codigoOC=2381-309-SE21;ORDEN DE COMPRA DESDE 2381-10-LE21;ADQUISICIÓN SEGUNDA COMPRA 2021 DE FARMACOS, SUPLE DESDE 2381-10-LE21;SE;Proveniente de licitación pública;No;No;8;SE;Sin emisión automática;6;Aceptada;4;Aceptada;2021-03-05;2021-03-05;2021-03-05;2021-03-05;2021-03-05;;1;4,8;4;89392,8;CLP;89392,8;14272,8;IVA;0;0;75120;3373;69.030.200-4;DEPARTAMENTO DE ADQUISICIONES DASM;86872;I MUNICIPALIDAD DE COPIAPO;Municipalidades;EMPRESAS DE PUBLICIDAD| GOBIERNO CENTRAL;Copiapó;Región de Atacama ;CL;658977;76.167.536-2;Medikar Ltda;1261270;Comercializadora Medikar Ltda;VENTA AL POR MAYOR DE PRODUCTOS FARMACEUTICOS| VEN;San Felipe;Región de Valparaíso ;Chile;;19;CL;7;2;2381-10-LE21;;115482492.0;42171900.0;Equipamiento y suministros médicos / Artículos médicos para urgencias y atención en terreno / Contenedores de almacenaje para servicios médicos de urgencia;42171903.0;Cajas de medicamentos de servicios médicos de urgencia;Equipamiento y suministros médicos;Artículos médicos para urgencias y atención en terreno;Contenedores de almacenaje para servicios médicos de urgencia;LOSOPRIL 7.5 MG X 30;ZOPERIL 7,5 MG®, ZOPICLONA, Envase de: 30 COMPRIMIDO, EUROMED, Reg.ISP: F-16990, Vence: 2023-05-31.  .......ALTERNATIVA EN GENERICO................;30;Caja;CLP;1275;0;0;0.0;38250;30 dias contra la recepcion conforme de la factura
43521052;1057532-382-SE21;http://www.mercadopublico.cl/PurchaseOrder/Modules/PO/DetailsPurchaseOrder.aspx?codigoOC=1057532-382-SE21;Convenio de medicamentos Compra Cosam Rahue;"Compra de medicamentos para Cosam Rahue
NOTA: NO SE PODRÁ EMITIR FACTURA SIN PREVIA RECEPCIÓN CONFORME DE O/C. //LA FACTURA DEBE INDICAR EL NÚMERO
DE O/C ASOCIADA.
DEBERAN: ENVIAR LOS DOCUMENTOS MERCANTILES EN ARCHIVO XLMS Y PDF AL CORREO 
dipresrecep";SE;Proveniente de licitación pública;No;No;8;SE;Sin emisión automática;12;Recepcion Conforme;7;Recepcion Conforme;2021-03-05;2021-03-05;2021-03-05;2021-03-05;2021-03-05;;1;3,69354838709677;62;152796;CLP;152796;24396;IVA;0;0;128400;1057532;61.607.600-0;Bienes y Servicios;7296;SERVICIO DE SALUD OSORNO;Salud;Servicio Público;Osorno;Región de los Lagos ;CL;261744;76.830.090-9;Caribean Pharma Ltda;256360;FARMACEUTICA CARIBEAN LTDA;VENTA AL POR MAYOR DE ARTICULOS DE PERFUMERIA, COS;Renca;Región Metropolitana de Santiago;Chile;;19;CL;7;48;1057532-89-LE20;;115489813.0;73101700.0;Servicios de producción y fabricación industrial / Industrias de plásticos y productos químicos / Producción farmacéutica;73101701.0;Servicios de producción de medicamentos o medicina;Servicios de producción y fabricación industrial;Industrias de plásticos y productos químicos;Producción farmacéutica;ESZOPICLONA 3MG COMPRIMIDOS ;ESZOPICLONA 3MG COMPRIMIDOS ;1200;Comprimido;CLP;107;0;0;0.0;128400;
43524608;2780-269-SE21;http://www.mercadopublico.cl/PurchaseOrder/Modules/PO/DetailsPurchaseOrder.aspx?codigoOC=2780-269-SE21;COMPRA DE MEDICAMENTOS PARA ABASTECER FARMACIA POPULAR LA LIGUA;COMPRA MEDICAMENTOS FARMACIA POPULAR LA LIGUA DESDE 2780-27-L121;SE;Proveniente de licitación pública;No;No;8;SE;Sin emisión automática;6;Aceptada;4;Aceptada;2021-03-08;2021-03-08;2021-03-08;2021-03-08;2021-03-08;;1;3,28888888888889;9;204459,85;CLP;204459,85;32644,85;IVA;0;0;171815;3769;69.050.100-7;DEPARTAMENTO DE SALUD MUNICIPAL;100648;I MUNICIPALIDAD DE LA LIGUA;Municipalidades;VENTA AL POR MAYOR DE OTROS PRODUCTOS N.C.P.| COMPRA, VENTA Y ALQUILER (EXCEPTO AMOBLADOS) DE INMUEBLES PROPIOS O AR| OTRAS ACTIVIDADES EMPRESARIALES N.C.P.| GOBIERNO CENTRAL;La Ligua;Región de Valparaíso ;CL;822399;76.237.266-5;LABORATORIOS ANDROMACO S.A.;1418939;LABORATORIOS ANDROMACO S.A.;FARMACEUTICO;Peñalolén;Región Metropolitana de Santiago;Chile;;19;CL;7;2;2780-27-L121;;115497722.0;42171900.0;Equipamiento y suministros médicos / Artículos médicos para urgencias y atención en terreno / Contenedores de almacenaje para servicios médicos de urgencia;42171903.0;Cajas de medicamentos de servicios médicos de urgencia;Equipamiento y suministros médicos;Artículos médicos para urgencias y atención en terreno;Contenedores de almacenaje para servicios médicos de urgencia;ESZOPICLONA 2 MG COMP;22100237 NOPTIC COM RECUBIERTO - ESZOPLICONA 2 MG - CAJA X 30 COM., CAJA X 30, REGISTRO ISP F-16723/18, FECHA VENCIMIENTO 30-09-2023, DESPACHO EN 48 HRS;10;Caja;CLP;4907;0;0;0.0;49070;30 dias contra la recepcion conforme de la factura
43525236;4463-369-SE21;http://www.mercadopublico.cl/PurchaseOrder/Modules/PO/DetailsPurchaseOrder.aspx?codigoOC=4463-369-SE21;ORDEN DE COMPRA DESDE 4463-3-LQ20;"Contrato de Suministro de Medicamentos en Comprimidos I

**PROGRAMACIÓN MEDICAMENTOS MARZO 2021**
OBSERVACIONES:
Favor despachar a BODEGA CENTRAL DE MEDICAMENTOS, dirección Chacabuco N° 121 en horario de 08:30 a 16:30 horas. 
Será obligación del Prov";SE;Proveniente de licitación pública;No;No;8;SE;Sin emisión automática;12;Recepcion Conforme;7;Recepcion Conforme;2021-03-08;2021-03-09;2021-03-08;2021-03-08;2021-03-09;;1;3,8375;16;326298;CLP;326298;52098;IVA;0;0;274200;5379;61.606.903-9;Farmacia;7452;SERVICIO DE SALUD DEL MAULE HOSPITAL DE CURICO;Salud;HOSPITALES Y CLINICAS;Curicó;Región del Maule ;CL;26581;91.637.000-8;LABORATORIOS RECALCINE S.A;26786;LABORATORIOS RECALCINE SA;FABRICACION DE PRODUCTOS FARMACEUTICOS, SUSTANCIAS;Providencia;Región Metropolitana de Santiago;Chile;;19;CL;7;48;4463-3-LQ20;;115500227.0;51141800.0;Medicamentos y productos farmacéuticos / Medicamentos para el sistema nervioso central / Hipnóticos;51141810.0;Zopiclona;Medicamentos y productos farmacéuticos;Medicamentos para el sistema nervioso central;Hipnóticos;40400100032 ESZOPLICONA 3 MG;"881851 VALNOC COMP. REC. 3 MG, VENCIMIENTO: 02-04-
2024; Plazo de entrega 48 horas hábiles; políticas de canje:
cambio de producto 30 días antes y 30 días después de la fecha de vencimiento; Presentación caja 30 comprimidos; valor cotizado es por c";3000;Comprimido;CLP;54;0;0;0.0;162000;
43525759;3178-961-SE21;http://www.mercadopublico.cl/PurchaseOrder/Modules/PO/DetailsPurchaseOrder.aspx?codigoOC=3178-961-SE21;ADQUISICIÓN  DESDE  LICITACIÓN  ID- 5839-3-LR18;"SE SOLICITA QUE LOS PRODUCTOS VENGAN CON UN MÍNIMO DE 18 MESES DE VENCIMIENTO CON FACTURA, FLETE PAGADO Y PUESTO 
EN BODEGA DEL HOSPITAL. 

I M P O R T A N T E:
NO SE CURSARÁ EL PAGO DE LA PRESENTE ORCOM MIENTRAS ESTA NO HAYA SIDO ACEPTADA POR EL PROV";SE;Proveniente de licitación pública;No;No;8;SE;Sin emisión automática;12;Recepcion Conforme;7;Recepcion Conforme;2021-03-08;2021-03-08;2021-03-08;2021-05-24;2021-03-09;;1;3,8375;16;84966;CLP;84966;13566;IVA;0;0;71400;4099;61.102.025-2;HOSPITAL NAVAL ALMIRANTE ADRIAZOLA;111875;DIRECCION DE ABASTECIMIENTO DE LA ARMADA;FFAA;HOSPITALES Y CLINICAS;Talcahuano;Región del Biobío ;CL;26581;91.637.000-8;LABORATORIOS RECALCINE S.A;26786;LABORATORIOS RECALCINE SA;FABRICACION DE PRODUCTOS FARMACEUTICOS, SUSTANCIAS;Providencia;Región Metropolitana de Santiago;Chile;2204004000;19;CL;7;2;5839-3-LR18;;115500807.0;73101700.0;Servicios de producción y fabricación industrial / Industrias de plásticos y productos químicos / Producción farmacéutica;73101701.0;Servicios de producción de medicamentos o medicina;Servicios de producción y fabricación industrial;Industrias de plásticos y productos químicos;Producción farmacéutica;ESZOPICLONA 2 MG   GRA.;ESZOPICLONA 2 MG   GRA.;1020;Gragea;CLP;70;0;0;0.0;71400;30 dias contra la recepcion conforme de la factura
43527487;2284-247-SE21;http://www.mercadopublico.cl/PurchaseOrder/Modules/PO/DetailsPurchaseOrder.aspx?codigoOC=2284-247-SE21;ORDEN DE COMPRA DESDE 2284-29-L121 MEDICAMENTOS DESTINADOS A LA ILUSTRE MUNICIPALIDAD DE VALDIVIA. SOLICITUD 32079;"ORDEN DE COMPRA DESDE 2284-29-L121 MEDICAMENTOS DESTINADOS A LA ILUSTRE MUNICIPALIDAD DE VALDIVIA. SOLICITUD 32079
DEBE ANOTAR EN LA FACTURA:
1- NUMERO DE ORDEN DE COMPRA
2- DATOS PARA PAGO VIA TRANSFERENCIA ELECTRONICA";SE;Proveniente de licitación pública;No;No;8;SE;Sin emisión automática;6;Aceptada;4;Aceptada;2021-03-08;2021-03-08;2021-03-08;2021-03-10;2021-03-09;;1;4,40377358490566;53;119238;CLP;119238;19038;IVA;0;0;100200;3278;69.200.100-1;DPTO. DE SALUD MUNICIPAL DE VALDIVIA;84152;I MUNICIPALIDAD VALDIVIA;Municipalidades;SALUD;Valdivia;Región de Los Ríos;CL;106395;77.596.940-7;LABORATORIO CHILE S.A.;103860;LABORATORIO CHILE S A;FABRICACION DE PRODUCTOS FARMACEUTICOS, SUSTANCIAS;Ñuñoa;Región Metropolitana de Santiago;Chile;;19;CL;7;2;2284-29-L121;;115505456.0;51102300.0;Medicamentos y productos farmacéuticos / Medicamentos anti infecciosos / Medicamentos antivirales;51102301.0;Aciclovir;Medicamentos y productos farmacéuticos;Medicamentos anti infecciosos;Medicamentos antivirales;"ESZOPICLONA 3MG CM REC
COMPRIMIDO O CAPSULA
";"ESZOPICLONA 3MG CM REC
COMPRIMIDO O CAPSULA
";600;Comprimido;CLP;107;0;0;0.0;64200;30 dias contra la recepcion conforme de la factura
43536433;2565-117-SE21;http://www.mercadopublico.cl/PurchaseOrder/Modules/PO/DetailsPurchaseOrder.aspx?codigoOC=2565-117-SE21;Medicamentos farmacia ;"CONTRATO SUMINISTRO MEDICAMENTOS CESFAM CHEPICA DESDE 2565-3-LP19.
SOLICITA .NATALIA SEGUEL TOLEDO  QUIMICO FARMACEUTICO CESFAM 

esta compra se financia con recursos asociados a la subvención a farmacias municipales y atención primaria, proyecto enm";SE;Proveniente de licitación pública;No;No;8;SE;Sin emisión automática;6;Aceptada;4;Aceptada;2021-03-09;2021-03-09;2021-03-09;2021-03-09;2021-03-17;;1;3,27027027027027;37;2754374;CLP;2754374;439774;IVA;0;0;2314600;3556;69.090.700-3;DEPTO. DE SALUD;92414;I MUNICIPALIDAD DE CHEPICA;Municipalidades;GOBIERNO CENTRAL Y ADMINISTRACION PUBLICA;Chépica;Región del Libertador General Bernardo O´Higgins;CL;275627;76.956.140-4;ETHON PHARMACEUTICALS SPA.;269948;ETHON PHARMACEUTICALS  COMERCIALIZADORA  IMP EXP Y DIST SPA;VENTA AL POR MAYOR DE ARTICULOS DE PERFUMERIA, COS;Rancagua;Región del Libertador General Bernardo O´Higgins;Chile;2152204004001;19;CL;7;2;2565-3-LP19;;115531169.0;51141800.0;Medicamentos y productos farmacéuticos / Medicamentos para el sistema nervioso central / Hipnóticos;51141810.0;Zopiclona;Medicamentos y productos farmacéuticos;Medicamentos para el sistema nervioso central;Hipnóticos;ZOPICLONA 7.5 MG COMPRIMIDOS ;;11000;Unidad no definida;CLP;28;0;0;0.0;308000;30 dias contra la recepcion conforme de la factura
43536986;1058100-35-SE21;http://www.mercadopublico.cl/PurchaseOrder/Modules/PO/DetailsPurchaseOrder.aspx?codigoOC=1058100-35-SE21;Compra de medicamento;"compra de medicamentos  con ID-1058101-2-LR20 con resolucion N°579 del 05/02/2021, con Solicitud de compra N° 136  del 05/3/2021 por Quimico
Requisitos al momento de emitir la factura: Orden de compra en estado aceptada por el proveedor en Mercado Públic";SE;Proveniente de licitación pública;No;No;8;SE;Sin emisión automática;12;Recepcion Conforme;7;Recepcion Conforme;2021-03-09;2021-03-09;2021-03-09;2021-03-09;2021-03-09;;1;3,8375;16;32130;CLP;32130;5130;IVA;0;0;27000;1058100;61.602.194-K;Fármarcos;7285;SERVICIO NACIONAL DE SALUD HOSPITAL DE COELEMU;Salud;Servicio Público;Coelemu;Región del Ñuble;CL;26581;91.637.000-8;LABORATORIOS RECALCINE S.A;26786;LABORATORIOS RECALCINE SA;FABRICACION DE PRODUCTOS FARMACEUTICOS, SUSTANCIAS;Providencia;Región Metropolitana de Santiago;Chile;;19;CL;7;48;;;115532642.0;51141800.0;Medicamentos y productos farmacéuticos / Medicamentos para el sistema nervioso central / Hipnóticos;51141808.0;Tartrato de zolpidem;Medicamentos y productos farmacéuticos;Medicamentos para el sistema nervioso central;Hipnóticos;;"Eszopiclona 3 mg	Comp.
";300;Unidad no definida;CLP;90;0;0;0.0;27000;
43537028;362-194-SE21;http://www.mercadopublico.cl/PurchaseOrder/Modules/PO/DetailsPurchaseOrder.aspx?codigoOC=362-194-SE21;ESZOPICLONA;CONVENIO MEDICAMENTOS E INSUMOS DESDE 362-16-LE20;SE;Proveniente de licitación pública;No;No;8;SE;Sin emisión automática;12;Recepcion Conforme;7;Recepcion Conforme;2021-03-09;2021-03-09;2021-03-09;2021-03-09;2021-03-09;;1;3,8375;16;235620;CLP;235620;37620;IVA;0;0;198000;1359;61.606.915-2;H_Chanco;7279;SERVICIO DE SALUD DEL MAULE HOSPITAL DE;Salud;;Chanco;Región del Maule ;CL;26581;91.637.000-8;LABORATORIOS RECALCINE S.A;26786;LABORATORIOS RECALCINE SA;FABRICACION DE PRODUCTOS FARMACEUTICOS, SUSTANCIAS;Providencia;Región Metropolitana de Santiago;Chile;;19;CL;7;2;362-16-LE20;;115532574.0;42171900.0;Equipamiento y suministros médicos / Artículos médicos para urgencias y atención en terreno / Contenedores de almacenaje para servicios médicos de urgencia;42171903.0;Cajas de medicamentos de servicios médicos de urgencia;Equipamiento y suministros médicos;Artículos médicos para urgencias y atención en terreno;Contenedores de almacenaje para servicios médicos de urgencia;eszopiclona 3mg;eszopiclona 3mg;1980;Comprimido;CLP;100;0;0;0.0;198000;30 dias contra la recepcion conforme de la factura
43539791;1057055-315-SE21;http://www.mercadopublico.cl/PurchaseOrder/Modules/PO/DetailsPurchaseOrder.aspx?codigoOC=1057055-315-SE21;GSP INT 1351/2019 1057055-94-LQ19 PAC ADQUISICION ESZOPICLONA 3 MG;"GSP INT 1351/2019 1057055-94-LQ19 PAC ADQUISICION ESZOPICLONA 3 MG

PLC (1057055-1-PC21)

DESPACHO SERA COORDINADO MEDIANTE CORREO ELECTRÓNICO. 

CUALQUIER CONSULTA COMUNICARSE AL FONO: 25749286 O AL CORREO ELECTRÓNICO gerardo.silvap@redsalud.gob.cl";SE;Proveniente de licitación pública;No;No;8;SE;Sin emisión automática;12;Recepcion Conforme;7;Recepcion Conforme;2021-03-10;2021-03-10;2021-03-10;2021-03-10;2021-07-28;;1;4,2;1;21527,1;CLP;21527,1;3437,1;IVA;0;0;18090;1057055;61.608.604-9;Fármacos;7326;SERV SALUD METROPOLITANO CENTRAL HOSPITAL CLINICO SAN BORJA ARRIARAN;Salud;Adquisición de Fármacos;Santiago Centro;Región Metropolitana de Santiago;CL;854608;76.437.991-8;Seven Pharma Chile;1450283;SEVEN PHARMA CHILE SPA;Importadora de productos farmaceuticos;Macul;Región Metropolitana de Santiago;Chile;;19;CL;7;48;1057055-94-LQ19;;115539503.0;73101700.0;Servicios de producción y fabricación industrial / Industrias de plásticos y productos químicos / Producción farmacéutica;73101701.0;Servicios de producción de medicamentos o medicinas;Servicios de producción y fabricación industrial;Industrias de plásticos y productos químicos;Producción farmacéutica;214-0006 ESZOPICLONA 3 MG, comprimidos ranurados, blíster, bioequivalente;CL40048 ESZOPICLONA 3 MG  COMPRIMIDOS RECUBIERTOS ESTUCHE 1X30S HDP-BOT EQUIVALENTE TERAPÉUTICO PROCEDENTE  HETERO LABS LIMITED UNIT-V  INDIA IMPORTADO Y DISTRIBUIDO POR SEVEN PHARMA CHILE S.P.A. OFERTA NO REQUIERE MONTO MINIMO DE FACTURACION, STOCK VIGEN;270;Unidad;CLP;67;0;0;0.0;18090;
43540316;1058128-415-SE21;http://www.mercadopublico.cl/PurchaseOrder/Modules/PO/DetailsPurchaseOrder.aspx?codigoOC=1058128-415-SE21;pedido Hospital Puerto Montt;"ID 1057536-38-R120
reposicion km

despachar vencimiento superior a 12 meses";SE;Proveniente de licitación pública;No;No;8;SE;Sin emisión automática;12;Recepcion Conforme;7;Recepcion Conforme;2021-03-10;2021-03-12;2021-03-10;2021-03-18;2021-03-12;;1;3,8375;16;119952;CLP;119952;19152;IVA;0;0;100800;1058128;61.975.100-0;Fármarcos;127018;HOSPITAL PUERTO MONTT SERVICIO DE SALUD DEL RELONCAVI;Salud;Servicio Público;Puerto Montt;Región de los Lagos ;CL;26581;91.637.000-8;LABORATORIOS RECALCINE S.A;26786;LABORATORIOS RECALCINE SA;FABRICACION DE PRODUCTOS FARMACEUTICOS, SUSTANCIAS;Providencia;Región Metropolitana de Santiago;Chile;3817;19;CL;7;48;;;115540651.0;51141800.0;Medicamentos y productos farmacéuticos / Medicamentos para el sistema nervioso central / Hipnóticos;51141810.0;Zopiclona;Medicamentos y productos farmacéuticos;Medicamentos para el sistema nervioso central;Hipnóticos;"1141101	ESZOPICLONA 3 MG
";"881851 (VALNOC COMP. REC. 3 MG X 30 (BRU)), VENCIMIENTO: 03-01-2024  
";1200;Comprimido;CLP;54;0;0;0.0;64800;
