50927976;1069417-1171-SE24;http://www.mercadopublico.cl/PurchaseOrder/Modules/PO/DetailsPurchaseOrder.aspx?codigoOC=1069417-1171-SE24;COMPRA DE MEDICAMENTOS PARA COSAM CHILLAN;"SOLICITUD Nº: 9
Nº DE PRE-OBLIGACION: 783
SS: 8481
_______________________________
FACTURAR AL RUT: 69.270.200-K
CON CARGO A CUENTA 2152204004001, CdeC:
COSAM 010111:$ 12.452.755
DESPACHAR A POBLACION VILLA KENNEDY, PJE 9, CASA 23, CHILLAN
PLAZO DE ENTREGA: 03 DÍAS HÁBILES, según licitación 1069417-87-LP24, se contará desde el segundo día hábil siguiente a la fecha de envío de la OC a proveedor.

CONSULTA POR PAGO DE FACTURAS 
Orlando Sepulveda Contreras, correo electrónico: orlandosepulveda@daschillan.cl Teléfono 42-2588410
";SE;Proveniente de licitación pública;No;No;8;SE;Sin emisión automática;12;Recepcion Conforme;7;Recepcion Conforme;2024-07-26;2024-07-30;2024-07-29;2024-10-29;2024-08-05;;1;4,40377358490566;53;12452755;CLP;12452755;1988255;IVA;0;0;10464500;1069417;69.270.200-k;Dirección  de Salud Municipal Chillán;88254;I MUNICIPALIDAD DE CHILLAN;Municipalidades;Salud Municipal;Chillán;Región del Ñuble;;106395;77.596.940-7;LABORATORIO CHILE S.A.;103860;LABORATORIO CHILE S A;FABRICACION DE PRODUCTOS FARMACEUTICOS, SUSTANCIAS;Ñuñoa;Región Metropolitana de Santiago;Chile;;19;;7;2.0;1069417-87-LP24;;136849099;51141500.0;Medicamentos y productos farmacéuticos / Medicamentos para el sistema nervioso central / Anticonvulsivos;51141502;Clonazepam;Medicamentos y productos farmacéuticos;Medicamentos para el sistema nervioso central;Anticonvulsivos;ESZOPICLONA COMPRIMIDO 3 MG;;10800;Comprimido;CLP;48;0;0;0.0;518400;30 dias contra la recepcion conforme de la factura
50930141;1058025-34-SE24;http://www.mercadopublico.cl/PurchaseOrder/Modules/PO/DetailsPurchaseOrder.aspx?codigoOC=1058025-34-SE24;LIC-MEDICAMENTOS-B.FARMACIA-22.04.004.001.02- HFCM 26000 (ISM);Adquisición de Fármacos para stock en Bodega Farmacia del HFC Mulchén DESDE 1058025-4-LE24, LIC-MEDICAMENTOS-B.FARMACIA-22.04.004.001.02- HFCM 26000 (ISM), FAVOR DESPÁCHAR EN DIAS INDICADOS EN OFERTA 3 DIAS ;SE;Proveniente de licitación pública;No;No;8;SE;Sin emisión automática;12;Recepcion Conforme;7;Recepcion Conforme;2024-07-26;2024-07-26;2024-07-26;2024-09-17;2024-07-29;;1;4,40377358490566;53;1854020;CLP;1854020;296020;IVA;0;0;1558000;1058025;61.607.302-8;Fármarcos;7434;SERVICIO DE SALUD BIO BIO HOSPITAL DE MULCHEN;Salud;Servicio Público;Mulchén;Región del Biobío ;CL;106395;77.596.940-7;LABORATORIO CHILE S.A.;103860;LABORATORIO CHILE S A;FABRICACION DE PRODUCTOS FARMACEUTICOS, SUSTANCIAS;Ñuñoa;Región Metropolitana de Santiago;Chile;;19;CL;7;2.0;1058025-4-LE24;;136855804;42171900.0;Equipamiento y suministros médicos / Artículos médicos para urgencias y atención en terreno / Contenedores de almacenaje para servicios médicos de urgencia;42171903;Cajas de medicamentos de servicios médicos de urgencia;Equipamiento y suministros médicos;Artículos médicos para urgencias y atención en terreno;Contenedores de almacenaje para servicios médicos de urgencia;"ESZOPICLONA 3 MG [COMPRIMIDO]
";120-10-81153 ESZOPICLONA 3 MG 30 CR REG.ISP F-27519 EQUIVALENTE TERAPEUTICO Eszopiclona 3mg 30 Comprimidos Recubiertos, venc: 30-11-2025, Se adjunta documentacion técnica, certificado de farmacovigilancia, politica de canje, devoluciones y norma GMP. Desp;6000;Comprimido;CLP;48;0;0;0.0;288000;30 dias contra la recepcion conforme de la factura
50933344;2389-555-AG24;http://www.mercadopublico.cl/PurchaseOrder/Modules/PO/DetailsPurchaseOrder.aspx?codigoOC=2389-555-AG24;Orden de Compra generada por invitación a compra ágil: 2389-382-COT24;MEDICAMENTOS PRAPS PALIATIVOS;AG;Adquisición igual o inferior a 30 UTM (Debe presentar 3 cotizaciones);Si;Si;13;AG;Compra Ágil;6;Aceptada;4;Aceptada;2024-07-28;2024-07-30;2024-07-30;2024-07-30;2024-07-31;;1;4,2;1;91392;CLP;91392;14592;IVA;0;0;76800;3381;69.191.600-6;Departamento de Salud;86943;I MUNICIPALIDAD DE PUCON;Municipalidades;VENTA AL POR MENOR DE OTROS PRODUCTOS EN PEQUENOS ALMACENES NO ESPECIA| HOTELES| RESTAURANTES| GOBIERNO CENTRAL| ESTABLECIMIENTOS DE ENSENANZA PRIMARIA;Santiago;Región Metropolitana de Santiago;Extranjero;854608;76.437.991-8;Seven Pharma Chile;1450283;SEVEN PHARMA CHILE SPA;Importadora de productos farmaceuticos;Macul;Región Metropolitana de Santiago;;;19;Extranjero;7;2.0;;;136864598;51141800.0;Medicamentos y productos farmacéuticos / Medicamentos para el sistema nervioso central / Hipnóticos;51141810;Zopiclona;Medicamentos y productos farmacéuticos;Medicamentos para el sistema nervioso central;Hipnóticos;"Eszopiclona 3mg, comprimidos recubiertos.	CONSIDERAR ANEXO DE CONDICIONES PARA OFERTAR
";;960;Unidad;CLP;80;0;0;;76800;30 dias contra la recepcion conforme de la factura
50937090;900-891-AG24;http://www.mercadopublico.cl/PurchaseOrder/Modules/PO/DetailsPurchaseOrder.aspx?codigoOC=900-891-AG24;Compra de medicamentos PRAIS;"Registrar el número de Orden de Compra en el campo de referencia 801 al emitir su factura en la plataforma de SII (sin observaciones adicionales letras, números, signos, espacios etc.) de lo contrario el sistema implementado por la DIPRES el SII y administrado por ACEPTA RECHAZARA el documento al no encontrar una O.C. válidamente emitida.
Siempre debe aceptar la O.C. en el portal www.mercadopublico.cl antes de emitir su factura, al momento de facturar la condición de pago debe ser CREDITO.
Es responsabilidad del proveedor verificar que el DTE esté correctamente aceptado por nuestro hospital. Consultas al correo juan.saavedra.v@redsalud.gob.cl
Respetar horario para despacho: lunes a viernes de 09:00 a 13:00 hrs.   
";AG;Adquisición igual o inferior a 30 UTM (Debe presentar 3 cotizaciones);Si;Si;13;AG;Compra Ágil;12;Recepcion Conforme;7;Recepcion Conforme;2024-07-29;2024-07-30;2024-07-29;2024-07-29;2024-07-31;;1;3,27027027027027;37;1203685;CLP;1203685;192185;IVA;0;0;1011500;1896;61.979.910-0;Hospital Psquiatrico del Salvador;7239;SERVICIO DE SALUD VALPARAISO SAN ANTONIO;Salud;HOSPITALES Y CLINICAS;Valparaíso;Región de Valparaíso ;Extranjero;275627;76.956.140-4;ETHON PHARMACEUTICALS SPA.;269948;ETHON PHARMACEUTICALS  COMERCIALIZADORA  IMP EXP Y DIST SPA;VENTA AL POR MAYOR DE ARTICULOS DE PERFUMERIA, COSMETICOS, JABONES Y P| VENTA AL POR MAYOR DE PRODUCTOS FARMACEUTICOS| VENTA AL POR MAYOR DE PRODUCTOS QUIMICOS;Rancagua;Región del Libertador General Bernardo O´Higgins;;1722;19;Extranjero;7;2.0;;;136875143;73101700.0;Servicios de producción y fabricación industrial / Industrias de plásticos y productos químicos / Producción farmacéutica;73101701;Servicios de producción de medicamentos o medicinas;Servicios de producción y fabricación industrial;Industrias de plásticos y productos químicos;Producción farmacéutica;ESZOPICLONA 3 MG;;500;Comprimido;CLP;127;0;0;;63500;30 dias contra la recepcion conforme de la factura
50944749;2548-868-SE24;http://www.mercadopublico.cl/PurchaseOrder/Modules/PO/DetailsPurchaseOrder.aspx?codigoOC=2548-868-SE24;CONTRATO SUMINISTRO DE MEDICAMENTOS DESDE 2548-6-LR24;"CONTRATO SUMINISTRO DE MEDICAMENTOS DESDE 2548-6-LR24

ACEPTAR ORDEN DE COMPRA ANTES DE FACTURAR.
DESPACHO A AVENIDA MAQUEHUE 1441, PADRE LAS CASAS
FARMACIA MUNICIPAL
";SE;Proveniente de licitación pública;No;No;8;SE;Sin emisión automática;6;Aceptada;4;Aceptada;2024-07-30;2024-07-30;2024-07-30;2024-07-30;2024-07-30;;1;3,27027027027027;37;30273,6;CLP;30273,6;4833,6;IVA;0;0;25440;3539;61.955.000-5;MUNICIPALIDAD DE PADRE LAS CASAS  SALUD;90886;I MUNICIPALIDAD DE PADRE LAS CASAS;Municipalidades;GOBIERNO CENTRAL Y ADMINISTRACION PUBLICA;Padre Las Casas;Región de la Araucanía ;CL;275627;76.956.140-4;ETHON PHARMACEUTICALS SPA.;269948;ETHON PHARMACEUTICALS  COMERCIALIZADORA  IMP EXP Y DIST SPA;VENTA AL POR MAYOR DE ARTICULOS DE PERFUMERIA, COS;Rancagua;Región del Libertador General Bernardo O´Higgins;Chile;15-868;19;CL;7;2.0;2548-6-LR24;;136898019;85121900.0;Salud, servicios sanitarios y alimentación / Medicina y servicios de salud / Farmacéuticos;85121902;Farmacias;Salud, servicios sanitarios y alimentación;Medicina y servicios de salud;Farmacéuticos;ZOPICLONA 7,5 MG CAJA DE 30 COMPRIMIDOS O CÁPSULAS;ZPCL07.5COMP. (BE)ZOPICLONA 7.5MG X 30 COMP.REC.. LABORATORIO CHILE. ZOPICLONA. REG ISP F-26342. VCTO 04-2025. LOTE A61145B -- 7800007807083;20;Unidad;CLP;1272;0;0;0.0;25440;30 dias contra la recepcion conforme de la factura
50946499;2548-875-SE24;http://www.mercadopublico.cl/PurchaseOrder/Modules/PO/DetailsPurchaseOrder.aspx?codigoOC=2548-875-SE24;CONTRATO SUMINISTRO DE MEDICAMENTOS DESDE 2548-6-LR24;"CONTRATO SUMINISTRO DE MEDICAMENTOS DESDE 2548-6-LR24

ACEPTAR ORDEN DE COMPRA ANTES DE FACTURAR.
DESPACHO A AVENIDA MAQUEHUE 1441, PADRE LAS CASAS
FARMACIA MUNICIPAL
";SE;Proveniente de licitación pública;No;No;8;SE;Sin emisión automática;6;Aceptada;4;Aceptada;2024-07-30;2024-07-30;2024-07-30;2024-07-30;2024-07-30;;1;3,27027027027027;37;36242,64;CLP;36242,64;5786,64;IVA;0;0;30456;3539;61.955.000-5;MUNICIPALIDAD DE PADRE LAS CASAS  SALUD;90886;I MUNICIPALIDAD DE PADRE LAS CASAS;Municipalidades;GOBIERNO CENTRAL Y ADMINISTRACION PUBLICA;Padre Las Casas;Región de la Araucanía ;CL;275627;76.956.140-4;ETHON PHARMACEUTICALS SPA.;269948;ETHON PHARMACEUTICALS  COMERCIALIZADORA  IMP EXP Y DIST SPA;VENTA AL POR MAYOR DE ARTICULOS DE PERFUMERIA, COS;Rancagua;Región del Libertador General Bernardo O´Higgins;Chile;15-875;19;CL;7;2.0;2548-6-LR24;;136903333;85121900.0;Salud, servicios sanitarios y alimentación / Medicina y servicios de salud / Farmacéuticos;85121902;Farmacias;Salud, servicios sanitarios y alimentación;Medicina y servicios de salud;Farmacéuticos;ESZOPICLONA COMPRIMIDO O CÁPSULA 3 MG;ESZP0003COMP. (BE)ESZOPICLONA 3MG X 30 COMP.RECUBIERTOS. SEVEN PHARMA. ESZOPICLONA. REG ISP F-22496. VCTO Mayor a 12 meses. LOTE -- 8903726195628;240;Unidad;CLP;126,9;0;0;0.0;30456;30 dias contra la recepcion conforme de la factura
50949463;2762-972-AG24;http://www.mercadopublico.cl/PurchaseOrder/Modules/PO/DetailsPurchaseOrder.aspx?codigoOC=2762-972-AG24;Orden de Compra generada por invitación a compra ágil: 2762-724-COT24;"Orden de Compra codigo: 2762-972-AG24 dirigida a DROGUERÍA ACONCAGUA SPA.
MEMORANDUM N°829, JEFE GESTIÓN TÉCNICA DASM.
SOL/MAT. N°264, GESTIÓN FARMACIA DASM.";AG;Adquisición igual o inferior a 30 UTM (Debe presentar 3 cotizaciones);Si;Si;13;AG;Compra Ágil;6;Aceptada;4;Aceptada;2024-07-30;2024-07-30;2024-07-30;2024-07-30;2024-08-06;;1;0;0;1949220;CLP;1949220;311220;IVA;0;0;1638000;3751;69.151.202-9;DEPARTAMENTO ADMINISTRACION SALUD MUNICIPAL;100448;I MUNICIPALIDAD DE CORONEL;Municipalidades;GOBIERNO CENTRAL Y ADMINISTRACION PUBLICA;Coronel;Región del Biobío ;Extranjero;1124621;76.985.933-0;Droguería Aconcagua SpA;1714883;DROGUERÍA ACONCAGUA SPA;VENTA AL POR MAYOR DE PRODUCTOS FARMACEUTICOS Y MEDICINALES;La Granja;Región Metropolitana de Santiago;;05-82/2024;19;Extranjero;7;2.0;;;136912595;51141800.0;Medicamentos y productos farmacéuticos / Medicamentos para el sistema nervioso central / Hipnóticos;51141810;Zopiclona;Medicamentos y productos farmacéuticos;Medicamentos para el sistema nervioso central;Hipnóticos;ZOPICLONA 7,5MG.;;63000;Comprimido;CLP;26;0;0;;1638000;30 dias contra la recepcion conforme de la factura
50952216;525800-317-SE24;http://www.mercadopublico.cl/PurchaseOrder/Modules/PO/DetailsPurchaseOrder.aspx?codigoOC=525800-317-SE24;MEDICAMENTOS FARMACIA MUNICIPAL NP 581-589;COMPRA DE MEDICAMENTOS PARA LA FARMACIA MUNICIPAL SEGÚN NP581-589, DESPACHAR A CALLE SALINAS Nº1201 SAN FELIPE, EN EL SIGUIENTE HORARIO: DE LUNES A JUEVES DE 09:00 A 17:00 HRS Y VIERNES DE 09:00 A 16:00 HRS. FONO 323244952.;SE;Contratación con titulares de derecho de propiedad intelectual o industrial;Si;No;8;SE;Sin emisión automática;12;Recepcion Conforme;7;Recepcion Conforme;2024-07-30;2024-07-30;2024-07-30;2024-07-30;2024-07-31;;1;4,08;10;609875;CLP;609875;97375;IVA;0;0;512500;525800;69.050.600-9;Cesfam Segismundo Iturra Taito;100158;I MUNICIPALIDAD DE SAN FELIPE;Municipalidades;GOBIERNO CENTRAL Y ADMINISTRACION PUBLICA| EXPLOTACION DE INSTALACIONES ESPECIALIZADAS PARA PRACTICAS DEPORTIVAS;San Felipe;Región de Valparaíso ;CL;26897;96.026.000-7;Chemopharma S.A.;27062;CHEMOPHARMA S A;FABRICACION DE PRODUCTOS FARMACEUTICOS, SUSTANCIAS;Quilicura;Región Metropolitana de Santiago;Chile;2152204004020;19;CL;7;2.0;;;136921798;51141800.0;Medicamentos y productos farmacéuticos / Medicamentos para el sistema nervioso central / Hipnóticos;51141810;Zopiclona;Medicamentos y productos farmacéuticos;Medicamentos para el sistema nervioso central;Hipnóticos;ZOMETIC 7.5 MG X 30 COMP;ZOMETIC 7.5 MG X 30 COMP;100;Unidad no definida;CLP;1050;0;0;0.0;105000;30 dias contra la recepcion conforme de la factura
50953085;4162-422-AG24;http://www.mercadopublico.cl/PurchaseOrder/Modules/PO/DetailsPurchaseOrder.aspx?codigoOC=4162-422-AG24;Orden de Compra generada por invitación a compra ágil: 4162-301-COT24;"Orden de Compra codigo: 4162-422-AG24 dirigida a DROGUERIA GLOBAL PHARMA SPA

CONTAR CON LOS MEDICAMENTOS NECESARIOS PARA EL NORMAL FUNCIONAMIENTO DE CESFAM DOÑIHUE";AG;Adquisición igual o inferior a 30 UTM (Debe presentar 3 cotizaciones);Si;Si;13;AG;Compra Ágil;4;Enviada a proveedor;1;Nueva orden de compra;2024-07-30;2024-07-30;2024-07-30;2024-07-30;;;1;3,89333333333333;15;89250;CLP;89250;14250;IVA;0;0;75000;5081;69.080.600-2;Salud;123788;I MUNICIPALIDAD DE DONIHUE;Municipalidades;GOBIERNO CENTRAL Y ADMINISTRACION PUBLICA;Doñihue;Región del Libertador General Bernardo O´Higgins;Extranjero;829754;76.389.383-9;DROGUERIA GLOBAL PHARMA SPA;1426099;DROGUERIA GLOBAL PHARMA SPA;FARMACIA Y PERFUMERIA ;Cerrillos;Región Metropolitana de Santiago;;PRESUPUESTO MUNICIPAL;19;Extranjero;7;2.0;;;136924307;51141800.0;Medicamentos y productos farmacéuticos / Medicamentos para el sistema nervioso central / Hipnóticos;51141810;Zopiclona;Medicamentos y productos farmacéuticos;Medicamentos para el sistema nervioso central;Hipnóticos;ZOPICLONA 7,5MG COMPRIMIDO SEGUN ADJUNTO;;3000;Unidad;CLP;25;0;0;;75000;30 dias contra la recepcion conforme de la factura
50958429;1058132-1659-SE24;http://www.mercadopublico.cl/PurchaseOrder/Modules/PO/DetailsPurchaseOrder.aspx?codigoOC=1058132-1659-SE24;ORDEN DE COMPRA DESDE 1058132-6-LQ24	;"TIPO:NORMAL
Compra por Suministro de Medicamentos Tabla N°3 Grupo W DESDE 1058132-6-LQ24
Programa de compras de AGOSTO 2024, despachar mercaderías con vencimientos
superiores a 12 meses.
Lugar de Entrega: Bodega de Fármacos del Hospital Las Higueras de Talcahuano,
de Lunes a Viernes de 08:00 a 13:00 Horas
Todo DTE emitido debe hacer referencia a la orden de compra asociada y
generada en mercado público, en el campo 801 destinada para ello
El DTE debe ser enviado en un plazo no mayor a 48 horas a la casilla de correo
dipresrecepcion@custodium.com, Las facturas deben tener como forma de pago
crédito
CUENTA N° 1
";SE;Proveniente de licitación pública;No;No;8;SE;Sin emisión automática;12;Recepcion Conforme;7;Recepcion Conforme;2024-07-31;2024-07-31;2024-07-31;2024-07-31;2024-07-31;;1;4,62857142857143;7;179071,2;CLP;179071,2;28591,2;IVA;0;0;150480;1058132;61.607.202-1;Fármarcos;7419;SERVICIO DE SALUD DE TALCAHUANO HOSPITAL;Salud;Servicio Público;Talcahuano;Región del Biobío ;CL;69104;91.650.000-9;Laboratorios Saval S.A;67079;LABORATORIOS SAVAL S A;FABRICACION DE PRODUCTOS FARMACEUTICOS, SUSTANCIAS;Santiago;Región Metropolitana de Santiago;Chile;;19;CL;7;2.0;1058132-6-LQ24;;136940247;51141800.0;Medicamentos y productos farmacéuticos / Medicamentos para el sistema nervioso central / Hipnóticos;51141810;Zopiclona;Medicamentos y productos farmacéuticos;Medicamentos para el sistema nervioso central;Hipnóticos;004-0468 ESZOPICLONA 3 MG CM;NIRVAN 3 mg - x 40 comprimidos. Registro ISP: F-18537-21. Equivalente Terapéutico. Certificación GMP;1520;Comprimido;CLP;99;0;0;0.0;150480;30 dias contra la recepcion conforme de la factura
