45539812;2917-98-SE22;http://www.mercadopublico.cl/PurchaseOrder/Modules/PO/DetailsPurchaseOrder.aspx?codigoOC=2917-98-SE22;Medicamentos Farmacia Vecina ;Medicamentos Farmacia Vecina DESDE 2917-4-L122;SE;Proveniente de licitación pública;No;No;8;SE;Sin emisión automática;6;Aceptada;4;Aceptada;2022-03-08;2022-03-08;2022-03-08;2022-03-08;2022-03-08;;1;3,89333333333333;15;189567;CLP;189567;30267;IVA;0;0;159300;3903;69.210.302-5;Salud;7367;I MUNICIPALIDAD DE RIO NEGRO;Municipalidades;;Río Negro;Región de los Lagos ;CL;829754;76.389.383-9;DROGUERIA GLOBAL PHARMA SPA;1426099;DROGUERIA GLOBAL PHARMA SPA;FARMACIA Y PERFUMERIA ;Cerrillos;Región Metropolitana de Santiago;Chile;5/14;19;CL;7;2.0;2917-4-L122;;121087958;51141800.0;Medicamentos y productos farmacéuticos / Medicamentos para el sistema nervioso central / Hipnóticos;51141810.0;Zopiclona;Medicamentos y productos farmacéuticos;Medicamentos para el sistema nervioso central;Hipnóticos;4242016 ZOPICLONA 7,5 MG 30 COMP REGISTRO ISP F-16990.18 EUROFARMA ZOPERIL 31-08-2024 ENTREGA DENTRO DE 72 HORAS HABILES. MONTO MIN. DESPACHO 30.000. FLETE INCLUIDO.;4242016 ZOPICLONA 7,5 MG 30 COMP REGISTRO ISP F-16990.18 EUROFARMA ZOPERIL 31-08-2024 ENTREGA DENTRO DE 72 HORAS HABILES. MONTO MIN. DESPACHO 30.000. FLETE INCLUIDO.;20;Caja;CLP;940;0;0;0;18800;30 dias contra la recepcion conforme de la factura
45542322;3809-27-SE22;http://www.mercadopublico.cl/PurchaseOrder/Modules/PO/DetailsPurchaseOrder.aspx?codigoOC=3809-27-SE22;FARMACOS E INSUMOS DE USO MEDICO;"De acuerdo a lo establecido en las Bases de Licitación. La factura de esta Orden de Compra se debe emitir a :
Razon Social: Asociación de Municipalidades Nahuelbuta.
Rut: 65.077.833-2
Dirección: Basilio Urrutia 914, Traiguén

FARMACOS E INSUMOS DE EN";SE;Proveniente de licitación pública;No;No;8;SE;Sin emisión automática;6;Aceptada;4;Aceptada;2022-03-08;2022-03-09;2022-03-09;2022-03-09;2022-03-10;;1;3,69354838709677;62;1231888;CLP;1231888;196688;IVA;0;0;1035200;4729;69.180.200-0;Depto. Salud;116945;I MUNICIPALIDAD DE PUREN;Municipalidades;GOBIERNO CENTRAL Y ADMINISTRACION PUBLICA;Purén;Región de la Araucanía ;CL;261744;76.830.090-9;Caribean Pharma Ltda;256360;FARMACEUTICA CARIBEAN LTDA;VENTA AL POR MAYOR DE ARTICULOS DE PERFUMERIA, COS;Renca;Región Metropolitana de Santiago;Chile;Asociacion de Municiálidades;19;CL;7;2.0;3809-3-LE22;;121096241;51141800.0;Medicamentos y productos farmacéuticos / Medicamentos para el sistema nervioso central / Hipnóticos;51141810.0;Zopiclona;Medicamentos y productos farmacéuticos;Medicamentos para el sistema nervioso central;Hipnóticos;"Zopiclona 7,5 mg
";MIN0215 ZOPICLONA 7,5  COMP. CAJA X 1000, Zoplicona 7,5 mg, F-12586/17, MINTLAB, Venc: 31-10-2023, Plazo de entrega de 24-48 hrs;10000;Comprimido;CLP;21,7;0;0;0;217000;30 dias contra la recepcion conforme de la factura
45546876;3663-92-SE22;http://www.mercadopublico.cl/PurchaseOrder/Modules/PO/DetailsPurchaseOrder.aspx?codigoOC=3663-92-SE22;MEDICAMENTOS CANASTA BASICA;SUMINISTRO MEDICAMENTOS FARMACIA POPULAR DESDE 3663-1-LQ22;SE;Proveniente de licitación pública;No;No;8;SE;Sin emisión automática;6;Aceptada;4;Aceptada;2022-03-09;2022-03-11;2022-03-11;2022-03-11;2022-03-11;;1;3,27027027027027;37;1448777,4;CLP;1448777,4;231317,4;IVA;0;0;1217460;4583;69.081.300-9;Salud;116215;I MUNICIPALIDAD DE REQUINOA;Municipalidades;GOBIERNO CENTRAL Y ADMINISTRACION PUBLICA;Requinoa;Región del Libertador General Bernardo O´Higgins;CL;275627;76.956.140-4;ETHON PHARMACEUTICALS SPA.;269948;ETHON PHARMACEUTICALS  COMERCIALIZADORA  IMP EXP Y DIST SPA;VENTA AL POR MAYOR DE ARTICULOS DE PERFUMERIA, COS;Rancagua;Región del Libertador General Bernardo O´Higgins;Chile;2152204004;19;CL;7;2.0;3663-1-LQ22;;121110491;51141800.0;Medicamentos y productos farmacéuticos / Medicamentos para el sistema nervioso central / Hipnóticos;51141810.0;Zopiclona;Medicamentos y productos farmacéuticos;Medicamentos para el sistema nervioso central;Hipnóticos;"Zopiclona 7,5mg ""EQUIVALENTE A"" Zoperil/Zometic  comprimido caja x 30 Se aumentará la cantidad según la necesidad de la Farmacia Popular";ZPCL07.5COMP. ZOMETIC 7.5MG X 30 COMP.. CHEMOPHARMA. ZOPICLONA. REG ISP F-8783/16. VCTO Mayor a 12 meses. LOTE  -- 7800041047414, Vigencia de la Oferta 120 días;50;Caja;CLP;1215;0;0;0;60750;30 dias contra la recepcion conforme de la factura
45551720;1076710-73-SE22;http://www.mercadopublico.cl/PurchaseOrder/Modules/PO/DetailsPurchaseOrder.aspx?codigoOC=1076710-73-SE22;OC DESDE 1076710-19-LP21 MEDICAMENTOS;"SUMINISTRO DE MEDICAMENTOS DESIERTOS INTERMEDIADOS POR CENABAST PARA EL CRS HOSPITAL PROVINCIA CORDILLERA DESDE 1076710-19-LP21

Horario de recepción Lunes a Jueves 08:00 a 16:00 viernes hasta las 15:00, Entre Hijuelas N° 1638 al 1734, Puente Alto.
POR";SE;Proveniente de licitación pública;No;No;8;SE;Sin emisión automática;12;Recepcion Conforme;7;Recepcion Conforme;2022-03-10;2022-03-10;2022-03-10;2022-03-10;2022-03-11;;1;3,27027027027027;37;74970;CLP;74970;11970;IVA;0;0;63000;1076710;61.980.620-4;FÁRMACOS CRS HPC;1530575;CENTRO DE REFERENCIA DE SALUD HOSPITAL PROVINCIA CORDILLERA;Salud;SALUD ;Puente Alto;Región Metropolitana de Santiago;CL;275627;76.956.140-4;ETHON PHARMACEUTICALS SPA.;269948;ETHON PHARMACEUTICALS  COMERCIALIZADORA  IMP EXP Y DIST SPA;VENTA AL POR MAYOR DE ARTICULOS DE PERFUMERIA, COS;Rancagua;Región del Libertador General Bernardo O´Higgins;Chile;;19;CL;7;2.0;1076710-19-LP21;;121124764;51141800.0;Medicamentos y productos farmacéuticos / Medicamentos para el sistema nervioso central / Hipnóticos;51141810.0;Zopiclona;Medicamentos y productos farmacéuticos;Medicamentos para el sistema nervioso central;Hipnóticos;"FA01-0142 ZOPICLONA 7,5 MG COMPRIMIDO
";"ZPCL07.5COMP. BEZOPICLONA 7.5MG X 1000 COMP.REC.. MINTLAB. ZOPICLONA. REG ISP F-12586 - VTO 2-2023 - LOTE B210188 Vigencia de la Oferta 90 días
";3000;Comprimido;CLP;21;0;0;0;63000;30 dias contra la recepcion conforme de la factura
45554184;1099899-32-SE22;http://www.mercadopublico.cl/PurchaseOrder/Modules/PO/DetailsPurchaseOrder.aspx?codigoOC=1099899-32-SE22;ESZOPICLONA 3 MG COMPRIMIDOS FARMACIA - COSAM LOS ANDES ORDEN DE COMPRA DESDE 1099899-2-LQ2;"la necesidad del Centro de Salud Mental Comunitaria Los Andes, con el objetivo de garantizar y dar cumplimiento a los Tratamientos de
Salud Mental Ambulatoria del Valle del Aconcagua, es que requiere Convenio de Suministro Medicamentos, por un periodo de";SE;Proveniente de licitación pública;No;No;8;SE;Sin emisión automática;12;Recepcion Conforme;7;Recepcion Conforme;2022-03-10;2022-03-11;2022-03-10;2022-06-16;2022-03-11;;1;3,27027027027027;37;138516;CLP;138516;22116;IVA;0;0;116400;1099899;62.000.630-0;BIENES Y SERVICIOS;1688788;CENTRO SALUD MENTAL COMUNITARIA LOS ANDES;Salud;HOSPITALES Y CLÍNICAS;Los Andes;Región de Valparaíso ;CL;275627;76.956.140-4;ETHON PHARMACEUTICALS SPA.;269948;ETHON PHARMACEUTICALS  COMERCIALIZADORA  IMP EXP Y DIST SPA;VENTA AL POR MAYOR DE ARTICULOS DE PERFUMERIA, COS;Rancagua;Región del Libertador General Bernardo O´Higgins;Chile;;19;CL;7;2.0;1099899-2-LQ22;;121131784;73101700.0;Servicios de producción y fabricación industrial / Industrias de plásticos y productos químicos / Producción farmacéutica;73101701.0;Servicios de producción de medicamentos o medicinas;Servicios de producción y fabricación industrial;Industrias de plásticos y productos químicos;Producción farmacéutica;ESZOPICLONA 3 MG COMPRIMIDOS Producto de Referencia o Bioequivalente, con vencimiento igual o posterior a 12 meses, adjuntar ficha del medicamento, se adjuntan Bases Administrativas, Especificaciones Técnicas y Anexos.;ESZP0003COMP. (BE)ESZOPICLONA 3MG X 30 COMP.RECUBIERTOS. SEVEN PHARMA. ESZOPICLONA. REG ISP F-22496. VCTO 06-2023. LOTE ESZ21013 -- 8903726195628, Entrega en 2 día. Se adjunta ISP, CANJE y anexos técnicos. Validez de la oferta 60 días. Sin costo por flete;1200;Comprimido;CLP;97;0;0;0;116400;30 dias contra la recepcion conforme de la factura
45555156;5350-218-SE22;http://www.mercadopublico.cl/PurchaseOrder/Modules/PO/DetailsPurchaseOrder.aspx?codigoOC=5350-218-SE22;ORDEN DE COMPRA DESDE 5350-77-LP21;"CONVENIO DE SUMINSITRO FARMACIA COMUNITARIA DESDE 5350-77-LP21
ORDEN DE COMPRA REFERENCIAL, FAVOR NO ENVIAR PRODUCTOS";SE;Proveniente de licitación pública;No;No;8;SE;Sin emisión automática;6;Aceptada;4;Aceptada;2022-03-10;2022-03-11;2022-03-11;2022-03-11;2022-03-11;;1;4,23157894736842;76;153373,15;CLP;153373,15;24488,15;IVA;0;0;128885;6263;69.030.500-3;DEPTO DE SALUD MUNICIPAL;86491;I MUNICIPALIDAD DE VALLENAR;Municipalidades;VENTA AL POR MENOR DE FLORES, PLANTAS, ARBOLES, SEMILLAS, ABONOS| GOBIERNO CENTRAL;Vallenar;Región de Atacama ;CL;550506;91.575.000-1;Socofar Division Munnich;26783;SOCOFAR S A;REPARACION DE EQUIPO MEDICO Y QUIRURGICO, Y DE APA;Quilicura;Región Metropolitana de Santiago;Chile;;19;CL;7;2.0;5350-77-LP21;;121134639;51191900.0;Medicamentos y productos farmacéuticos / Agentes que afectan el agua y los electrolitos / Suplementos dietéticos y productos de terapia alimenticia;51191905.0;Suplementos vitamínicos;Medicamentos y productos farmacéuticos;Agentes que afectan el agua y los electrolitos;Suplementos dietéticos y productos de terapia alimenticia;ZOPICLONA 7,5 MG CAJA X 30 COMPRIMIDOS ;273269 ZOPICLONA BE.COM.7.5MG.30 GENERICOS BIOEQUIVALENTES. VCTO 12-2023. SE ADJUNTA FICHA TECNICA. DESPACHO EN 48 HORAS, SIN COSTO ADICIONAL. MONTO MINIMO FACTURACION 50.000. SOCOFAR CUENTA CON SERVICIO DE POST VENTA Y POLITICA DE CANJE;1;Unidad;CLP;1154;0;0;0;1154;30 dias contra la recepcion conforme de la factura
45555157;5350-219-SE22;http://www.mercadopublico.cl/PurchaseOrder/Modules/PO/DetailsPurchaseOrder.aspx?codigoOC=5350-219-SE22;ORDEN DE COMPRA DESDE 5350-77-LP21;"CONVENIO DE SUMINSITRO FARMACIA COMUNITARIA DESDE 5350-77-LP21
ORDEN DE COMPRA REFERENCIAL, FAVOR NO ENVIAR PRODUCTOS";SE;Proveniente de licitación pública;No;No;8;SE;Sin emisión automática;6;Aceptada;4;Aceptada;2022-03-10;2022-03-11;2022-03-11;2022-03-11;2022-03-11;;1;4,19047619047619;21;31059;CLP;31059;4959;IVA;0;0;26100;6263;69.030.500-3;DEPTO DE SALUD MUNICIPAL;86491;I MUNICIPALIDAD DE VALLENAR;Municipalidades;VENTA AL POR MENOR DE FLORES, PLANTAS, ARBOLES, SEMILLAS, ABONOS| GOBIERNO CENTRAL;Vallenar;Región de Atacama ;CL;586852;76.079.782-0;WINPHARM;1160440;WINPHARM SPA;VENTA AL POR MAYOR DE PRODUCTOS QUIMICOS;Pudahuel;Región Metropolitana de Santiago;Chile;;19;CL;7;2.0;5350-77-LP21;;121134641;51191900.0;Medicamentos y productos farmacéuticos / Agentes que afectan el agua y los electrolitos / Suplementos dietéticos y productos de terapia alimenticia;51191905.0;Suplementos vitamínicos;Medicamentos y productos farmacéuticos;Agentes que afectan el agua y los electrolitos;Suplementos dietéticos y productos de terapia alimenticia;ESZOPICLONA 3 MG CAJA X 30 COMPRIMIDOS ;"ESZOPICLONA 3 MG CM REC. CX30. REG ISP F-22496. LAB SEVENPH. VENCE 30-04-2023
";1;Unidad;CLP;2700;0;0;0;2700;30 dias contra la recepcion conforme de la factura
45557802;362-132-AG22;http://www.mercadopublico.cl/PurchaseOrder/Modules/PO/DetailsPurchaseOrder.aspx?codigoOC=362-132-AG22;Orden de Compra generada por invitación a compra ágil: 362-63-COT22;;AG;Adquisición igual o inferior a 30 UTM (Debe presentar 3 cotizaciones);Si;Si;13;AG;Compra Ágil;12;Recepcion Conforme;7;Recepcion Conforme;2022-03-11;2022-03-11;2022-03-11;2022-03-11;2022-03-11;;1;3,69354838709677;62;104720;CLP;104720;16720;IVA;0;0;88000;1359;61.606.915-2;H_Chanco;7279;SERVICIO DE SALUD DEL MAULE HOSPITAL DE;Salud;;Chanco;Región del Maule ;CL;261744;76.830.090-9;Caribean Pharma Ltda;256360;FARMACEUTICA CARIBEAN LTDA;VENTA AL POR MAYOR DE ARTICULOS DE PERFUMERIA, COS;Renca;Región Metropolitana de Santiago;Chile;;19;CL;7;2.0;;;121142404;51141800.0;Medicamentos y productos farmacéuticos / Medicamentos para el sistema nervioso central / Hipnóticos;51141810.0;Zopiclona;Medicamentos y productos farmacéuticos;Medicamentos para el sistema nervioso central;Hipnóticos;ZOPICLONA 7,5 MG;ZOPICLONA 7,5 MG;4000;Unidad;CLP;22;0;0;0;88000;30 dias contra la recepcion conforme de la factura
45562143;2688-103-SE22;http://www.mercadopublico.cl/PurchaseOrder/Modules/PO/DetailsPurchaseOrder.aspx?codigoOC=2688-103-SE22;ADQUISICION MEDICAMENTOS CESFAM;"SUMINISTRO MEDICAMENTOS DESDE 2688-1-LP22.
DESPACHO EN CESFAM ALGARROBO
CONTACTO: CAROL NIETO CARDENAS";SE;Proveniente de licitación pública;No;No;8;SE;Sin emisión automática;12;Recepcion Conforme;7;Recepcion Conforme;2022-03-11;2022-03-18;2022-03-18;2022-03-18;2022-03-23;;1;4,23157894736842;76;2445127,6766;CLP;2445127,6766;390398,5366;IVA;0;0;2054729,14;3677;69.061.600-9;MUNICIPALIDAD DE ALGARROBO-SALUD;7294;I MUNICIPALIDAD DE ALGARROBO;Municipalidades;GOBIERNO CENTRAL Y ADMINISTRACION PUBLICA;Algarrobo;Región de Valparaíso ;  ;550506;91.575.000-1;Socofar Division Munnich;26783;SOCOFAR S A;REPARACION DE EQUIPO MEDICO Y QUIRURGICO, Y DE APA;Quilicura;Región Metropolitana de Santiago;Chile;;19;  ;12;2.0;2688-1-LP22;;121156304;51141800.0;Medicamentos y productos farmacéuticos / Medicamentos para el sistema nervioso central / Hipnóticos;51141810.0;Zopiclona;Medicamentos y productos farmacéuticos;Medicamentos para el sistema nervioso central;Hipnóticos;"ZOPICLONA 7,5 mg	
";225187 ZOPICLONA 7.5MG - ZOPLICONA - BIOEQUIVALENTE - MINTLAB REG.ISP F-12586 - CAJA X 1000 - COMPRIMIDO.VCTO 31-03-2024. SE ADJUNTA DOCUMENTACION TECNICA. DESPACHO 1 DIA HABIL, SIN COSTO ADICIONAL, VALIDEZ DE LA OFERTA 60 DIAS CORRIDOS DESDE EL CIERRE. S;3000;Comprimido;CLP;21,73;0;0;0;65190;30 dias contra la recepcion conforme de la factura
45562144;2688-104-SE22;http://www.mercadopublico.cl/PurchaseOrder/Modules/PO/DetailsPurchaseOrder.aspx?codigoOC=2688-104-SE22;ADQUISICION MEDICAMENTOS CESFAM;"SUMINISTRO MEDICAMENTOS DESDE 2688-1-LP22.
DESPACHO EN CESFAM ALGARROBO
CONTACTO: CAROL NIETO";SE;Proveniente de licitación pública;No;No;8;SE;Sin emisión automática;12;Recepcion Conforme;7;Recepcion Conforme;2022-03-11;2022-03-28;2022-03-28;2022-03-28;2022-03-28;;1;4,19047619047619;21;6585936;CLP;6585936;1051536;IVA;0;0;5534400;3677;69.061.600-9;MUNICIPALIDAD DE ALGARROBO-SALUD;7294;I MUNICIPALIDAD DE ALGARROBO;Municipalidades;GOBIERNO CENTRAL Y ADMINISTRACION PUBLICA;Algarrobo;Región de Valparaíso ;  ;586852;76.079.782-0;WINPHARM;1160440;WINPHARM SPA;VENTA AL POR MAYOR DE PRODUCTOS QUIMICOS;Pudahuel;Región Metropolitana de Santiago;Chile;;19;  ;7;2.0;2688-1-LP22;;121156310;51141800.0;Medicamentos y productos farmacéuticos / Medicamentos para el sistema nervioso central / Hipnóticos;51141810.0;Zopiclona;Medicamentos y productos farmacéuticos;Medicamentos para el sistema nervioso central;Hipnóticos;"ESZOPICLONA 3 mg
";"ESZOPICLONA 3 MG CM REC CX30 LAB SEVENPH REG ISP F-22496 VENCE 30-06-23




";450;Comprimido;CLP;90;0;0;0;40500;30 dias contra la recepcion conforme de la factura
45562390;2069-2240-SE22;http://www.mercadopublico.cl/PurchaseOrder/Modules/PO/DetailsPurchaseOrder.aspx?codigoOC=2069-2240-SE22;SAR-CP-032022-PROGRAMA MARZO FARMACOS-LP;"PROGRAMA MEDICAMENTOS MARZO 2022 
Cert. Disponibilidad presupuestaria: PRES-154/2021
Horario de Atención de Bodega: lunes a viernes de 8:30 a 13:30 - 14:30 a 17:00 horas. en horario hábil.
 **ESTIMADO PROVEEDOR: FAVOR DESPACHAR ORDENES DE COMPRA EN EST";SE;Proveniente de licitación pública;No;No;8;SE;Sin emisión automática;12;Recepcion Conforme;7;Recepcion Conforme;2022-03-12;2022-03-16;2022-03-16;2022-03-12;2022-03-16;;1;3,69354838709677;62;28560;CLP;28560;4560;IVA;0;0;24000;3064;61.608.101-2;HOSPITAL BARROS LUCO TRUDEAU;7293;SERVICIO DE SALUD METROPOLITANO SUR HOSP;Salud;HOSPITALES Y CLINICAS;San Miguel;Región Metropolitana de Santiago;CL;261744;76.830.090-9;Caribean Pharma Ltda;256360;FARMACEUTICA CARIBEAN LTDA;VENTA AL POR MAYOR DE ARTICULOS DE PERFUMERIA, COS;Renca;Región Metropolitana de Santiago;Chile;3055;19;CL;12;48.0;2069-18-LR21;;121156883;51141800.0;Medicamentos y productos farmacéuticos / Medicamentos para el sistema nervioso central / Hipnóticos;51141810.0;Zopiclona;Medicamentos y productos farmacéuticos;Medicamentos para el sistema nervioso central;Hipnóticos;2140126	ZOPICLONA 7,5 MG COMPRIMIDO;MIN0215 ZOPICLONA 7,5  COMP. CAJA X 1000 B  Entrega 24-HR ZOPICLONA F-1258617 MINTLAB  VENC. 31-12-2022   ;1000;Comprimido;CLP;24;0;0;0;24000;
45565444;4172-170-SE22;http://www.mercadopublico.cl/PurchaseOrder/Modules/PO/DetailsPurchaseOrder.aspx?codigoOC=4172-170-SE22;ORDEN DE COMPRA DESDE 4172-3-LE22;"MEDICAMENTOS DEPTO. SALUD COLBÚN DESDE 4172-3-LE22
DECRETO 545 / 10.03.2022";SE;Proveniente de licitación pública;No;No;8;SE;Sin emisión automática;6;Aceptada;4;Aceptada;2022-03-14;2022-03-14;2022-03-14;2022-03-14;2022-03-15;;1;3,69354838709677;62;3115373,828;CLP;3115373,828;497412,628;IVA;0;0;2617961,2;5091;69.130.500-7;Salud;124195;ILUSTRE MUNICIPALIDAD DE COLBUN;Municipalidades;ACTIVIDADES DE ASESORAMIENTO EMPRESARIAL Y EN MATERIA DE GESTION| OTRAS ACTIVIDADES DE SERVICIOS PERSONALES N.C.P.;Colbún;Región del Maule ;CL;261744;76.830.090-9;Caribean Pharma Ltda;256360;FARMACEUTICA CARIBEAN LTDA;VENTA AL POR MAYOR DE ARTICULOS DE PERFUMERIA, COS;Renca;Región Metropolitana de Santiago;Chile;;19;CL;21;2.0;4172-3-LE22;;121166702;51141800.0;Medicamentos y productos farmacéuticos / Medicamentos para el sistema nervioso central / Hipnóticos;51141810.0;Zopiclona;Medicamentos y productos farmacéuticos;Medicamentos para el sistema nervioso central;Hipnóticos;ZOPICLONA 7,5 MG COMPRIMIDO ;MIN0215 ZOPICLONA 7,5  COMP. CAJA X 1000, Zoplicona 7,5 mg, F-12586/17, MINTLAB, Venc: 31-10-2023, Plazo de entrega de 24-48 hrs;23000;Unidad;CLP;21,73;0;0;0;499790;30 dias contra la recepcion conforme de la factura
45566590;2335-139-SE22;http://www.mercadopublico.cl/PurchaseOrder/Modules/PO/DetailsPurchaseOrder.aspx?codigoOC=2335-139-SE22;MEDICAMENTOS F.C. OP 9. 10. 11.;MEDICAMENTOS PARA BODEGA DE FARMACIA COMUNITARIA DEPENDIENTE DEL DEPTO. DE SALUD DE LINARES  (OP 9/10/11.) DESDE (2335-2-LE22)   (215-22-04-004-003) (FARMACIA COMUNITARIA) C/CH 167  .  .. . . . .  (DESPACHAR A BODEGA DE CALLE FREIRE N°341 LINARES)  (FAC;SE;Proveniente de licitación pública;No;No;8;SE;Sin emisión automática;6;Aceptada;4;Aceptada;2022-03-14;2022-03-15;2022-03-15;2022-03-15;2022-03-15;;1;4,19047619047619;21;385560;CLP;385560;61560;IVA;0;0;324000;3328;69.130.301-2;ADQUISICIONES SALUD;86545;I MUNICIPALIDAD DE LINARES;Municipalidades;;Linares;Región del Maule ;CL;586852;76.079.782-0;WINPHARM;1160440;WINPHARM SPA;VENTA AL POR MAYOR DE PRODUCTOS QUIMICOS;Pudahuel;Región Metropolitana de Santiago;Chile;;19;CL;7;2.0;2335-2-LE22;;121170266;51141800.0;Medicamentos y productos farmacéuticos / Medicamentos para el sistema nervioso central / Hipnóticos;51141810.0;Zopiclona;Medicamentos y productos farmacéuticos;Medicamentos para el sistema nervioso central;Hipnóticos;"Eszopiclona 3 mg. Caja x 30 comp. rec. Similar a ZOPINOM . . . . . . .. . .. . .. (Se adjuntan bases administrativas y técnicas, ""leerlas p/ofertar"").
";"ESZOPICLONA 3 MG CM REC
CX30 reg F-22496 lab.SEVENPH
vence 30-06-2023

 
";100;Caja;CLP;2700;0;0;0;270000;30 dias contra la recepcion conforme de la factura
45569671;2146-124-AG22;http://www.mercadopublico.cl/PurchaseOrder/Modules/PO/DetailsPurchaseOrder.aspx?codigoOC=2146-124-AG22;Orden de Compra generada por invitación a compra ágil: 2146-48-COT22;"RESOLUCIÓN EXENTA N°341-97 POR COMPRA DE ZOPICLONA 7.5MG, REQUERIDO MEDIANTE SOLICITUD DE COMPRA N° 25 DE FECHA 08/03/2022 EMITIDO POR JEFE FARMACIA DEL ESTABLECIMIENTO.

HACER DESPACHO MEDIANTE GUÍA POSTERIOR RECEPCIÓN CONFORME, EMITIR FACTURA CORRESPO";AG;Adquisición igual o inferior a 30 UTM (Debe presentar 3 cotizaciones);Si;Si;13;AG;Compra Ágil;12;Recepcion Conforme;7;Recepcion Conforme;2022-03-15;2022-03-16;2022-03-15;2022-03-23;2022-03-17;;1;3,69354838709677;62;261800;CLP;261800;41800;IVA;0;0;220000;3141;61.606.405-3;Hosp. Andacollo;7472;SERVICIO DE SALUD COQUIMBO HOSPITAL DE ANDACOLLO;Salud;;Andacollo;Región de Coquimbo ;CL;261744;76.830.090-9;Caribean Pharma Ltda;256360;FARMACEUTICA CARIBEAN LTDA;VENTA AL POR MAYOR DE ARTICULOS DE PERFUMERIA, COS;Renca;Región Metropolitana de Santiago;Chile;;19;CL;9;2.0;;;121179190;51141800.0;Medicamentos y productos farmacéuticos / Medicamentos para el sistema nervioso central / Hipnóticos;51141810.0;Zopiclona;Medicamentos y productos farmacéuticos;Medicamentos para el sistema nervioso central;Hipnóticos;ZOPICLONA 7.5 MG, INDICAR VENCIMIENTO MAYOR A 18 MESES, TIEMPO DE DESPACHO, STOCK DISPONIBLE, CONTACTO DIRECTO CON VENDEDOR, IMAGEN Y FICHA TÉCNICA DEL PRODUCTO A OFERTAR. PARA EVALUACIÓN Y ADJUDICACIÓN;ZOPICLONA 7,5 COMP. CAJA X 1000, Zoplicona 7,5 mg, F-12586/17, MINTLAB, Venc: 31-10-2023 ENTREGA 2 DIAS M.MIN 50000 CONTACTO: ANDREA BRAVO 226639324 abravo@caribeanpharma.cl;10000;Unidad;CLP;22;0;0;0;220000;30 dias contra la recepcion conforme de la factura
45570594;4075-194-SE22;http://www.mercadopublico.cl/PurchaseOrder/Modules/PO/DetailsPurchaseOrder.aspx?codigoOC=4075-194-SE22;ORDEN DE COMPRA DESDE 4075-9-L122;COMPRA DE FARMACOS PARA FARMACIA POPULAR DESDE 4075-9-L122;SE;Proveniente de licitación pública;No;No;8;SE;Sin emisión automática;6;Aceptada;4;Aceptada;2022-03-15;2022-03-15;2022-03-15;2022-03-15;2022-03-15;;1;3,89333333333333;15;426615;CLP;426615;68115;IVA;0;0;358500;4995;69.150.901-K;I MUNICIPALIDAD DE YUMBEL DEPTO SALUD;120004;I MUNICIPALIDAD DE YUMBEL;Municipalidades;servicio publico;Yumbel;Región del Biobío ;CL;829754;76.389.383-9;DROGUERIA GLOBAL PHARMA SPA;1426099;DROGUERIA GLOBAL PHARMA SPA;FARMACIA Y PERFUMERIA ;Cerrillos;Región Metropolitana de Santiago;Chile;2204004;19;CL;7;2.0;4075-9-L122;;121181948;85121900.0;Salud, servicios sanitarios y alimentación / Medicina y servicios de salud / Farmacéuticos;85121902.0;Farmacias;Salud, servicios sanitarios y alimentación;Medicina y servicios de salud;Farmacéuticos;ZOPICLONA 7,5 MG X 30 COMP.;4242016 ZOPICLONA 7,5 MG 30 COMP REGISTRO ISP F-16990.18	EUROFARMA  ZOPERIL 30-11-2024 ENTREGA DENTRO DE 48 HORAS HABILES. MONTO MIN. DESPACHO 30.000. FLETE INCLUIDO.;150;Caja;CLP;940;0;0;0;141000;30 dias contra la recepcion conforme de la factura
45572752;3251-105-SE22;http://www.mercadopublico.cl/PurchaseOrder/Modules/PO/DetailsPurchaseOrder.aspx?codigoOC=3251-105-SE22;Medicamentos;ABASTECER BODEGA DE FARMACIA DEL DEPARTAMENTO DE SALUD MUNICIPAL DE PELLUHUE ;SE;Proveniente de licitación pública;No;No;8;SE;Sin emisión automática;12;Recepcion Conforme;7;Recepcion Conforme;2022-03-15;2022-03-15;2022-03-15;2022-03-15;2022-03-15;;1;3,27027027027027;37;427626,5;CLP;427626,5;68276,5;IVA;0;0;359350;4172;69.252.700-3;Departamento de Salud;113978;I MUNICIPALIDAD DE PELLUHUE;Municipalidades;GOBIERNO CENTRAL Y ADMINISTRACION PUBLICA;Pelluhue;Región del Maule ;CL;275627;76.956.140-4;ETHON PHARMACEUTICALS SPA.;269948;ETHON PHARMACEUTICALS  COMERCIALIZADORA  IMP EXP Y DIST SPA;VENTA AL POR MAYOR DE ARTICULOS DE PERFUMERIA, COS;Rancagua;Región del Libertador General Bernardo O´Higgins;Chile;2152204004;19;CL;7;2.0;3251-18-LP20;;121189424;51141800.0;Medicamentos y productos farmacéuticos / Medicamentos para el sistema nervioso central / Hipnóticos;51141810.0;Zopiclona;Medicamentos y productos farmacéuticos;Medicamentos para el sistema nervioso central;Hipnóticos;Zopiclona 7.5mg.;ZPCL07.5COMP. BEZOPICLONA 7.5MG X 1000 COMP.REC.. MINTLAB. ZOPICLONA. REG ISP F-12586 - VTO 10-2022 - LOTE J201308 Entrega en 3 dias. Se adjunta CANJE . Validez de la oferta 60 días. Sin costo por flete. Monto mínimo de despacho 50.000.;15000;Ampolla;CLP;21;0;0;0;315000;30 dias contra la recepcion conforme de la factura
45576973;5051-884-SE22;http://www.mercadopublico.cl/PurchaseOrder/Modules/PO/DetailsPurchaseOrder.aspx?codigoOC=5051-884-SE22;5051-68-LE21/220400400102/ESZOPLICONA/MARZO;"Memantina 10 mg y otros medicamentos DESDE 5051-68-LE21.
DESPACHAR A BODEGA HOSPITAL REGIONAL DE TALCA. UBICADO EN 1 NORTE N°1990. CON FLETE INCLUIDO.
CONSUMO MARZO.";SE;Proveniente de licitación pública;No;No;8;SE;Sin emisión automática;12;Recepcion Conforme;7;Recepcion Conforme;2022-03-16;2022-03-17;2022-03-16;2022-03-16;2022-03-17;;1;4,40377358490566;53;51586,5;CLP;51586,5;8236,5;IVA;0;0;43350;5964;61.606.901-2;Farmacia;7260;SERVICIO DE SALUD DEL MAULE HOSPITAL DE TALCA;Salud;HOSPITALES Y CLINICAS;Talca;Región del Maule ;CL;106395;77.596.940-7;LABORATORIO CHILE S.A.;103860;LABORATORIO CHILE S A;FABRICACION DE PRODUCTOS FARMACEUTICOS, SUSTANCIAS;Ñuñoa;Región Metropolitana de Santiago;Chile;;19;CL;7;48.0;5051-68-LE21;;121202435;51141800.0;Medicamentos y productos farmacéuticos / Medicamentos para el sistema nervioso central / Hipnóticos;51141810.0;Zopiclona;Medicamentos y productos farmacéuticos;Medicamentos para el sistema nervioso central;Hipnóticos;ESZOPICLONA 3 MG COMPRIMIDO COD INTER 040400100032;120-10-74721 ZOPINOM 3 MG 30 CR EQUIVALENTE TERAPÉUTICO Eszopiclona 3 mg 30 Comprimidos Recubiertos. Despacho en 48 horas.;510;Comprimido;CLP;85;0;0;0;43350;
