49724082;2101-46-SE24;http://www.mercadopublico.cl/PurchaseOrder/Modules/PO/DetailsPurchaseOrder.aspx?codigoOC=2101-46-SE24;MEDICAMENTOS;"COD.EJC.:ALNR8
UNIDAD SOLICITANTE: BODEGA DE FÁRMACOS
SUBTL. PPTO: 22.04.004 ""PRODUCTOS FARMACÉUTICOS""
----------------------
- EL ENVÍO DE LOS PRODUCTOS E INSUMOS DEBERÁ SER CON GUÍA DE DESPACHO E INDICAR EL NÚMERO DE ORDEN DE COMPRA.
- EN CASO DE DESPACHAR CON FACTURA EL HOSPITAL REALIZARÁ EL RECLAMO DEL DOCUMENTO.
- LA FACTURA DEBERÁ EMITIRSE UNA VEZ REALIZADA LA RECEPCIÓN CONFORME EN MERCADO PÚBLICO, CON LAS SIGUIENTES CONSIDERACIONES:
SEÑALAR NÚMERO DE ORDEN DE COMPRA Y GUÍA DE DESPACHO EN EL CAMPO CORRESPONDIENTE.
DESPACHAR A HOSPITAL INTERCULTURAL KALLVU LLANKA, UBICADO EN RUTA P60R, ESQUINA RUTA P520, ACCESO NORTE. CAÑETE. ";SE;Proveniente de licitación pública;No;No;8;SE;Sin emisión automática;12;Recepcion Conforme;7;Recepcion Conforme;2024-01-18;2024-01-19;2024-01-19;2024-01-19;2024-01-22;;1;3,89333333333333;15;2437887,55;CLP;2437887,55;389242,55;IVA;0;0;2048645;3096;61.602.213-k;Hospital Cañete;7401;HOSPITAL INTERCULTURAL KALLVU LLANKA.-;Salud;;Cañete;Región del Biobío ;CL;829754;76.389.383-9;DROGUERIA GLOBAL PHARMA SPA;1426099;DROGUERIA GLOBAL PHARMA SPA;FARMACIA Y PERFUMERIA ;Cerrillos;Región Metropolitana de Santiago;Chile;136;19;CL;7;2;2101-206-LE23;;133208912;12162200.0;Productos químicos industriales / Aditivos / Anti-oxidantes;12162207.0;Melatonina;Productos químicos industriales;Aditivos;Anti-oxidantes;MELATONINA 3 MG CM/CP ;"4242075 MELATONINA 3 MG 30 COMPRIMIDOS REG ISP F-11438.21 EUROFARMA	31-07-2025 ENTREGA DENTRO DE 48 HORAS HÁBILES. MONTO MÍN. DESPACHO 30.000. FLETE INCLUIDO. 
";20000;Comprimido;CLP;33;0;0;0.0;660000;30 dias contra la recepcion conforme de la factura
49730597;2664-80-SE24;http://www.mercadopublico.cl/PurchaseOrder/Modules/PO/DetailsPurchaseOrder.aspx?codigoOC=2664-80-SE24;MEDICAMENTO FARMACIA POPULAR, S/P N° 01-19-24;"MEDICAMENTO FARMACIA POPULAR, S/P N° 01-19-24
DESPACHAR A IGNACIO SERRANO N° 1055 - TOME
AT.: CARLOS VILLARROEL SOTO";SE;Contratación con titulares de derecho de propiedad intelectual o industrial;Si;No;8;SE;Sin emisión automática;6;Aceptada;4;Aceptada;2024-01-19;2024-01-19;2024-01-19;2024-02-01;2024-01-19;;1;0;0;1219531,04;CLP;1219531,04;194715,04;IVA;0;0;1024816;3653;69.150.102-7;Dirección de Salud Municipal;98443;I MUNICIPALIDAD DE TOME;Municipalidades;;Tomé;Región del Biobío ;CL;60314;96.599.510-2;EUROFARMA CHILE SPA;58731;MEDIPHARM S.A.;FABRICACION DE PRODUCTOS FARMACEUTICOS, SUSTANCIAS;Pudahuel;Región Metropolitana de Santiago;Chile;2152204004011;19;CL;7;2;;;133232523;42171900.0;Equipamiento y suministros médicos / Artículos médicos para urgencias y atención en terreno / Contenedores de almacenaje para servicios médicos de urgencia;42171903.0;Cajas de medicamentos de servicios médicos de urge;Equipamiento y suministros médicos;Artículos médicos para urgencias y atención en terreno;Contenedores de almacenaje para servicios médicos de urgencia;"Melatonina 3 mg 30 comprimidos
";"Melatonina 3 mg 30 comprimidos
";100;Caja;CLP;1259;0;0;0.0;125900;30 dias contra la recepcion conforme de la factura
49730773;1058087-44-AG24;http://www.mercadopublico.cl/PurchaseOrder/Modules/PO/DetailsPurchaseOrder.aspx?codigoOC=1058087-44-AG24;MPO/PROGRAMA FARMACIA/ENERO 2024;"DESPACHAR AC 25-01-2024

Proveedores: A contar desde el 13 de marzo será obligatorio incluir información que permita la trazabilidad de insumos médicos, que incluye nombre, lote y fecha de vencimiento, indicar si corresponde a dispositivo médico según la norma de ISP.
Horario de Bodega lunes a jueves 09:00 a 15:00 horas, viernes 09:00 a 14:00 horas, adjuntar a Factura copia de orden de compra estado aceptada e incluir en Factura el número de ésta. Teléfono: 225756290 Bodega Central.
";AG;Adquisición igual o inferior a 30 UTM (Debe presentar 3 cotizaciones);Si;Si;13;AG;Compra Ágil;12;Recepcion Conforme;7;Recepcion Conforme;2024-01-19;2024-01-19;2024-01-19;2024-01-19;2024-01-22;;1;0;0;142800;CLP;142800;22800;IVA;0;0;120000;1058087;61.608.408-9;Fármarcos;6918;SERVICIO DE SALUD ORIENTE HOSPITAL LUIS CALVO MACKENNA;Salud;HOSPITAL ;Alhué;Región Metropolitana de Santiago;Extranjero;651991;76.133.312-7;HOSPIFARMA;1254490;LABORATORIO HOSPIFARMA CHILE LIMITADA;VENTA AL POR MAYOR DE ARTICULOS DE PERFUMERIA, COSMETICOS, JABONES Y P| VENTA AL POR MAYOR DE PRODUCTOS FARMACEUTICOS| VENTA AL POR MAYOR DE PRODUCTOS QUIMICOS;Quilicura;Región Metropolitana de Santiago;;552;19;Extranjero;7;2;;;133232981;73101700.0;Servicios de producción y fabricación industrial / Industrias de plásticos y productos químicos / Producción farmacéutica;73101701.0;Servicios de producción de medicamentos o medicinas;Servicios de producción y fabricación industrial;Industrias de plásticos y productos químicos;Producción farmacéutica;"119-0054	MELATONINA CPS 3MG                                                    
";119-0054	MELATONINA CPS 3MG     ;4000;Unidad;CLP;30;0;0;;120000;30 dias contra la recepcion conforme de la factura
49734797;1208129-18-SE24;http://www.mercadopublico.cl/PurchaseOrder/Modules/PO/DetailsPurchaseOrder.aspx?codigoOC=1208129-18-SE24;ARRULLO MEDICAMENTOS FEBRERO;CORRESPONDE A MEDICAMENTOS VARIOS PARA LOS NNA EN CREAD ARRULLO DURANTE FEBRERO. DESPACHAR A CALLE LA VIRGEN N°420 CONCEPCION, ENVIAR XML A CASILLA DIPRESRECEPCION@CUSTODIUM.COM. CDP N°20. DIRECCION FACTURACION CAUPOLICAN N°518, PISO 7, CONCEPCIÓN.;SE;Proveniente de licitación pública;No;No;8;SE;Sin emisión automática;12;Recepcion Conforme;7;Recepcion Conforme;2024-01-19;2024-01-22;2024-01-19;2024-01-19;2024-01-30;;1;0;0;2368397,5;CLP;2368397,5;378147,5;IVA;0;0;1990250;1208129;62.000.890-7;ADMINISTRACIÓN DIRECTA REGIÓN DEL BIOBÍO;1765960;SERVICIO NACIONAL DE PROTECCIÓN ESPECIALIZADA A LA NIÑEZ Y ADOLESCENCI;Otros;ADMINISTRACIÓN DIRECTA DR BIOBÍO;Concepción;Región del Biobío ;;930190;76.552.307-9;Drogueria Alemana;1523719;Drogueria Alemana;Drogueria;Concepción;Región del Biobío ;;;19;;7;2;1208129-6-LE22;;133246419;12162200.0;Productos químicos industriales / Aditivos / Anti-oxidantes;12162207.0;Melatonina;Productos químicos industriales;Aditivos;Anti-oxidantes;MELATONINA 3 MG X 30 TABLETAS;MELATONINA 3 MG X 30 TABLETAS;30;Caja;CLP;3150;0;0;0.0;94500;30 dias contra la recepcion conforme de la factura
49740698;1047027-100-SE24;http://www.mercadopublico.cl/PurchaseOrder/Modules/PO/DetailsPurchaseOrder.aspx?codigoOC=1047027-100-SE24;(JVF) MELATONINA 3MG. 1047027-1-LR23 ENERO;"PLAN DE COMPRAS ENERO 2024
ÍTEM 220400400102
________________________
HORARIO RECEPCION BODEGA FARMACIA
LUNES A JUEVES DE 08:00 A 16:30HRS.
VIERNES DE 08 A 15:00HRS.";SE;Proveniente de licitación pública;No;No;8;SE;Sin emisión automática;12;Recepcion Conforme;7;Recepcion Conforme;2024-01-22;2024-01-22;2024-01-22;2024-01-22;2024-01-23;;1;3,69354838709677;62;135660;CLP;135660;21660;IVA;0;0;114000;1047027;61.606.604-8;FARMACIA MEDICAMENTOS;7485;HOSPITAL DE QUILPUE;Salud;MEDICAMENTOS FARMACIA;Quilpué;Región de Valparaíso ;CL;261744;76.830.090-9;Caribean Pharma SpA;256360;FARMACEUTICA CARIBEAN LTDA;VENTA AL POR MAYOR DE ARTICULOS DE PERFUMERIA, COS;Renca;Región Metropolitana de Santiago;Chile;;19;CL;7;2;1047027-1-LR23;;133263897;12162200.0;Productos químicos industriales / Aditivos / Anti-oxidantes;12162207.0;Melatonina;Productos químicos industriales;Aditivos;Anti-oxidantes;[225V131] MELATONINA 3MG X 30 COMP;HOF0105 MELATONINA 3MG X 30 COMP., Melatonina 3 mg, F-26109/21, HOSPIFARMA, 01-08-2024, venc: 01-08-2024, Plazo de entrega de 24-48 hrs;3000;Unidad no definida;CLP;38;0;0;0.0;114000;30 dias contra la recepcion conforme de la factura
49744700;3864-39-SE24;http://www.mercadopublico.cl/PurchaseOrder/Modules/PO/DetailsPurchaseOrder.aspx?codigoOC=3864-39-SE24;COMPRA MEDICAMENTOS FCIA MUNICIPAL TU SANTA CRUZ;COMPRA MEDICAMENTOS FCIA MUNICIPAL ;SE;Contratación con titulares de derecho de propiedad intelectual o industrial;Si;No;8;SE;Sin emisión automática;6;Aceptada;4;Aceptada;2024-01-22;2024-01-22;2024-01-22;2024-01-22;2024-01-23;;1;0;0;785116,78;CLP;785116,78;125354,78;IVA;0;0;659762;4784;69.090.600-7;Salud Municipal;117584;I MUNICIPALIDAD DE SANTA CRUZ;Municipalidades;GOBIERNO CENTRAL Y ADMINISTRACION PUBLICA;Santa Cruz;Región del Libertador General Bernardo O´Higgins;CL;60314;96.599.510-2;EUROFARMA CHILE SPA;58731;MEDIPHARM S.A.;FABRICACION DE PRODUCTOS FARMACEUTICOS, SUSTANCIAS;Pudahuel;Región Metropolitana de Santiago;Chile;215.22.04.004.001.017;19;CL;7;2;;;133277955;51142200.0;Medicamentos y productos farmacéuticos / Medicamentos para el sistema nervioso central / Analgésicos narcóticos;51142226.0;Clorhidrato de metadona;Medicamentos y productos farmacéuticos;Medicamentos para el sistema nervioso central;Analgésicos narcóticos;20 MELATONINA 3MG (30 COMPRIMIDOS);;20;Unidad no definida;CLP;1259;0;0;0.0;25180;30 dias contra la recepcion conforme de la factura
49749328;748201-43-SE24;http://www.mercadopublico.cl/PurchaseOrder/Modules/PO/DetailsPurchaseOrder.aspx?codigoOC=748201-43-SE24;LIC: 748201-5-LQ23 BPH S.A. Valpo. Sinfa 12978;"SINFA N°12978
RESOLUCION N°66 FECHA 10/01/2024
FACTURAR: CAPREDENA
GIRO: VENTA AL POR MENOR DE PRODUCTOS FARMACÉUTICOS Y MEDICINALES EN COMERCIOS ESPECIALIZADOS.
DIRECCION FACTURA: PASEO BULNES 284 STGO.
DIRECCIÓN DESPACHO: AV. YUNGAY N° 1951 VALPARAISO 
MENCIONAR Nº OC EN LA FACTURA
NO SE RECEPCIONAN MERCAD. C/VENC.INF.12MESES
D.T.Q.F: SIGRID NEUMANN, FONO: 32/ 2455428
PARA CONSULTAS TÉCNICAS O DE PRECIO, FAVOR CONTACTARSE AL CORREO MSCHMIDT@CAPREDENA.CL O AL FONO 0228306503.
RECORDAR QUE ANTES DE FACTURAR, DEBE ACEPTAR LA O.C. EN EL PORTAL, EVITANDO RECLAMO DEL DTE.
ENVIAR ARCHIVO XML"" DEL DTE A LA CASILLA DE CORREO DE CAPREDENA: dipresrecepción@custodium.com
";SE;Proveniente de licitación pública;No;No;8;SE;Sin emisión automática;12;Recepcion Conforme;7;Recepcion Conforme;2024-01-23;2024-01-25;2024-01-25;2024-01-25;2024-01-26;;1;4,96;5;242760;CLP;242760;38760;IVA;0;0;204000;748201;61.108.000-k;Unidad de Compras Farmacia;7175;CAJA DE PREVISION DE LA DEFENSA NACIONAL;Gob. Central, Universidades;FARMACIAS INDEPENDIENTES| COMERCIO AL POR MENOR DE;Santiago;Región Metropolitana de Santiago;CL;44164;96.519.830-k;BPH S.A;43359;BPH S.A;VENTA AL POR MAYOR DE PRODUCTOS QUIMICOS;Quilicura;Región Metropolitana de Santiago;Chile;;19;CL;7;2;748201-5-LQ23;;133290824;85121900.0;Salud, servicios sanitarios y alimentación / Medicina y servicios de salud / Farmacéuticos;85121902.0;Farmacias;Salud, servicios sanitarios y alimentación;Medicina y servicios de salud;Farmacéuticos;MELATONINA 3 MG. 30 COMP.;MELATONINA 3 MG. 30 COMP.;170;Caja;CLP;1200;0;0;0.0;204000;30 dias contra la recepcion conforme de la factura
49751474;2389-12-AG24;http://www.mercadopublico.cl/PurchaseOrder/Modules/PO/DetailsPurchaseOrder.aspx?codigoOC=2389-12-AG24;Orden de Compra generada por invitación a compra ágil: 2389-19-COT24;Orden de Compra codigo: 2389-12-AG24 dirigida a SCM PHARMA SPA;AG;Adquisición igual o inferior a 30 UTM (Debe presentar 3 cotizaciones);Si;Si;13;AG;Compra Ágil;6;Aceptada;4;Aceptada;2024-01-23;2024-01-25;2024-01-25;2024-01-25;2024-01-25;;1;0;0;416500;CLP;416500;66500;IVA;0;0;350000;3381;69.191.600-6;Departamento de Salud;86943;I MUNICIPALIDAD DE PUCON;Municipalidades;VENTA AL POR MENOR DE OTROS PRODUCTOS EN PEQUENOS ALMACENES NO ESPECIA| HOTELES| RESTAURANTES| GOBIERNO CENTRAL| ESTABLECIMIENTOS DE ENSENANZA PRIMARIA;Pucón;Región de la Araucanía ;Extranjero;1185307;77.337.544-5;SCM;1773777;SCM PHARMA SPA;VENTA AL POR MAYOR DE PRODUCTOS FARMACEUTICOS Y MEDICINALES;Providencia;Región Metropolitana de Santiago;;;19;Extranjero;7;2;;;133297081;12162200.0;Productos químicos industriales / Aditivos / Anti-oxidantes;12162207.0;Melatonina;Productos químicos industriales;Aditivos;Anti-oxidantes;"Melatonina 3mg, cápsula	CONSIDERAR ANEXO DE CONDICIONES PARA OFERTAR
";;10000;Unidad;CLP;35;0;0;;350000;30 dias contra la recepcion conforme de la factura
49757911;748201-48-SE24;http://www.mercadopublico.cl/PurchaseOrder/Modules/PO/DetailsPurchaseOrder.aspx?codigoOC=748201-48-SE24;LIC: 748201-5-LQ23 BPH S.A. Stgo. Sinfa 3169;"SINFA N°3169
RESOLUCION N°66 FECHA 10/01/2024
FACTURAR: CAPREDENA
GIRO: VENTA AL POR MENOR DE PRODUCTOS FARMACÉUTICOS Y MEDICINALES EN COMERCIOS ESPECIALIZADOS.
DIRECCION FACTURA: PASEO BULNES 284 SANTIAGO.
DIRECCIÓN DESPACHO: PASEO BULNES N°284
MENCIONAR OC EN LA FACTURA	
NO SE RECEPCIONAN MERCAD.C/VENC.INF.12MESES
D.T.Q.F: ISLEN MANCILLA C., FONO: 24227810.
PARA CONSULTAS TÉCNICAS O DE PRECIO, FAVOR CONTACTARSE AL CORREO MSCHMIDT@CAPREDENA.CL O AL FONO 0228306503
RECORDAR QUE ANTES DE FACTURAR, DEBE ACEPTAR LA O.C. EN EL PORTAL, EVITANDO RECLAMO DEL DTE.
ENVIAR ARCHIVO XML"" DEL DTE A LA CASILLA DE CORREO DE CAPREDENA: dipresrecepción@custodium.com
";SE;Proveniente de licitación pública;No;No;8;SE;Sin emisión automática;12;Recepcion Conforme;7;Recepcion Conforme;2024-01-24;2024-01-25;2024-01-25;2024-01-25;2024-01-26;;1;4,96;5;727090;CLP;727090;116090;IVA;0;0;611000;748201;61.108.000-k;Unidad de Compras Farmacia;7175;CAJA DE PREVISION DE LA DEFENSA NACIONAL;Gob. Central, Universidades;FARMACIAS INDEPENDIENTES| COMERCIO AL POR MENOR DE;Santiago;Región Metropolitana de Santiago;CL;44164;96.519.830-k;BPH S.A;43359;BPH S.A;VENTA AL POR MAYOR DE PRODUCTOS QUIMICOS;Quilicura;Región Metropolitana de Santiago;Chile;;19;CL;7;2;748201-5-LQ23;;133318414;85121900.0;Salud, servicios sanitarios y alimentación / Medicina y servicios de salud / Farmacéuticos;85121902.0;Farmacias;Salud, servicios sanitarios y alimentación;Medicina y servicios de salud;Farmacéuticos;MELATONINA 3 MG. 30 COMP.;MELATONINA 3 MG. 30 COMP.;280;Caja;CLP;1200;0;0;0.0;336000;30 dias contra la recepcion conforme de la factura
49758679;1058095-341-AG24;http://www.mercadopublico.cl/PurchaseOrder/Modules/PO/DetailsPurchaseOrder.aspx?codigoOC=1058095-341-AG24;Orden de Compra generada por invitación a compra ágil: 1058095-107-COT24;"FARMACIA. COMPRA AGIL. COMPRA EXTRA PACIENTE S.C.E. 371755 I.P.: 220400400102.  DESDE 1058095-107-COT24.

Proveedor debe garantizar el despacho de la totalidad de la OC dentro de los próximos 1 días de enviada la OC.
El despacho de material sea con guía de despacho. Enviar facturas originales a casilla de intercambio en SII dipresrecepcion@custodium.com, la factura debe mencionar la orden de compra a la cual pertenece, para que sea recepcionada en bodega de Abastecimiento. ESTA ORDEN DE COMPRA ESTA AFECTA A MULTAS. 

Para cambios de productos deben ser retirados del CASR sin costo adicional.

";AG;Adquisición igual o inferior a 30 UTM (Debe presentar 3 cotizaciones);Si;Si;13;AG;Compra Ágil;12;Recepcion Conforme;7;Recepcion Conforme;2024-01-24;2024-01-25;2024-01-24;2024-01-24;2024-01-25;;1;4;31;7497;CLP;7497;1197;IVA;0;0;6300;1058095;61.608.502-6;Fármarcos;7320;COMPLEJO ASISTENCIAL DR. SOTERO DEL RIO;Salud;Servicio Público;Puente Alto;Región Metropolitana de Santiago;Extranjero;23690;80.447.400-5;MUNNICH PHARMA MEDICAL SPA;24141;MUNNICH PHARMA MEDICAL SPA;VENTA AL POR MAYOR DE PRODUCTOS FARMACEUTICOS| VENTA AL POR MAYOR DE OTROS PRODUCTOS N.C.P.;Quilicura;Región Metropolitana de Santiago;;;19;Extranjero;7;2;;;133318865;12162200.0;Productos químicos industriales / Aditivos / Anti-oxidantes;12162207.0;Melatonina;Productos químicos industriales;Aditivos;Anti-oxidantes;"50-214-800-036-00	MELATONINA 3MG
";;180;Comprimido;CLP;35;0;0;;6300;30 dias contra la recepcion conforme de la factura
49761020;3740-4-AG24;http://www.mercadopublico.cl/PurchaseOrder/Modules/PO/DetailsPurchaseOrder.aspx?codigoOC=3740-4-AG24;Orden de Compra generada por invitación a compra ágil: 3740-1-COT24;Orden de Compra codigo: 3740-4-AG24 dirigida a SCM PHARMA SPA;AG;Adquisición igual o inferior a 30 UTM (Debe presentar 3 cotizaciones);Si;Si;13;AG;Compra Ágil;6;Aceptada;4;Aceptada;2024-01-24;2024-01-26;2024-01-26;2024-01-26;2024-01-26;;1;0;0;944503;CLP;944503;150803;IVA;0;0;793700;4660;69.030.700-6;Depto. Salud;116406;I MUNICIPALIDAD DE HUASCO;Municipalidades;GOBIERNO CENTRAL;Huasco;Región de Atacama ;Extranjero;1185307;77.337.544-5;SCM;1773777;SCM PHARMA SPA;VENTA AL POR MAYOR DE PRODUCTOS FARMACEUTICOS Y MEDICINALES;Providencia;Región Metropolitana de Santiago;;00001;19;Extranjero;7;2;;;133326089;12162200.0;Productos químicos industriales / Aditivos / Anti-oxidantes;12162207.0;Melatonina;Productos químicos industriales;Aditivos;Anti-oxidantes;3000 COMPRIMIDOS DE MELATONINA DE 3 MG;;3000;Comprimido;CLP;35;0;0;;105000;30 dias contra la recepcion conforme de la factura
49765255;3980-9-SE24;http://www.mercadopublico.cl/PurchaseOrder/Modules/PO/DetailsPurchaseOrder.aspx?codigoOC=3980-9-SE24;ORDEN DE COMPRA DESDE 3980-3-LE24;Adquisición medicamentos Farmacia Popular Peumo DESDE 3980-3-LE24;SE;Proveniente de licitación pública;No;No;8;SE;Sin emisión automática;6;Aceptada;4;Aceptada;2024-01-25;2024-01-25;2024-01-25;2024-01-25;2024-01-25;;1;4;31;2307000,64;CLP;2307000,64;368344,64;IVA;0;0;1938656;4900;69.080.900-1;Salud;118861;I MUNICIPALIDAD DE PEUMO;Municipalidades;;Peumo;Región del Libertador General Bernardo O´Higgins;CL;23690;80.447.400-5;MUNNICH PHARMA MEDICAL SPA;24141;MUNNICH PHARMA MEDICAL SPA;VENTA AL POR MAYOR DE PRODUCTOS FARMACEUTICOS| VEN;QUILICURA;METROPOLITANA;Chile;2152204004;19;CL;7;2;3980-3-LE24;;133337796;12162200.0;Productos químicos industriales / Aditivos / Anti-oxidantes;12162207.0;Melatonina;Productos químicos industriales;Aditivos;Anti-oxidantes;Melatonina 3 mg x 30 capsulas;"274564 MELATONINA CAPSULAS 3MG.30 - CAJA POR 30 CAPSULAS - SEDANTES: F-21660 - ARAMA - VIGENCIA SUPERIOR A 24 MESES, SE ADJUNTA FICHA TECNICA. 
SE ADJUNTA CARTA DE CANJE.
DESPACHO EN 24 HORAS
VENCIMIENTO 05-2026
EL DESPACHO NO TIENE COSTO ADICIONAL.
";5;Caja;CLP;1050;0;0;0.0;5250;30 dias contra la recepcion conforme de la factura
49766234;2766-99-AG24;http://www.mercadopublico.cl/PurchaseOrder/Modules/PO/DetailsPurchaseOrder.aspx?codigoOC=2766-99-AG24;MDC HEALTH SPA Compra Agil: 2766-70-COT24;"MEMO 072 DEL 04/01/2024 PO 5/4 DEL 08/04/24
DESPACHADO AVENIDA PEDRO AGUIRRE CERDA 0161. FARMACIA MUNICIPAL LA CISTERNA
CONTACTO: SANDRA BALMACEDA OVALLE        MOVIL: 997015316     ";AG;Adquisición igual o inferior a 30 UTM (Debe presentar 3 cotizaciones);Si;Si;13;AG;Compra Ágil;12;Recepcion Conforme;7;Recepcion Conforme;2024-01-25;2024-01-25;2024-01-25;2024-01-25;2024-01-30;;1;0;0;310590;CLP;310590;49590;IVA;0;0;261000;3755;69.072.000-0;SALUD;100488;I MUNICIPALIDAD DE LA CISTERNA;Municipalidades;GOBIERNO CENTRAL Y ADMINISTRACION PUBLICA;La Cisterna;Región Metropolitana de Santiago;Extranjero;1152378;76.986.924-7;MDC HEALTH;1741827;MDC HEALTH SPA;OTRAS ACTIVIDADES DE VENTA AL POR MENOR EN COMERCIOS NO ESPECIALIZADOS;Providencia;Región Metropolitana de Santiago;;2152204004002;19;Extranjero;7;2;;;133340977;85121900.0;Salud, servicios sanitarios y alimentación / Medicina y servicios de salud / Farmacéuticos;85121902.0;Farmacias;Salud, servicios sanitarios y alimentación;Medicina y servicios de salud;Farmacéuticos;"MELATONINA 3 mg. cajas x 30 CAP. ; VENCIMIENTO 08/2026 ; Despacho 48 hrs; contacto :  REG. ISP F-27758/23 ";"MELATONINA 3 mg. cajas x 30 CAP. ; VENCIMIENTO 08/2026 ; Despacho 48 hrs; contacto :  REG. ISP F-27758/23 ";300;Caja;CLP;870;0;0;;261000;30 dias contra la recepcion conforme de la factura
49766672;4172-60-SE24;http://www.mercadopublico.cl/PurchaseOrder/Modules/PO/DetailsPurchaseOrder.aspx?codigoOC=4172-60-SE24;ORDEN DE COMPRA DESDE 4172-4-LE24;"MEDICAMENTOS FARMACIA POPULAR DESDE 4172-4-LE24
MMN°2675
DECRETO N°311/22.01.24";SE;Proveniente de licitación pública;No;No;8;SE;Sin emisión automática;6;Aceptada;4;Aceptada;2024-01-25;2024-01-25;2024-01-25;2024-01-25;2024-01-25;;1;4;31;3464873,02;CLP;3464873,02;553215,02;IVA;0;0;2911658;5091;69.130.500-7;Salud;124195;ILUSTRE MUNICIPALIDAD DE COLBUN;Municipalidades;ACTIVIDADES DE ASESORAMIENTO EMPRESARIAL Y EN MATERIA DE GESTION| OTRAS ACTIVIDADES DE SERVICIOS PERSONALES N.C.P.;Colbún;Región del Maule ;CL;23690;80.447.400-5;MUNNICH PHARMA MEDICAL SPA;24141;MUNNICH PHARMA MEDICAL SPA;VENTA AL POR MAYOR DE PRODUCTOS FARMACEUTICOS| VEN;;;Chile;2152204004;19;CL;21;2;4172-4-LE24;;133342556;12162200.0;Productos químicos industriales / Aditivos / Anti-oxidantes;12162207.0;Melatonina;Productos químicos industriales;Aditivos;Anti-oxidantes;Melatonina 3 mg x 30 capsulas;274564 MELATONINA CAPSULAS 3MG.30 - CAJA POR 30 CAPSULAS - SEDANTES: F-21660 - ARAMA - VIGENCIA SUPERIOR A 24 MESES, ;30;Caja;CLP;1050;0;0;0.0;31500;30 dias contra la recepcion conforme de la factura
49781095;1069417-56-SE24;http://www.mercadopublico.cl/PurchaseOrder/Modules/PO/DetailsPurchaseOrder.aspx?codigoOC=1069417-56-SE24;COMPRA DE MEDICAMENTOS PARA DISAMU CHILLAN;"SOLICITUD Nº: 3
Nº DE PRE-OBLIGACION: 343
_______________________________
FACTURAR AL RUT: 69.270.200-K
CON CARGO A CUENTA 2152204004, CdeC:
SRN 010102: $ 1.370.880
IR 010103: $ 628.320 
UE 010104: $ 171.360 
LV 010105: $ 354.144 
Q 010106: $ 85.680 
CATO 010107: $ 20.563 
SDO 010110: $ 38.842 
DESPACHAR A POBLACION VILLA KENNEDY, PJE 9, CASA 23, CHILLAN
PLAZO DE ENTREGA: 03 DÍAS HÁBILES, según licitación 1069417-80-LR23, se contará desde el segundo día hábil siguiente a la fecha de envío de la OC a proveedor.
";SE;Proveniente de licitación pública;No;No;8;SE;Sin emisión automática;12;Recepcion Conforme;7;Recepcion Conforme;2024-01-29;2024-01-30;2024-01-30;2024-03-08;2024-02-06;;1;0;0;2669788,8;CLP;2669788,8;426268,8;IVA;0;0;2243520;1069417;69.270.200-k;Dirección  de Salud Municipal Chillán;88254;I MUNICIPALIDAD DE CHILLAN;Municipalidades;Salud Municipal;Chillán;Región del Ñuble;;677833;76.070.033-9;ARAMA NATURAL PRODUCTS DISTRIBUIDORA LIMITADA;1279538;ARAMA NATURAL PRODUCTS DISTRIBUIDORA LIMITADA;VENTA AL POR MAYOR DE OTROS PRODUCTOS N.C.P.| SERV;Pudahuel;Región Metropolitana de Santiago;Chile;;19;;7;2;1069417-80-LR23;;133383710;12162200.0;Productos químicos industriales / Aditivos / Anti-oxidantes;12162207.0;Melatonina;Productos químicos industriales;Aditivos;Anti-oxidantes;"MELATONINA COMPRIMIDOS 3 MG
";;70110;Comprimido;CLP;32;0;0;0.0;2243520;30 dias contra la recepcion conforme de la factura
49784653;1047027-128-SE24;http://www.mercadopublico.cl/PurchaseOrder/Modules/PO/DetailsPurchaseOrder.aspx?codigoOC=1047027-128-SE24;(JVF) MELATONINA 3MG. 1047027-1-LR23 FEBRERO;"PLAN DE COMPRAS FEBRERO 2024
ÍTEM 220400400102
________________________
HORARIO RECEPCION BODEGA FARMACIA
LUNES A JUEVES DE 08:00 A 16:30HRS.
VIERNES DE 08 A 15:00HRS.";SE;Proveniente de licitación pública;No;No;8;SE;Sin emisión automática;12;Recepcion Conforme;7;Recepcion Conforme;2024-01-29;2024-01-30;2024-01-29;2024-01-29;2024-01-30;;1;3,69354838709677;62;135660;CLP;135660;21660;IVA;0;0;114000;1047027;61.606.604-8;FARMACIA MEDICAMENTOS;7485;HOSPITAL DE QUILPUE;Salud;MEDICAMENTOS FARMACIA;Quilpué;Región de Valparaíso ;CL;261744;76.830.090-9;Caribean Pharma SpA;256360;FARMACEUTICA CARIBEAN LTDA;VENTA AL POR MAYOR DE ARTICULOS DE PERFUMERIA, COS;Renca;Región Metropolitana de Santiago;Chile;;19;CL;7;2;1047027-1-LR23;;133395121;12162200.0;Productos químicos industriales / Aditivos / Anti-oxidantes;12162207.0;Melatonina;Productos químicos industriales;Aditivos;Anti-oxidantes;[225V131] MELATONINA 3MG X 30 COMP;HOF0105 MELATONINA 3MG X 30 COMP., Melatonina 3 mg, F-26109/21, HOSPIFARMA, 01-08-2024, venc: 01-08-2024, Plazo de entrega de 24-48 hrs;3000;Unidad no definida;CLP;38;0;0;0.0;114000;30 dias contra la recepcion conforme de la factura
49788254;1070620-986-AG24;http://www.mercadopublico.cl/PurchaseOrder/Modules/PO/DetailsPurchaseOrder.aspx?codigoOC=1070620-986-AG24;YJF-ESZOPLICONA 3 MG COMPRIMIDO/FARMACIA compra ágil: 1070620-418-COT24;"YJF-ESZOPLICONA 3 MG COMPRIMIDO/FARMACIA compra ágil: 1070620-418-COT24

Orden de Compra código: 1070620-986-AG24 dirigida a SCM PHARMA SPA";AG;Adquisición igual o inferior a 30 UTM (Debe presentar 3 cotizaciones);Si;Si;13;AG;Compra Ágil;6;Aceptada;4;Aceptada;2024-01-30;2024-01-30;2024-01-30;2024-01-30;2024-01-30;;1;0;0;446250;CLP;446250;71250;IVA;0;0;375000;1070620;62.000.530-4;Hospital Dr. Ernesto Torres Galdames;1662264;HOSPITAL DOCTOR ERNESTO TORRES GALDAMES;Salud;SERVICIO PUBLICO;Iquique;Región de Tarapacá  ;Extranjero;1185307;77.337.544-5;SCM;1773777;SCM PHARMA SPA;VENTA AL POR MAYOR DE PRODUCTOS FARMACEUTICOS Y MEDICINALES;Providencia;Región Metropolitana de Santiago;;1707;19;Extranjero;7;2;;;133406503;12162200.0;Productos químicos industriales / Aditivos / Anti-oxidantes;12162207.0;Melatonina;Productos químicos industriales;Aditivos;Anti-oxidantes;ESZOPLICONA 3 MG COMPRIMIDO (2210144);Se adjunta cotización detallada, Contacto F. 225104550, Despacho sin costo, Envio en 72 horas- monto mínimo de despacho $ 100.000 neto- Cotización valida por 15 días.;3000;Unidad;CLP;125;0;0;;375000;30 dias contra la recepcion conforme de la factura
