51861548;3776-1047-SE24;http://www.mercadopublico.cl/PurchaseOrder/Modules/PO/DetailsPurchaseOrder.aspx?codigoOC=3776-1047-SE24;Medicamentos para ayudas sociales, mes de diciembre.-;Se requiere la adquisición de medicamentos para ayudas sociales mes de diciembre, según Orden de Pedido N°50006. Decreto N°2604 de fecha 10 de diciembre de 2024.(ítem: 215-24-01-007-000-000) ;SE;Orden de Compra para informar;No;No;8;SE;Sin emisión automática;12;Recepcion Conforme;7;Recepcion Conforme;2024-12-10;2024-12-20;2024-12-19;2024-12-19;2024-12-23;;1;0;0;5224220,19;CLP;5224220,19;834119,19;IVA;0;2;4390099;4696;69.060.500-7;UNIDAD DE ADMINISTRACIÓN Y FINANZAS;116733;I MUNICIPALIDAD DE HIJUELAS;Municipalidades;GOBIERNO CENTRAL Y ADMINISTRACION PUBLICA| OTRAS ACTIVIDADES DE SERVICIOS PERSONALES N.C.P.;Hijuelas;Región de Valparaíso ;CL;1069676;76.824.459-6;Maria Antonieta;1661340;Maria Antonieta;Farmacia Independiente;Hijuelas;Región de Valparaíso ;Chile;986;19;CL;22;2;;;139538664.0;51161800.0;Medicamentos y productos farmacéuticos / Medicamentos para el tracto respiratorio / Productos para tos, resfriados y antialérgicos;51161812.0;Combinación clorfeniramina-acetaminofeno;Medicamentos y productos farmacéuticos;Medicamentos para el tracto respiratorio;Productos para tos, resfriados y antialérgicos;Melatonina 3 mg x 30 comprimidos ;Melatonina 3 mg x 30 comprimidos ;1;Unidad no definida;CLP;2933;0;0;0.0;2933;30 dias contra la recepcion conforme de la factura
51868791;1216062-1162-SE24;http://www.mercadopublico.cl/PurchaseOrder/Modules/PO/DetailsPurchaseOrder.aspx?codigoOC=1216062-1162-SE24;S.C. N°813 Req. N°139 medicamentos ;"S.C. N°813 Req. N°139 medicamentos 

NOTA: LA FACTURACIÓN , DEBE SER REMITIDA A LOS SIGUIENTES CORREOS ELECTRONICOS: OFICINADEPARTES@CORPORACIONLOPRADO.CL    EDUARDO.TORRES@CORPORACIONLOPRADO.CL
HORARIO LUNES A JUEVES DESDE LAS 8:30 HASTA LAS 17:00 

VIERNES DESDE LAS 8:30 HASTA LAS 16:00, REVISAR LA DISTRIBUCION DE DESPACHO EN DOCUMENTO ADJUNTO.";SE;Proveniente de licitación pública;No;No;8;SE;Sin emisión automática;12;Recepcion Conforme;7;Recepcion Conforme;2024-12-13;2024-12-23;2024-12-20;2024-12-23;2024-12-23;;1;0;0;1337750,4;CLP;1337750,4;213590,4;IVA;0;0;1124160;1216062;71.265.200-4;Corporación Municipal de Lo Prado;1803791;Corporación Municipal de Lo Prado;Otros;Actividades de otras asociaciones N.C.P. y venta por menor de productos;Lo Prado;Región Metropolitana de Santiago;CL;677833;76.070.033-9;ARAMA NATURAL PRODUCTS DISTRIBUIDORA LIMITADA;1279538;ARAMA NATURAL PRODUCTS DISTRIBUIDORA LIMITADA;VENTA AL POR MAYOR DE OTROS PRODUCTOS N.C.P.| SERV;Pudahuel;Región Metropolitana de Santiago;Chile;percapita salud;19;CL;7;2;1216062-13-LR23;;139556953.0;12162200.0;Productos químicos industriales / Aditivos / Anti-oxidantes;12162207.0;Melatonina;Productos químicos industriales;Aditivos;Anti-oxidantes;"Melatonina 3 mg Comprimidos
";;35130;Comprimido;CLP;32;0;0;0.0;1124160;30 dias contra la recepcion conforme de la factura
51879913;948356-4901-SE24;http://www.mercadopublico.cl/PurchaseOrder/Modules/PO/DetailsPurchaseOrder.aspx?codigoOC=948356-4901-SE24;PEDIDO FARMACIA;"
Despacho urgente 
Recepción de mercadería en la Bodega Central será el siguiente:
	Lunes a jueves de 08:00 a 15:00 hrs.
	Viernes de 08:00 a 13:00 hrs.
";SE;Proveniente de licitación pública;No;No;8;SE;Sin emisión automática;12;Recepcion Conforme;7;Recepcion Conforme;2024-12-16;2024-12-16;2024-12-16;2024-12-16;2024-12-17;;1;0;0;541212;CLP;541212;86412;IVA;0;0;454800;948356;61.513.003-6;Unidad de Compra Fármacos Nutrición y Reactivos;220665;FONDO HOSPITAL DE LA DIRECCION DE PREVISION DE CARABINEROS DE CHILE;FFAA;;* ;Región Metropolitana de Santiago;CL;668273;76.091.301-4;LABORATORIOS BIOPAS S.A.;1270266;LABORATORIOS BIOPAS S.A.;VENTA AL POR MAYOR DE OTROS PRODUCTOS N.C.P.| OTRA;Huechuraba;Región Metropolitana de Santiago;Chile;15789;19;CL;7;2;948356-50-LE23;;139589534.0;12162200.0;Productos químicos industriales / Aditivos / Anti-oxidantes;12162207.0;Melatonina;Productos químicos industriales;Aditivos;Anti-oxidantes;MELATONINA 2 MG COMP. LIB. PROLONG. HOSDIP AA4402 ;Laboratorios Biopas S.A. Nombre comercial Vigisom 2 mg LP Caja x 30 comprimidos;600;Comprimido;CLP;758;0;0;0.0;454800;30 dias contra la recepcion conforme de la factura
51885659;1058071-1526-SE24;http://www.mercadopublico.cl/PurchaseOrder/Modules/PO/DetailsPurchaseOrder.aspx?codigoOC=1058071-1526-SE24;MELATONINA 3MG COMPRIMIDO;"PLAN DE COMPRAS TRAER ORDEN DE COMPRA despacho previa coordinación con bodega
ashley.sotomayor@redsalud.gob.cl 226120526
RECEPCION A PROVEEDORES LUNES A JUEVES   08:00 AM   - 14:00 PM. VIERNES      
08:00 AM    - 13:00 PM.

";SE;Proveniente de licitación pública;No;No;8;SE;Sin emisión automática;12;Recepcion Conforme;7;Recepcion Conforme;2024-12-17;2024-12-17;2024-12-17;2024-12-17;2024-12-17;;1;3,27027027027027;37;124950;CLP;124950;19950;IVA;0;0;105000;1058071;61.980.320-5;Fármarcos;1379869;HOSPITAL CLINICO METROPOLITANO EL CARMEN DOCTOR LUIS VALENTIN FERRADA;Salud;Servicio Público;* ;Región Metropolitana de Santiago;CL;275627;76.956.140-4;ETHON PHARMACEUTICALS SPA.;269948;ETHON PHARMACEUTICALS  COMERCIALIZADORA  IMP EXP Y DIST SPA;VENTA AL POR MAYOR DE ARTICULOS DE PERFUMERIA, COS;Rancagua;Región del Libertador General Bernardo O´Higgins;Chile;;19;CL;7;2;1058071-12-LE24;;139602954.0;73101700.0;Servicios de producción y fabricación industrial / Industrias de plásticos y productos químicos / Producción farmacéutica;73101701.0;Servicios de producción de medicamentos o medicina;Servicios de producción y fabricación industrial;Industrias de plásticos y productos químicos;Producción farmacéutica;"5560023	MELATONINA 3MG COMPRIMIDO
";MLTN0003COMP. MELATONINA 3MG X 30 CAP.. MDC HEALTH SPA.. MELATONINA. REG ISP F-25890. VCTO 05-2025. LOTE MA3F016 -- 7804673040058, Entrega 24 horas CONTADAS DESDE LA FECHA DE ENVIO DE LA OC . Se adjunta CANJE . Sin costo por flete. sin monto mínimo d;3000;Comprimido;CLP;35;0;0;0.0;105000;30 dias contra la recepcion conforme de la factura
51891798;3561-974-AG24;http://www.mercadopublico.cl/PurchaseOrder/Modules/PO/DetailsPurchaseOrder.aspx?codigoOC=3561-974-AG24;MEDICAMENTOS CONVENIO ATENCIÓN INTEGRAL AL DESARROLLO INFANTO ADOLESCENTE.;"Orden de Compra codigo: 3561-974-AG24 dirigida a GOAT PHARMA SPA
HORARIO RECEPCIÓN DE DESPACHO 
LUNES A VIERNES 08:30 A 16:00 HRS,";AG;Adquisición igual o inferior a 30 UTM (Debe presentar 3 cotizaciones);Si;Si;13;AG;Compra Ágil;6;Aceptada;4;Aceptada;2024-12-17;2024-12-17;2024-12-17;2024-12-17;2024-12-19;;1;0;0;1157727,2;CLP;1157727,2;184847,2;IVA;0;0;972880;4481;69.060.300-4;Departamento de Salud Municipal;115185;I MUNICIPALIDAD DE LA CALERA;Municipalidades;GOBIERNO CENTRAL Y ADMINISTRACION PUBLICA;La Calera;Región de Valparaíso ;Extranjero;1265254;77.673.367-9;GOAT PHARMA;1851150;GOAT PHARMA SPA;VENTA AL POR MAYOR DE PRODUCTOS FARMACEUTICOS Y MEDICINALES;Macul;Región Metropolitana de Santiago;;2152204004003;19;Extranjero;7;2;;;139621369.0;12162200.0;Productos químicos industriales / Aditivos / Anti-oxidantes;12162207.0;Melatonina;Productos químicos industriales;Aditivos;Anti-oxidantes;UNIDADES DE COMPRIMIDOS DE MELATONINA 3 MG. FECHA DE VENCIMIENTO SUPERIOR Ó IGUALA 24 MESES.;;2000;Comprimido;CLP;48;0;0;;96000;30 dias contra la recepcion conforme de la factura
51895109;3696-497-SE24;http://www.mercadopublico.cl/PurchaseOrder/Modules/PO/DetailsPurchaseOrder.aspx?codigoOC=3696-497-SE24;ORDEN DE COMPRA DESDE 3696-27-L124;Medicamentos Farmacia Municipal DESDE 3696-27-L124;SE;Proveniente de licitación pública;No;No;8;SE;Sin emisión automática;12;Recepcion Conforme;7;Recepcion Conforme;2024-12-18;2024-12-18;2024-12-18;2024-12-18;2024-12-18;;1;3,27027027027027;37;252201,46;CLP;252201,46;40267,46;IVA;0;0;211934;4616;69.100.300-0;Departamento De Salud;116299;I MUNICIPALIDAD DE TENO;Municipalidades;GOBIERNO CENTRAL Y ADMINISTRACION PUBLICA;Teno;Región del Maule ;CL;275627;76.956.140-4;ETHON PHARMACEUTICALS SPA.;269948;ETHON PHARMACEUTICALS  COMERCIALIZADORA  IMP EXP Y DIST SPA;VENTA AL POR MAYOR DE ARTICULOS DE PERFUMERIA, COS;Rancagua;Región del Libertador General Bernardo O´Higgins;Chile;215-22-04-004-000-000;19;CL;7;2;3696-27-L124;;139631320.0;51161800.0;Medicamentos y productos farmacéuticos / Medicamentos para el tracto respiratorio / Productos para tos, resfriados y antialérgicos;51161812.0;Combinación clorfeniramina-acetaminofeno;Medicamentos y productos farmacéuticos;Medicamentos para el tracto respiratorio;Productos para tos, resfriados y antialérgicos;Melatonina 3 mg x 30 comp;MLTN0003COMP. MELATONINA 3MG X 30 COMP.. EUROFARMA. MELATONINA. REG ISP F-25847. VCTO 07-2026. LOTE . LOTE 0707824 -- 7800046005167;6;Caja;CLP;1047;0;0;0.0;6282;30 dias contra la recepcion conforme de la factura
51898919;3754-556-SE24;http://www.mercadopublico.cl/PurchaseOrder/Modules/PO/DetailsPurchaseOrder.aspx?codigoOC=3754-556-SE24;ORDEN DE COMPRA DESDE 3754-35-L124;Adquisicion Medicamentos para Farmacia Municipal DESDE 3754-35-L124;SE;Proveniente de licitación pública;No;No;8;SE;Sin emisión automática;5;En proceso;2;En proceso;2024-12-18;2024-12-18;2024-12-18;2024-12-18;;;1;4;31;691422,13;CLP;691422,13;110395,13;IVA;0;0;581027;4674;69.041.300-0;SALUD;84473;I MUNICIPALIDAD DE CANELA;Municipalidades;GOBIERNO CENTRAL Y ADMINISTRACION PUBLICA;Canela;Región de Coquimbo ;CL;23690;80.447.400-5;MUNNICH PHARMA MEDICAL SPA;24141;MUNNICH PHARMA MEDICAL SPA;VENTA AL POR MAYOR DE PRODUCTOS FARMACEUTICOS| VEN;;;Chile;2152204004;19;CL;7;2;3754-35-L124;;139642569.0;12162200.0;Productos químicos industriales / Aditivos / Anti-oxidantes;12162207.0;Melatonina;Productos químicos industriales;Aditivos;Anti-oxidantes;Se requiere adquirir Melatonina 3MG/Caps /Caja;274564 MELATONINA CAPSULAS 3 MG. CAJA POR 30 CAPSULAS - SEDANTES: F-21660 - ARAMA - VCTO. 01-2027;10;Caja;CLP;1050;0;0;0.0;10500;30 dias contra la recepcion conforme de la factura
51898920;3754-557-SE24;http://www.mercadopublico.cl/PurchaseOrder/Modules/PO/DetailsPurchaseOrder.aspx?codigoOC=3754-557-SE24;ORDEN DE COMPRA DESDE 3754-35-L124;Adquisicion Medicamentos para Farmacia Municipal DESDE 3754-35-L124;SE;Proveniente de licitación pública;No;No;8;SE;Sin emisión automática;6;Aceptada;4;Aceptada;2024-12-18;2024-12-18;2024-12-18;2024-12-18;2024-12-19;;1;3,69354838709677;62;184812,95;CLP;184812,95;29507,95;IVA;0;0;155305;4674;69.041.300-0;SALUD;84473;I MUNICIPALIDAD DE CANELA;Municipalidades;GOBIERNO CENTRAL Y ADMINISTRACION PUBLICA;Canela;Región de Coquimbo ;CL;261744;76.830.090-9;Caribean Pharma SpA;256360;FARMACEUTICA CARIBEAN LTDA;VENTA AL POR MAYOR DE ARTICULOS DE PERFUMERIA, COS;Renca;Región Metropolitana de Santiago;Chile;2152204004;19;CL;7;2;3754-35-L124;;139642578.0;12162200.0;Productos químicos industriales / Aditivos / Anti-oxidantes;12162207.0;Melatonina;Productos químicos industriales;Aditivos;Anti-oxidantes;Se Requiere adqquirir Melatonina 3MG/ML/Fco;ARA0001 CIRCALIFE 3MG/ML SOL. ORAL X 30 ML FCO. GOT., MELATONINA 3 mg/mL, F-25907/21, ARAMA, 01-01-2026, venc: 01-01-2026, Plazo de entrega de 48 hrs;6;Frasco;CLP;4572;0;0;0.0;27432;30 dias contra la recepcion conforme de la factura
51910180;3501-377-AG24;http://www.mercadopublico.cl/PurchaseOrder/Modules/PO/DetailsPurchaseOrder.aspx?codigoOC=3501-377-AG24;Orden de Compra generada por invitación a compra ágil: 3501-241-COT24;"Orden de Compra codigo: 3501-377-AG24 dirigida a SCM PHARMA SPA

Justificación selección de cotización menos económica: Conforme a instancia N° 1 de los términos de referencia y demás fundamentos expuestos en el acta Eva";AG;Adquisición igual o inferior a 30 UTM (Debe presentar 3 cotizaciones);Si;Si;13;AG;Compra Ágil;6;Aceptada;4;Aceptada;2024-12-19;2024-12-19;2024-12-19;2024-12-24;2024-12-20;;1;0;0;3737397,3;CLP;3737397,3;596727,3;IVA;0;0;3140670;4422;69.081.700-4;Departamento de Salud;115010;I MUNICIPALIDAD DE QUINTA DE TILCOCO;Municipalidades;GOBIERNO CENTRAL Y ADMINISTRACION PUBLICA| ACTIVIDADES DE CLUBES DE DEPORTES Y ESTADIOS;Quinta de Tilcoco;Región del Libertador General Bernardo O´Higgins;Extranjero;1185307;77.337.544-5;SCM;1773777;SCM PHARMA SPA;VENTA AL POR MAYOR DE PRODUCTOS FARMACEUTICOS Y MEDICINALES;Providencia;Región Metropolitana de Santiago;;215.22.04.004;19;Extranjero;7;2;;;139675477.0;12162200.0;Productos químicos industriales / Aditivos / Anti-oxidantes;12162207.0;Melatonina;Productos químicos industriales;Aditivos;Anti-oxidantes;Fluoxetina 20 mg, conforme a términos de referencia adjuntos ;;1000;Comprimido;CLP;22;0;0;;22000;30 dias contra la recepcion conforme de la factura
51910180;3501-377-AG24;http://www.mercadopublico.cl/PurchaseOrder/Modules/PO/DetailsPurchaseOrder.aspx?codigoOC=3501-377-AG24;Orden de Compra generada por invitación a compra ágil: 3501-241-COT24;"Orden de Compra codigo: 3501-377-AG24 dirigida a SCM PHARMA SPA

Justificación selección de cotización menos económica: Conforme a instancia N° 1 de los términos de referencia y demás fundamentos expuestos en el acta Eva";AG;Adquisición igual o inferior a 30 UTM (Debe presentar 3 cotizaciones);Si;Si;13;AG;Compra Ágil;6;Aceptada;4;Aceptada;2024-12-19;2024-12-19;2024-12-19;2024-12-24;2024-12-20;;1;0;0;3737397,3;CLP;3737397,3;596727,3;IVA;0;0;3140670;4422;69.081.700-4;Departamento de Salud;115010;I MUNICIPALIDAD DE QUINTA DE TILCOCO;Municipalidades;GOBIERNO CENTRAL Y ADMINISTRACION PUBLICA| ACTIVIDADES DE CLUBES DE DEPORTES Y ESTADIOS;Quinta de Tilcoco;Región del Libertador General Bernardo O´Higgins;Extranjero;1185307;77.337.544-5;SCM;1773777;SCM PHARMA SPA;VENTA AL POR MAYOR DE PRODUCTOS FARMACEUTICOS Y MEDICINALES;Providencia;Región Metropolitana de Santiago;;215.22.04.004;19;Extranjero;7;2;;;139675476.0;51141700.0;Medicamentos y productos farmacéuticos / Medicamentos para el sistema nervioso central / Agentes antipsicóticos;51141704.0;Risperidona;Medicamentos y productos farmacéuticos;Medicamentos para el sistema nervioso central;Agentes antipsicóticos;Melatonina 3 mg, conforme a términos de referencia adjuntos ;;1650;Comprimido;CLP;37;0;0;;61050;30 dias contra la recepcion conforme de la factura
51910751;3864-664-TD24;http://www.mercadopublico.cl/PurchaseOrder/Modules/PO/DetailsPurchaseOrder.aspx?codigoOC=3864-664-TD24;Orden de Compra generada por Trato Directo ID 3864-24-FTD24;COMPRA MEDICAMENTOS PARA FCIA MUNICIPAL ;TD;Contratación con titulares de derecho de propiedad intelectual o industrial;Si;No;16;TD;Proveniente de Ficha de Trato Directo;6;Aceptada;4;Aceptada;2024-12-19;2024-12-20;2024-12-19;2024-12-19;2024-12-20;;1;0;0;1596753,9;CLP;1596753,9;254943,9;IVA;0;0;1341810;4784;69.090.600-7;Salud Municipal;117584;I MUNICIPALIDAD DE SANTA CRUZ;Municipalidades;GOBIERNO CENTRAL Y ADMINISTRACION PUBLICA;Santa Cruz;Región del Libertador General Bernardo O´Higgins;Extranjero;60314;96.599.510-2;EUROFARMA CHILE SPA;58731;MEDIPHARM S.A.;FABRICACION DE PRODUCTOS FARMACEUTICOS, SUSTANCIAS QUIMICAS MEDICINALE;María Elena;Región Metropolitana de Santiago;;215.22.04.004.001.017;19;Extranjero;7;2;;;139677828.0;51191900.0;Medicamentos y productos farmacéuticos / Agentes que afectan el agua y los electrolitos / Suplementos dietéticos y productos de terapia alimenticia;51191905.0;Suplementos vitamínicos;Medicamentos y productos farmacéuticos;Agentes que afectan el agua y los electrolitos;Suplementos dietéticos y productos de terapia alimenticia;30 MELATONINA 3MG (30 COMPRIMIDOS);;30;Caja;CLP;1170;0;0;;35100;30 dias contra la recepcion conforme de la factura
51916596;2708-1178-AG24;http://www.mercadopublico.cl/PurchaseOrder/Modules/PO/DetailsPurchaseOrder.aspx?codigoOC=2708-1178-AG24;Orden de Compra generada por invitación a compra ágil: 2708-1103-COT24;"Orden de Compra codigo: 2708-1178-AG24 dirigida a VENTAS Y SERVICIOS PROFESIONALES YAKU PACHA LIMITADA, ADQUISICION DE INSUMOS PARA DESARROLLAR ASESORIA TECNICA A USUARIOS CONVENIO PADIS (SEGUN TDR ADJUNTO) PARA APOYAR LABORES DE EXTENSION EN TERRENO DE CARACTER FORMATIVO, OI 2909 DEFOP, CDP N°1548 19/12/2024 ITEM 22.04 ""MATERIALES DE USO O CONSUMO"", AREA: SERVICIOS A LA COMUNIDAD, PROGRAMA: FOMENTO PRODUCTIVO, SUBPROGRAMA: PADIS 2024-2025";AG;Adquisición igual o inferior a 30 UTM (Debe presentar 3 cotizaciones);Si;Si;13;AG;Compra Ágil;6;Aceptada;4;Aceptada;2024-12-20;2024-12-20;2024-12-20;2024-12-20;2024-12-23;;1;0;0;470621,2;CLP;470621,2;75141,2;IVA;0;0;395480;3697;69.040.700-0;Municipalidad de Ovalle - imoadq;99860;MUNICIPALIDAD DE OVALLE;Municipalidades;MUNICIPALIDADES| HOSPITALES Y CLINICAS;Ovalle;Región de Coquimbo ;Extranjero;1421215;78.059.645-7;YAKU PACHA LTDA.;2003239;VENTAS Y SERVICIOS PROFESIONALES YAKU PACHA LIMITADA;SERVICIOS PROFESIONALES DE INGENIERIA Y ACTIVIDADES CONEXAS DE CONSULT;Ovalle;Región de Coquimbo ;;22.04;19;Extranjero;7;2;;;139694347.0;10111300.0;Artículos para plantas y animales / Artículos para mascotas / Accesorios y tratamientos para mascotas;10111305.0;Fármacos veterinarios;Artículos para plantas y animales;Artículos para mascotas;Accesorios y tratamientos para mascotas;IMPLANTE SUBCUTANEO DE MELATONINA 18 mg. (CAJA DE 50 DOSIS) PRODUCTO NO PROXIMO A VENCER, INDICAR FECHA DE VENCIMIENTO;IMPLANTE SUBCUTANEO DE MELATONINA 18 mg. (CAJA DE 50 DOSIS) PRODUCTO NO PROXIMO A VENCER, INDICAR FECHA DE VENCIMIENTO;1;Caja;CLP;317000;0;0;;317000;30 dias contra la recepcion conforme de la factura
51920614;2069-12869-AG24;http://www.mercadopublico.cl/PurchaseOrder/Modules/PO/DetailsPurchaseOrder.aspx?codigoOC=2069-12869-AG24;SAR-CP-012025-PROGRAMA ENERO 2025 FARMACOS-AG;"Orden de Compra generada por invitación a compra ágil: 2069-4933-COT24
PROGRAMA MEDICAMENTOS ENERO 2025
1. Despachar a BODEGA CENTRAL. Obligatorio traer Orden de Compra IMPRESA y en Estado ACEPTADA
2. HORARIO: ** Lunes a Viernes 8:30 a 13:00 y de 14:30 a 16:00 Hrs. Productos refrigerados se reciben hasta las 13:00.**
3. Factura y/o Guía debe incluir lote y vencimiento de productos (vencimientos inferiores a 12 meses deben ser validados previo al despacho con comprador respectivo vía mail)
4. Factura electrónica enviar a: ""dipresrecepcion@custodium.com"" y recepcionfacturaelectronica.cabl@redsalud.gov.cl"" adjuntar OC en estado ""ACEPTADA"" y guía con recepción conforme.
5. Pago Proveedores: 25762900 
6. Proveedor debe traer sus propios implementos y herramientas para el transporte y distribución de productos
7.  Traer 1 copia de la factura (bodega)
";AG;Adquisición igual o inferior a 30 UTM (Debe presentar 3 cotizaciones);Si;Si;13;AG;Compra Ágil;12;Recepcion Conforme;7;Recepcion Conforme;2024-12-23;2024-12-31;2024-12-31;2024-12-23;2025-01-03;;1;0;0;4933610,29;CLP;4933610,29;787719,29;IVA;0;0;4145891;3064;61.608.101-2;HOSPITAL BARROS LUCO TRUDEAU;7293;SERVICIO DE SALUD METROPOLITANO SUR HOSP;Salud;HOSPITALES Y CLINICAS;San Miguel;Región Metropolitana de Santiago;Extranjero;711524;76.125.564-9;Laboratorio Aconfar Chile ltda.;1311638;Laboratorio Aconfar Chile ltda.;SERVICIOS DE ENVASADO Y EMPAQUE| OTROS PROFESIONALES DE LA SALUD| OTRAS ACTIVIDADES EMPRESARIALES RELACIONADAS CON LA SALUD HUMANA;Renca;Región Metropolitana de Santiago;;496;19;Extranjero;7;2;;;139705983.0;12162200.0;Productos químicos industriales / Aditivos / Anti-oxidantes;12162207.0;Melatonina;Productos químicos industriales;Aditivos;Anti-oxidantes;"2140200	MELATONINA 3 MG
";GEN0214 CIRCALIFE 3 MG ESTCH. X 30 CAP., Melatonina 3 mg., F-23544/22, OPKO CHILE S.A ;1020;Comprimido;CLP;40;0;0;;40800;30 dias contra la recepcion conforme de la factura
51924907;1692-920-SE24;http://www.mercadopublico.cl/PurchaseOrder/Modules/PO/DetailsPurchaseOrder.aspx?codigoOC=1692-920-SE24;ORDEN DE COMPRA DESDE 1692-43-L124;MEDICAMENTOS PARA EL HOSPITAL DE COCHRANE DESDE 1692-43-L124;SE;Proveniente de licitación pública;No;No;8;SE;Sin emisión automática;12;Recepcion Conforme;7;Recepcion Conforme;2024-12-23;2024-12-24;2024-12-23;2024-12-23;2024-12-26;;1;3,69354838709677;62;775047;CLP;775047;123747;IVA;0;0;651300;2688;61.602.292-k;Hospital Cochrane;7480;SERVICIO NACIONAL DE SALUD HOSPITAL DE COCHRANE;Salud;;Cochrane;Región Aysén del General Carlos Ibáñez del Campo;CL;261744;76.830.090-9;Caribean Pharma SpA;256360;FARMACEUTICA CARIBEAN LTDA;VENTA AL POR MAYOR DE ARTICULOS DE PERFUMERIA, COS;Renca;Región Metropolitana de Santiago;Chile;1975;19;CL;7;2;1692-43-L124;;139719330.0;12162200.0;Productos químicos industriales / Aditivos / Anti-oxidantes;12162207.0;Melatonina;Productos químicos industriales;Aditivos;Anti-oxidantes;MELATONINA 3 MG;HOF0105 MELATONINA 3MG X 30 COMP., Melatonina 3 mg, F-2482524, HOSPIFARMA, VENCE: 01-06-2026, PLAZO DE ENTREGA: 5 A 7 DIAS;3000;Comprimido;CLP;41;0;0;0.0;123000;30 dias contra la recepcion conforme de la factura
51926941;1643-3019-AG24;http://www.mercadopublico.cl/PurchaseOrder/Modules/PO/DetailsPurchaseOrder.aspx?codigoOC=1643-3019-AG24;MELATONINA CM 3 MG 1643-1801-COT24  (PRAIS);"643-3019-AG24 dirigida a ADN FARMACEUTICA SPA
100004066
MELATONINA CM 3 MG (PRAIS)
Despacho de Lunes a jueves 08:30 a 16:00 Hrs. / viernes 08:30 a 15:00 Hrs.   
Fono: 225744288 Bodega de Farmacia
ADJUNTAR OC A GUIA DE DESPACHO. 
";AG;Adquisición igual o inferior a 30 UTM (Debe presentar 3 cotizaciones);Si;Si;13;AG;Compra Ágil;12;Recepcion Conforme;7;Recepcion Conforme;2024-12-23;2024-12-24;2024-12-23;2024-12-23;2024-12-24;;1;0;0;9424,8;CLP;9424,8;1504,8;IVA;0;0;7920;2639;61.602.122-2;Hospital de Talagante;7457;SERVICIO NACIONAL DE SALUD HOSPITAL DE T;Salud;HOSPITALES Y CLINICAS;Talagante;Región Metropolitana de Santiago;Extranjero;989196;76.786.297-0;ADN FARMACÉUTICA;1580697;ADN FARMACEUTICA SPA;DROGUERIA;Pudahuel;Región Metropolitana de Santiago;;;19;Extranjero;7;2;;;139725440.0;12162200.0;Productos químicos industriales / Aditivos / Anti-oxidantes;12162207.0;Melatonina;Productos químicos industriales;Aditivos;Anti-oxidantes;"100004066
MELATONINA CM 3 MG  (PRAIS)
FACTOR DE EMPAQUE: 30
";;180;Unidad;CLP;44;0;0;;7920;30 dias contra la recepcion conforme de la factura
51931975;1214102-3694-AG24;http://www.mercadopublico.cl/PurchaseOrder/Modules/PO/DetailsPurchaseOrder.aspx?codigoOC=1214102-3694-AG24;DGC/SP 134-137/FARMACOS/DROGUERIA: 1214102-4176-COT24;"Orden de Compra codigo: 1214102-3694-AG24 dirigida a SCM PHARMA SPA

Justificación selección de cotización menos económica: proveedor cotiza en su totalidad los productos 
Factura debe informar ID de OC en el campo 801.
Antes de emitir una Factura la OC debe estar en estado aceptada en Mercado Público.
El monto de la DTE no puede ser superior a lo indicado en la OC
Se debe enviar datos de transferencia bancaria a Sandra Marilao, Mail: smarilao@codep.cl ";AG;Adquisición igual o inferior a 30 UTM (Debe presentar 3 cotizaciones);Si;Si;13;AG;Compra Ágil;6;Aceptada;4;Aceptada;2024-12-26;2024-12-26;2024-12-26;2024-12-26;2024-12-26;;1;0;0;2375840,95;CLP;2375840,95;379335,95;IVA;0;0;1996505;1214102;70.835.200-4;Adquisiciones;1801848;CORP MUNICIPAL DE DESARROLLO SOCIAL DE PUDAHUEL;Otros;Servicios;Pudahuel;Región Metropolitana de Santiago;Extranjero;1185307;77.337.544-5;SCM;1773777;SCM PHARMA SPA;VENTA AL POR MAYOR DE PRODUCTOS FARMACEUTICOS Y MEDICINALES;Providencia;Región Metropolitana de Santiago;;;19;Extranjero;7;2;;;139739637.0;12162200.0;Productos químicos industriales / Aditivos / Anti-oxidantes;12162207.0;Melatonina;Productos químicos industriales;Aditivos;Anti-oxidantes;Melatonina 3mg capsulas, adjuntar cotización, registro isp, fecha de vencimiento mayor a 12 meses o carta de canje;;540;Comprimido;CLP;37;0;0;;19980;30 dias contra la recepcion conforme de la factura
51934952;812030-3491-AG24;http://www.mercadopublico.cl/PurchaseOrder/Modules/PO/DetailsPurchaseOrder.aspx?codigoOC=812030-3491-AG24;Orden de Compra generada por invitación a compra ágil: 812030-4104-COT24;"Orden de Compra codigo: 812030-3491-AG24 dirigida a DROGUERÍA ACONCAGUA SPA
Favor coordinar despacho con calendarizaciones@hospitallaflorida.cl
Enviar a bodega de abastecimiento avenida Froilán Roa # 6542 la florida, horario de lunes a jueves de 8:30 a 16:00 horas, viernes de 8:30 a 15:00 horas, adjuntar factura, guía de despacho y copia de OC aceptada en el Mercado Publico. 
";AG;Adquisición igual o inferior a 30 UTM (Debe presentar 3 cotizaciones);Si;Si;13;AG;Compra Ágil;12;Recepcion Conforme;7;Recepcion Conforme;2024-12-26;2024-12-30;2024-12-30;2025-01-08;2025-01-03;;1;0;0;208250;CLP;208250;33250;IVA;0;0;175000;812030;65.075.485-9;medicamentos, oxigeno y trauma;1375151;HOSPITAL CLINICO METROPOLITANO DE LA FLORIDA DOCTORA ELOISA DIAZ;Salud;medicamentos, oxigeno y trauma;La Florida;Región Metropolitana de Santiago;Extranjero;1124621;76.985.933-0;Droguería Aconcagua SpA;1714883;DROGUERÍA ACONCAGUA SPA;VENTA AL POR MAYOR DE PRODUCTOS FARMACEUTICOS Y MEDICINALES;La Granja;Región Metropolitana de Santiago;;;19;Extranjero;7;2;;;139748206.0;12162200.0;Productos químicos industriales / Aditivos / Anti-oxidantes;12162207.0;Melatonina;Productos químicos industriales;Aditivos;Anti-oxidantes;FANN05040 MELATONINA 3 mg cápsula;FANN05040 MELATONINA 3 mg cápsula;5000;Cápsula;CLP;35;0;0;;175000;30 dias contra la recepcion conforme de la factura
