51037497;748201-1021-SE24;http://www.mercadopublico.cl/PurchaseOrder/Modules/PO/DetailsPurchaseOrder.aspx?codigoOC=748201-1021-SE24;TD 748201-5-LQ23 BPH S.A. Stgo. Sinfa 403 agosto 24;"SINFA N°403
RESOLUCION N°66 FECHA 10/01/2024
FACTURAR: CAPREDENA
GIRO: VENTA AL POR MENOR DE PRODUCTOS FARMACÉUTICOS Y MEDICINALES EN COMERCIOS ESPECIALIZADOS.
DIRECCION FACTURA: PASEO BULNES 284 SANTIAGO.
DIRECCIÓN DESPACHO: PASEO BULNES N°284
MENCIONAR OC EN LA FACTURA	
NO SE RECEPCIONAN MERCAD.C/VENC.INF.12MESES
D.T.Q.F: ISLEN MANCILLA C., FONO: 24227810.
PARA CONSULTAS TÉCNICAS O DE PRECIO, FAVOR CONTACTARSE AL CORREO MSCHMIDT@CAPREDENA.CL O AL FONO 0228306503
RECORDAR QUE ANTES DE FACTURAR, DEBE ACEPTAR LA O.C. EN EL PORTAL, EVITANDO RECLAMO DEL DTE.
ENVIAR ARCHIVO XML"" DEL DTE A LA CASILLA DE CORREO DE CAPREDENA: dipresrecepción@custodium.com
";SE;Proveniente de licitación pública;No;No;8;SE;Sin emisión automática;12;Recepcion Conforme;7;Recepcion Conforme;2024-08-12;2024-08-12;2024-08-12;2024-08-12;2024-08-13;;1;4,96;5;314160;CLP;314160;50160;IVA;0;0;264000;748201;61.108.000-k;Unidad de Compras Farmacia;7175;CAJA DE PREVISION DE LA DEFENSA NACIONAL;Gob. Central, Universidades;FARMACIAS INDEPENDIENTES| COMERCIO AL POR MENOR DE;* ;Región Metropolitana de Santiago;CL;44164;96.519.830-k;BPH S.A;43359;BPH S.A;VENTA AL POR MAYOR DE PRODUCTOS QUIMICOS;Quilicura;Región Metropolitana de Santiago;Chile;;19;CL;7;2;748201-5-LQ23;;137165384;85121900.0;Salud, servicios sanitarios y alimentación / Medicina y servicios de salud / Farmacéuticos;85121902;Farmacias;Salud, servicios sanitarios y alimentación;Medicina y servicios de salud;Farmacéuticos;MELATONINA 3 MG. 30 COMP.;MELATONINA 3 MG. 30 COMP.;220;Caja;CLP;1200;0.0;0;0.0;264000;30 dias contra la recepcion conforme de la factura
51043243;948356-3123-SE24;http://www.mercadopublico.cl/PurchaseOrder/Modules/PO/DetailsPurchaseOrder.aspx?codigoOC=948356-3123-SE24;948356-50-LE23;"
Despacho urgente 
Recepción de mercadería en la Bodega Central será el siguiente:
	Lunes a jueves de 08:00 a 15:00 hrs.
	Viernes de 08:00 a 13:00 hrs.
";SE;Proveniente de licitación pública;No;No;8;SE;Sin emisión automática;12;Recepcion Conforme;7;Recepcion Conforme;2024-08-13;2024-08-13;2024-08-13;2024-08-13;2024-08-13;;1;0;0;649454,4;CLP;649454,4;103694,4;IVA;0;0;545760;948356;61.513.003-6;Unidad de Compra Fármacos Nutrición y Reactivos;220665;FONDO HOSPITAL DE LA DIRECCION DE PREVISION DE CARABINEROS DE CHILE;FFAA;;* ;Región Metropolitana de Santiago;CL;668273;76.091.301-4;LABORATORIOS BIOPAS S.A.;1270266;LABORATORIOS BIOPAS S.A.;VENTA AL POR MAYOR DE OTROS PRODUCTOS N.C.P.| OTRA;Huechuraba;Región Metropolitana de Santiago;Chile;15789;19;CL;7;2;948356-50-LE23;;137182085;12162200.0;Productos químicos industriales / Aditivos / Anti-oxidantes;12162207;Melatonina;Productos químicos industriales;Aditivos;Anti-oxidantes;MELATONINA 2 MG COMP. LIB. PROLONG. HOSDIP AA4402 ;"IGISOM COMPRIMIDOS DE LIBERACIÓN PROLONGADA 2 mg (Melatonina) Caja x 30 comprimidos
F-25415/20
";720;Comprimido;CLP;758;0.0;0;0.0;545760;30 dias contra la recepcion conforme de la factura
51044762;2805-403-SE24;http://www.mercadopublico.cl/PurchaseOrder/Modules/PO/DetailsPurchaseOrder.aspx?codigoOC=2805-403-SE24;MEDICAMENTOS FARMACIA 3ER TRIMESTRE;"MEDICAMENTOS FARMACIA 3ER TRIMESTRE AÑO 2024 DESDE 2805-21-LE24

PRESUPUESTO CONVENIO FOFAR";SE;Proveniente de licitación pública;No;No;8;SE;Sin emisión automática;12;Recepcion Conforme;7;Recepcion Conforme;2024-08-13;2024-08-13;2024-08-13;2024-08-13;2024-08-13;;1;3,8375;16;1156680;CLP;1156680;184680;IVA;0;0;972000;3794;69.220.302-K;ILUSTRE MUNICIPALIDAD DE LLANQUIHUE-DEPTO. DE SALUD;7064;I MUNICIPALIDAD DE LLANQUIHUE;Municipalidades;;Llanquihue;Región de los Lagos ;CL;26581;91.637.000-8;LABORATORIOS RECALCINE S.A;26786;LABORATORIOS RECALCINE SA;FABRICACION DE PRODUCTOS FARMACEUTICOS, SUSTANCIAS;Providencia;Región Metropolitana de Santiago;Chile;2152204004;19;CL;7;2;2805-21-LE24;;137186615;12162200.0;Productos químicos industriales / Aditivos / Anti-oxidantes;12162207;Melatonina;Productos químicos industriales;Aditivos;Anti-oxidantes;ESZOPICLONA 3 MG COMPRIMIDOS  (PRECIO POR CAJA);"881851 VALNOC 3 MG CAJA X 30 COMPRIMIDOS PRINCIPIO ACTIVO ESZOPICLONA 3MG REGISTRO SANITARIO F-16735 - 23 EQUIVALENTE TERAPEUTICO, venc: 11/02/2026, Plazo de entrega 48 horas hábiles; políticas de canje: cambio de producto 30 días antes y 30 días después ";6000;Comprimido;CLP;92;0.0;0;0.0;552000;30 dias contra la recepcion conforme de la factura
51045969;4584-276-AG24;http://www.mercadopublico.cl/PurchaseOrder/Modules/PO/DetailsPurchaseOrder.aspx?codigoOC=4584-276-AG24;Orden de Compra generada por invitación a compra ágil: 4584-72-COT24;Orden de Compra codigo: 4584-276-AG24 dirigida a COMERCIAL ETHOS S A;AG;Adquisición igual o inferior a 30 UTM (Debe presentar 3 cotizaciones);Si;Si;13;AG;Compra Ágil;6;Aceptada;4;Aceptada;2024-08-13;2024-08-13;2024-08-13;2024-08-13;2024-08-19;;1;0;0;422871,26;CLP;422871,26;67517,26;IVA;0;0;355354;5500;69.091.300-3;SALUD MARCHIGUE;115304;I MUNICIPALIDAD DE MARCHIGUE;Municipalidades;SERVICIOS DE OTROS ESTABLECIMIENTOS QUE EXPENDEN COMIDAS Y BEBIDAS| GOBIERNO CENTRAL Y ADMINISTRACION PUBLICA| OTRAS ACTIVIDADES DE MANEJO DE DESPERDICIOS| OTROS SERVICIOS DE DIVERSION Y ESPARCIMIENTOS N.C.P.;Marchigue;Región del Libertador General Bernardo O´Higgins;Extranjero;80856;78.583.750-9;ETHOS CHILE;78647;ethos;VENTA AL POR MENOR DE ARTICULOS ORTOPEDICOS| VENTAS AL POR MENOR DE OTROS PRODUCTOS EN ALMACENES ESPECIALIZADOS N.C| ACTIVIDADES DE ASESORAMIENTO EMPRESARIAL Y EN MATERIA DE GESTION| SERVICIOS DE INGENIERIA PRESTADOS POR EMPRESAS N.C.P.| OTROS SERVICIOS D;Las Condes;Región Metropolitana de Santiago;;337;19;Extranjero;7;2;;;137189919;12162200.0;Productos químicos industriales / Aditivos / Anti-oxidantes;12162207;Melatonina;Productos químicos industriales;Aditivos;Anti-oxidantes;MELATONINA 3MG CAJA X 30 COMPRIMIDOS;;34;Caja;CLP;1461;0.0;0;;49674;30 dias contra la recepcion conforme de la factura
51048414;1462-391-AG24;http://www.mercadopublico.cl/PurchaseOrder/Modules/PO/DetailsPurchaseOrder.aspx?codigoOC=1462-391-AG24;Orden de Compra generada por invitación a compra ágil: 1462-85-COT24;"Orden de Compra codigo: 1462-391-AG24 dirigida a SCM PHARMA SPA
ADQUSICIÓN DE FARMACOS PARA PRESCRIPCION DE ESPECILISTA DE SALUD FAMILIAR HOSPITAL HUALAÑE.";AG;Adquisición igual o inferior a 30 UTM (Debe presentar 3 cotizaciones);Si;Si;13;AG;Compra Ágil;12;Recepcion Conforme;7;Recepcion Conforme;2024-08-13;2024-08-13;2024-08-13;2024-08-13;2024-08-26;;1;0;0;1488190,2;CLP;1488190,2;237610,2;IVA;0;0;1250580;2458;61.606.906-3;Hospital Hualañé;7255;SERVICIO DE SALUD DEL MAULE HOSPITAL DE HUALANE;Salud;HOSPITALES Y CLINICAS;Hualañé;Región del Maule ;Extranjero;1185307;77.337.544-5;SCM;1773777;SCM PHARMA SPA;VENTA AL POR MAYOR DE PRODUCTOS FARMACEUTICOS Y MEDICINALES;Providencia;Región Metropolitana de Santiago;;;19;Extranjero;7;2;;;137196939;12162200.0;Productos químicos industriales / Aditivos / Anti-oxidantes;12162207;Melatonina;Productos químicos industriales;Aditivos;Anti-oxidantes;MELATONINA 3MG;;600;Comprimido;CLP;32;0.0;0;;19200;30 dias contra la recepcion conforme de la factura
51060862;2766-1075-AG24;http://www.mercadopublico.cl/PurchaseOrder/Modules/PO/DetailsPurchaseOrder.aspx?codigoOC=2766-1075-AG24;ETHON PHARMACEUTICALS SPA compra ágil: 2766-658-COT24;"MEMO 4042 DEL 21/06/2024 PO 5/188 DEL 26/06/24
DESPACHADO AVENIDA PEDRO AGUIRRE CERDA 0161. FARMACIA MUNICIPAL LA CISTERNA
CONTACTO: SANDRA BALMACEDA OVALLE        MOVIL: 997015316     SBALMACEDAOVALLE@HOTMAIL.COM
HORARIO: RECEPCIÓN DE MERCADERÍA DE LUNES A VIERNES DE 8:30 A 13:00 HRS, LUNES A JUEVES 15:15 A 16:00AP
";AG;Adquisición igual o inferior a 30 UTM (Debe presentar 3 cotizaciones);Si;Si;13;AG;Compra Ágil;12;Recepcion Conforme;7;Recepcion Conforme;2024-08-14;2024-08-14;2024-08-14;2024-08-16;2024-08-14;;1;3,27027027027027;37;332010;CLP;332010;53010;IVA;0;0;279000;3755;69.072.000-0;SALUD;100488;I MUNICIPALIDAD DE LA CISTERNA;Municipalidades;GOBIERNO CENTRAL Y ADMINISTRACION PUBLICA;La Cisterna;Región Metropolitana de Santiago;Extranjero;275627;76.956.140-4;ETHON PHARMACEUTICALS SPA.;269948;ETHON PHARMACEUTICALS  COMERCIALIZADORA  IMP EXP Y DIST SPA;VENTA AL POR MAYOR DE ARTICULOS DE PERFUMERIA, COSMETICOS, JABONES Y P| VENTA AL POR MAYOR DE PRODUCTOS FARMACEUTICOS| VENTA AL POR MAYOR DE PRODUCTOS QUIMICOS;Rancagua;Región del Libertador General Bernardo O´Higgins;;Ilustre Municipalidad De La Cisterna;19;Extranjero;7;2;;;137233762;85121900.0;Salud, servicios sanitarios y alimentación / Medicina y servicios de salud / Farmacéuticos;85121902;Farmacias;Salud, servicios sanitarios y alimentación;Medicina y servicios de salud;Farmacéuticos;MLTN0003COMP. MELATONINA 3MG X 30 CAP.. MDC HEALTH SPA.. MELATONINA. REG ISP F-25890. VCTO 12-2025. LOTE CML014005 -- 7804673040447;MLTN0003COMP. MELATONINA 3MG X 30 CAP.. MDC HEALTH SPA.. MELATONINA. REG ISP F-25890. VCTO 12-2025. LOTE CML014005 -- 7804673040447;300;Caja;CLP;930;0.0;0;;279000;30 dias contra la recepcion conforme de la factura
51063929;4172-576-SE24;http://www.mercadopublico.cl/PurchaseOrder/Modules/PO/DetailsPurchaseOrder.aspx?codigoOC=4172-576-SE24;ORDEN DE COMPRA DESDE 4172-39-LE24;"MEDICAMENTOS PARA FARMACIA POPULAR DESDE 4172-39-LE24
DECRETO 2481/ 13.08.24";SE;Proveniente de licitación pública;No;No;8;SE;Sin emisión automática;6;Aceptada;4;Aceptada;2024-08-16;2024-08-16;2024-08-16;2024-08-16;2024-08-20;;1;4;31;6469399,3;CLP;6469399,3;1032929,3;IVA;0;0;5436470;5091;69.130.500-7;Salud;124195;ILUSTRE MUNICIPALIDAD DE COLBUN;Municipalidades;ACTIVIDADES DE ASESORAMIENTO EMPRESARIAL Y EN MATERIA DE GESTION| OTRAS ACTIVIDADES DE SERVICIOS PERSONALES N.C.P.;Colbún;Región del Maule ;CL;23690;80.447.400-5;MUNNICH PHARMA MEDICAL SPA;24141;MUNNICH PHARMA MEDICAL SPA;VENTA AL POR MAYOR DE PRODUCTOS FARMACEUTICOS| VEN;;;Chile;;19;CL;21;2;4172-39-LE24;;137242867;12162200.0;Productos químicos industriales / Aditivos / Anti-oxidantes;12162207;Melatonina;Productos químicos industriales;Aditivos;Anti-oxidantes;Melatonina 3 mg x 30 capsulas;"274564 MELATONINA CAPSULAS 3MG.30 - CAJA POR 30 CAPSULAS - SEDANTES: F-21660 - ARAMA - VIGENCIA SUPERIOR A 24 MESES, SE ADJUNTA FICHA TECNICA. 
SE ADJUNTA CARTA DE CANJE.
DESPACHO EN 2 DIAS HABILES.
VENCIMIENTO 01-2027
EL DESPACHO NO TIENE COSTO ADICI";35;Unidad;CLP;1050;0.0;0;0.0;36750;30 dias contra la recepcion conforme de la factura
51066370;4030-139-SE24;http://www.mercadopublico.cl/PurchaseOrder/Modules/PO/DetailsPurchaseOrder.aspx?codigoOC=4030-139-SE24;ORDEN DE COMPRA DESDE 4030-18-LE24;ADQUISICION DE MEDICAMENTOS;SE;Proveniente de licitación pública;No;No;8;SE;Sin emisión automática;12;Recepcion Conforme;7;Recepcion Conforme;2024-08-16;2024-08-19;2024-08-19;2024-09-24;2024-09-02;;1;4,8;4;1525009,0023;CLP;1525009,0023;243488,8323;IVA;0;0;1281520,17;4950;69.251.100-K;Depto. De Salud;119487;ILUSTRE MUNICIPALIDAD DE CAMINA;Municipalidades;;Camiña;Región de Tarapacá  ;CL;658977;76.167.536-2;Medikar Ltda;1261270;Comercializadora Medikar Ltda;VENTA AL POR MAYOR DE PRODUCTOS FARMACEUTICOS| VEN;San Felipe;Región de Valparaíso ;Chile;2152204004;19;CL;7;2;4030-18-LE24;;137250095;42171900.0;Equipamiento y suministros médicos / Artículos médicos para urgencias y atención en terreno / Contenedores de almacenaje para servicios médicos de urgencia;42171903;Cajas de medicamentos de servicios médicos de urgencia;Equipamiento y suministros médicos;Artículos médicos para urgencias y atención en terreno;Contenedores de almacenaje para servicios médicos de urgencia;MELATONINA Comprimido 3mg;MELATONINA 3 MG ®, MELATONINA, Envase de: 30 CAPSULA, ARAMA, Reg.ISP: F-23523, Vence: 2025-12-31. ;300;Unidad;CLP;42,3;0.0;0;0.0;12690;30 dias contra la recepcion conforme de la factura
51069780;3829-164-AG24;http://www.mercadopublico.cl/PurchaseOrder/Modules/PO/DetailsPurchaseOrder.aspx?codigoOC=3829-164-AG24;Orden de Compra generada por invitación a compra ágil: 3829-97-COT24;Orden de Compra codigo: 3829-164-AG24 dirigida a ETHON PHARMACEUTICALS  COMERCIALIZADORA  IMP EXP Y DIST SPA;AG;Adquisición igual o inferior a 30 UTM (Debe presentar 3 cotizaciones);Si;Si;13;AG;Compra Ágil;6;Aceptada;4;Aceptada;2024-08-19;2024-08-23;2024-08-23;2024-08-23;2024-08-23;;1;3,27027027027027;37;1219071,7;CLP;1219071,7;194641,7;IVA;0;0;1024430;4749;69.150.300-3;Departamento de Salud;7418;Ilustre Municipalidad de Ranquil;Municipalidades;;Ranquil;Región del Ñuble;Extranjero;275627;76.956.140-4;ETHON PHARMACEUTICALS SPA.;269948;ETHON PHARMACEUTICALS  COMERCIALIZADORA  IMP EXP Y DIST SPA;VENTA AL POR MAYOR DE ARTICULOS DE PERFUMERIA, COSMETICOS, JABONES Y P| VENTA AL POR MAYOR DE PRODUCTOS FARMACEUTICOS| VENTA AL POR MAYOR DE PRODUCTOS QUIMICOS;Rancagua;Región del Libertador General Bernardo O´Higgins;;215-22-04-004-003;19;Extranjero;7;2;;;137260177;42171900.0;Equipamiento y suministros médicos / Artículos médicos para urgencias y atención en terreno / Contenedores de almacenaje para servicios médicos de urgencia;42171903;Cajas de medicamentos de servicios médicos de urgencia;Equipamiento y suministros médicos;Artículos médicos para urgencias y atención en terreno;Contenedores de almacenaje para servicios médicos de urgencia;MELATONINA COMPRIMIDOS;;2000;Unidad;CLP;31;0.0;0;;62000;30 dias contra la recepcion conforme de la factura
51082658;4493-648-SE24;http://www.mercadopublico.cl/PurchaseOrder/Modules/PO/DetailsPurchaseOrder.aspx?codigoOC=4493-648-SE24;Adquisición de Fármacos para Farmacia Comunal de Penco;"CONTRATO DE SUMINISTRO PARA FARMACIA COMUNAL DE PENCO DESDE 4493-16-LE24

Responsable: Carlos González Inostroza
Despachar a Calle Maipú N° 201, Penco
De Lunes a Jueves de 08:30 a 13:00 y de 14:00 a 16:00 hrs.
Viernes de 08:30 a 13:00 y de 14:00 a 15:30 hrs.
Teléfono 41-2261409
";SE;Proveniente de licitación pública;No;No;8;SE;Sin emisión automática;12;Recepcion Conforme;7;Recepcion Conforme;2024-08-20;2024-08-20;2024-08-20;2024-08-20;2024-08-20;;1;0;0;161042,7;CLP;161042,7;25712,7;IVA;0;0;135330;5409;69.150.502-2;Departamento de Salud;142575;I MUNICIPALIDAD DE PENCO;Municipalidades;;Penco;Región del Biobío ;CL;1185307;77.337.544-5;SCM;1773777;SCM PHARMA SPA;VENTA AL POR MAYOR DE PRODUCTOS FARMACEUTICOS Y ME;Providencia;Región Metropolitana de Santiago;Chile;3784;19;CL;7;2;4493-16-LE24;;137298428;12162200.0;Productos químicos industriales / Aditivos / Anti-oxidantes;12162207;Melatonina;Productos químicos industriales;Aditivos;Anti-oxidantes;"MELATONINA 3MG	ENVASE CONTENIENDO 30 COMPRIMIDOS DE MELATONINA 3MG	SUGERENCIA, MELATONINA 3MG	CAJA
";Melatonina 3Mg  cajaX 30 Comp., Lab. Mdc, vence 31-10-2026;10;Caja;CLP;1053;0.0;0;0.0;10530;30 dias contra la recepcion conforme de la factura
51089683;2395-1132-AG24;http://www.mercadopublico.cl/PurchaseOrder/Modules/PO/DetailsPurchaseOrder.aspx?codigoOC=2395-1132-AG24;DROGUERIA - MELATONINA Y DONEPEZILO;"EL PROVEEDOR DEBERÁ ADJUNTAR EN LA FACTURA LOS DATOS BANCARIOS PARA LA TRANSFERENCIA Y DEBE INDICAR EL NÚMERO DE LA ORDEN DE COMPRA.
HORARIO DE ATENCIÓN: LUNES A JUEVES DE 08:30 AM A 13:00 PM
                                                                                 14:00 AM A 16:30 PM
                                            VIERNES                      08:30 AM A 13:00 PM
                                                                                  14:00 PM A 15:30 PM
";AG;Adquisición igual o inferior a 30 UTM (Debe presentar 3 cotizaciones);Si;Si;13;AG;Compra Ágil;6;Aceptada;4;Aceptada;2024-08-20;2024-08-28;2024-08-20;2024-08-20;2024-08-29;;1;0;0;866320;CLP;866320;138320;IVA;0;0;728000;3387;69.254.900-7;DIRECCION DE SALUD;87104;I MUNICIPALIDAD PEDRO AGUIRRE CERDA;Municipalidades;MUNICIPALIDADES| OTRAS ACTIVIDADES DE SERVICIOS PERSONALES N.C.P.;Pedro Aguirre Cerda;Región Metropolitana de Santiago;Extranjero;1185307;77.337.544-5;SCM;1773777;SCM PHARMA SPA;VENTA AL POR MAYOR DE PRODUCTOS FARMACEUTICOS Y MEDICINALES;Providencia;Región Metropolitana de Santiago;;4318;19;Extranjero;7;2;;;137319780;12162200.0;Productos químicos industriales / Aditivos / Anti-oxidantes;12162207;Melatonina;Productos químicos industriales;Aditivos;Anti-oxidantes;MELATONINA 3MG COMP/CAP;FV. 28/02/2026 CAJA 30 COMP;10000;Comprimido;CLP;32;0.0;0;;320000;30 dias contra la recepcion conforme de la factura
51095899;1058106-512-CC24;http://www.mercadopublico.cl/PurchaseOrder/Modules/PO/DetailsPurchaseOrder.aspx?codigoOC=1058106-512-CC24;compra de medicamentos ;"COMPRAS DE MEDICAMENTOS SOLICITADOS POR QUÍMICO FARMACÉUTICO, DESPACHO A DOMICILIO, FLETE CANCELADO.
LICITACIÓN 1058101-2-LR22

           1.- Requisitos obligatorios:
-	Dirección envió documento tributario eléctronico DTE al a casilla de intercambio en SII es dipresrecepcion@custodium.com .el DTE que no se encuentre direccionado a dicha casilla de intercambio en SII será reclamado de forma automática trascurrida 72 horas desde la recepción del DTE en SII (FORMATO XML) .
-	EL DTE debe contener el campo 801 o campo de referencia con el número de la orden de compra correctamente, esto dado que el sistema se encuentra integrado con mercado publico SIGFE  y SII. Orden de compra  en estado aceptada  en mercado  Publico 
-	DTE al crédito 
";CC;Proveniente de licitación pública;No;No;14;CC;Compra Coordinada;12;Recepcion Conforme;7;Recepcion Conforme;2024-08-21;2024-08-26;2024-08-21;2024-08-21;2024-08-28;;1;0;0;146370;CLP;146370;23370;IVA;0;0;123000;1058106;61.607.005-3;Fármarcos;7303;SERVICIO DE SALUD NUBLE HOSPITAL DE QUIRIHUE;Salud;Servicio Público;Quirihue;Región del Ñuble;CL;677833;76.070.033-9;ARAMA NATURAL PRODUCTS DISTRIBUIDORA LIMITADA;1279538;ARAMA NATURAL PRODUCTS DISTRIBUIDORA LIMITADA;VENTA AL POR MAYOR DE OTROS PRODUCTOS N.C.P.| SERV;Pudahuel;Región Metropolitana de Santiago;Chile;;19;CL;7;2;1058101-2-LR22;;137338098;12162200.0;Productos químicos industriales / Aditivos / Anti-oxidantes;12162207;Melatonina;Productos químicos industriales;Aditivos;Anti-oxidantes;MELATONINA 3 MG CM CAJA X 30 CAP.;MELATONINA 3 MG CM CAJA X 30 CAP.;3000;Unidad no definida;CLP;41;0.0;0;0.0;123000;30 dias contra la recepcion conforme de la factura
51097593;3696-259-SE24;http://www.mercadopublico.cl/PurchaseOrder/Modules/PO/DetailsPurchaseOrder.aspx?codigoOC=3696-259-SE24;ORDEN DE COMPRA DESDE 3696-15-L124;Adquisición de medicamentos Farmacia Municipal DESDE 3696-15-L124;SE;Proveniente de licitación pública;No;No;8;SE;Sin emisión automática;12;Recepcion Conforme;7;Recepcion Conforme;2024-08-21;2024-08-21;2024-08-21;2024-08-21;2024-08-22;;1;3,69354838709677;62;151218,06;CLP;151218,06;24144,06;IVA;0;0;127074;4616;69.100.300-0;Departamento De Salud;116299;I MUNICIPALIDAD DE TENO;Municipalidades;GOBIERNO CENTRAL Y ADMINISTRACION PUBLICA;Teno;Región del Maule ;CL;261744;76.830.090-9;Caribean Pharma SpA;256360;FARMACEUTICA CARIBEAN LTDA;VENTA AL POR MAYOR DE ARTICULOS DE PERFUMERIA, COS;Renca;Región Metropolitana de Santiago;Chile;215-22-04-004-000-000;19;CL;7;2;3696-15-L124;;137343041;51161800.0;Medicamentos y productos farmacéuticos / Medicamentos para el tracto respiratorio / Productos para tos, resfriados y antialérgicos;51161812;Combinación clorfeniramina-acetaminofeno;Medicamentos y productos farmacéuticos;Medicamentos para el tracto respiratorio;Productos para tos, resfriados y antialérgicos;MELATONINA 3 MG X 30 COMP;HOF0105 MELATONINA 3MG X 30 COMP., Melatonina 3 mg, F-24825/24, HOSPIFARMA, 01-05-2026, venc: 01-05-2026, PLAZO DE ENTREGA: 2 DIAS;6;Caja;CLP;1228;0.0;0;0.0;7368;30 dias contra la recepcion conforme de la factura
51102689;899-705-AG24;http://www.mercadopublico.cl/PurchaseOrder/Modules/PO/DetailsPurchaseOrder.aspx?codigoOC=899-705-AG24;ADQUISICIÓN DE MEDICAMENTOS DOXICICLINA Y MELATONINA;El Hospital Familiar y Comunitario San José de Casablanca requiere la adquisición de medicamentos Doxiciclina y Melatonina desde compra ágil 899-212-COT24 dirigida a ETHON PHARMACEUTICALS  COMERCIALIZADORA  IMP EXP Y DIST SPA.;AG;Adquisición igual o inferior a 30 UTM (Debe presentar 3 cotizaciones);Si;Si;13;AG;Compra Ágil;12;Recepcion Conforme;7;Recepcion Conforme;2024-08-22;2024-08-22;2024-08-22;2024-08-22;2024-08-22;;1;3,27027027027027;37;218008;CLP;218008;34808;IVA;0;0;183200;1895;61.602.067-6;Hospital San Jose - Casablanca;7239;SERVICIO DE SALUD VALPARAISO SAN ANTONIO;Salud;HOSPITALES Y CLINICAS;Casablanca;Región de Valparaíso ;Extranjero;275627;76.956.140-4;ETHON PHARMACEUTICALS SPA.;269948;ETHON PHARMACEUTICALS  COMERCIALIZADORA  IMP EXP Y DIST SPA;VENTA AL POR MAYOR DE ARTICULOS DE PERFUMERIA, COSMETICOS, JABONES Y P| VENTA AL POR MAYOR DE PRODUCTOS FARMACEUTICOS| VENTA AL POR MAYOR DE PRODUCTOS QUIMICOS;Rancagua;Región del Libertador General Bernardo O´Higgins;;;19;Extranjero;7;2;;;137357129;12162200.0;Productos químicos industriales / Aditivos / Anti-oxidantes;12162207;Melatonina;Productos químicos industriales;Aditivos;Anti-oxidantes;"Melatonina 3mg comprimido

Ajustar cantidad a formato de venta.

FAVOR ADJUNTAR COTIZACIÓN FORMAL, ESPECIFICACIONES DEL MEDICAMENTO, INDICAR FECHA DE VENCIMIENTO Y PLAZO DE DESPACHO. DE LO CONTRARIO SU OFERTA NO SERÁ EVALUADA.

POR FAVOR, NO POSTULAR SI NO CUENTA CON STOCK PARA DESPACHO.";;5000;Unidad;CLP;31;0.0;0;;155000;30 dias contra la recepcion conforme de la factura
51112588;900-993-AG24;http://www.mercadopublico.cl/PurchaseOrder/Modules/PO/DetailsPurchaseOrder.aspx?codigoOC=900-993-AG24;Compra medicamentos Farmacia;"Registrar el número de Orden de Compra en el campo de referencia 801 al emitir su factura en la plataforma de SII (sin observaciones adicionales letras, números, signos, espacios etc.) de lo contrario el sistema implementado por la DIPRES el SII y administrado por ACEPTA RECHAZARA el documento al no encontrar una O.C. válidamente emitida.
Siempre debe aceptar la O.C. en el portal www.mercadopublico.cl antes de emitir su factura, al momento de facturar la condición de pago debe ser CREDITO.
Es responsabilidad del proveedor verificar que el DTE esté correctamente aceptado por nuestro hospital. Consultas al correo juan.saavedra.v@redsalud.gob.cl
Respetar horario para despacho: lunes a viernes de 09:00 a 13:00 hrs.   
";AG;Adquisición igual o inferior a 30 UTM (Debe presentar 3 cotizaciones);Si;Si;13;AG;Compra Ágil;12;Recepcion Conforme;7;Recepcion Conforme;2024-08-23;2024-08-23;2024-08-23;2024-08-23;2024-08-25;;1;3,27027027027027;37;340816;CLP;340816;54416;IVA;0;0;286400;1896;61.979.910-0;Hospital Psquiatrico del Salvador;7239;SERVICIO DE SALUD VALPARAISO SAN ANTONIO;Salud;HOSPITALES Y CLINICAS;Valparaíso;Región de Valparaíso ;Extranjero;275627;76.956.140-4;ETHON PHARMACEUTICALS SPA.;269948;ETHON PHARMACEUTICALS  COMERCIALIZADORA  IMP EXP Y DIST SPA;VENTA AL POR MAYOR DE ARTICULOS DE PERFUMERIA, COSMETICOS, JABONES Y P| VENTA AL POR MAYOR DE PRODUCTOS FARMACEUTICOS| VENTA AL POR MAYOR DE PRODUCTOS QUIMICOS;Rancagua;Región del Libertador General Bernardo O´Higgins;;1873;19;Extranjero;7;2;;;137387641;12162200.0;Productos químicos industriales / Aditivos / Anti-oxidantes;12162207;Melatonina;Productos químicos industriales;Aditivos;Anti-oxidantes;Melatonina 3 mg;;8000;Comprimido;CLP;31;0.0;0;;248000;30 dias contra la recepcion conforme de la factura
51114025;2664-1117-AG24;http://www.mercadopublico.cl/PurchaseOrder/Modules/PO/DetailsPurchaseOrder.aspx?codigoOC=2664-1117-AG24;MEDICAMENTOS DROGUERIA SP 0708-2027;"MEDICAMENTOS DROGUERIA SP 0708-2027
DESPACHAR A NUEVA ALDEA 2720, SECTOR LOS BLOQUES, TOMÉ.
ATENCION PATRICIO CONTRERAS // MAURICIO MELLA
DE LUNES A VIERNES DE 8:30 A 15:30 HRS.";AG;Adquisición igual o inferior a 30 UTM (Debe presentar 3 cotizaciones);Si;Si;13;AG;Compra Ágil;6;Aceptada;4;Aceptada;2024-08-23;2024-08-26;2024-08-26;2024-08-26;2024-08-26;;1;0;0;446607;CLP;446607;71307;IVA;0;0;375300;3653;69.150.102-7;Dirección de Salud Municipal;98443;I MUNICIPALIDAD DE TOME;Municipalidades;;Tomé;Región del Biobío ;Extranjero;651991;76.133.312-7;HOSPIFARMA;1254490;LABORATORIO HOSPIFARMA CHILE LIMITADA;VENTA AL POR MAYOR DE ARTICULOS DE PERFUMERIA, COSMETICOS, JABONES Y P| VENTA AL POR MAYOR DE PRODUCTOS FARMACEUTICOS| VENTA AL POR MAYOR DE PRODUCTOS QUIMICOS;Quilicura;Región Metropolitana de Santiago;;2152204004002;19;Extranjero;7;2;;;137392118;12162200.0;Productos químicos industriales / Aditivos / Anti-oxidantes;12162207;Melatonina;Productos químicos industriales;Aditivos;Anti-oxidantes;"Melatonina 3 mg capsula o comprimido envasado en blister. Envase resistente con sello que asegure la inviolabilidad del contenido.
ADJUNTAR FICHA TECNICA, VENCIMIENTO SUPERIOS A DOS AÑOS, REGISTRO ISP Y RESOLUCION DE FUNCIONAMIENTO DE ISP
";HOF0111 MELATONINA CÁPS 3 mg. REG ISP F-24825/19. PRESENTACIÓN: CAJA X 30 CÁPS. MARCA: HOSPIFARMA. FAB: BIOMYLZ PVT. LTD., INDIA. VENC: 01-06-2026;12510;Comprimido;CLP;30;0.0;0;;375300;30 dias contra la recepcion conforme de la factura
