47454404;1559-73-AG23;http://www.mercadopublico.cl/PurchaseOrder/Modules/PO/DetailsPurchaseOrder.aspx?codigoOC=1559-73-AG23;ESZOPICLONA 3MG CM (1559-3-COT23) (AG,FARM,220400400102,JRT);"PRODUCTO PARA FARMACIA, 901317
DESPACHO SOLO CON GUIA DE DESPACHO Y ORDEN DE COMPRA ACEPTADA A: GALVARINO #1509, CERRO NAVIA, PISO -1, BODEGA DE ABASTECIMIENTO 
CONTACTO BODEGA VALERIA ROJAS, FONO 226126828 valeria.rojasp@redsalud.gov.cl
ESTIMADO PROVEEDOR FAVOR FACTURAR CON CONDICION DE PAGO CREDITO
FAVOR ENVIAR DOCUMENTOS TRIBUTARIOS ELECTRONICOS EN FORMATO XML A LA CASILLA dipresrecepcion@custodium.com
*** DESPACHO PARCIAL SEGUN REQUERIMIENTO DE BODEGA ***
";AG;Adquisición igual o inferior a 30 UTM (Debe presentar 3 cotizaciones);Si;Si;13;AG;Compra Ágil;12;Recepcion Conforme;7;Recepcion Conforme;2023-01-18;2023-01-18;2023-01-18;2023-01-18;2023-01-19;;1;4,19047619047619;21;160650;CLP;160650;25650;IVA;0;0;135000;2555;61.608.205-1;FARMACIA;7383;SERVICIO SALUD OCCIDENTE HOSPITAL DR FELIX BULNES CERDA;Salud;HOSPITALES Y CLINICAS;Cerro Navia;Región Metropolitana de Santiago;;586852;76.079.782-0;WINPHARM;1160440;WINPHARM SPA;VENTA AL POR MAYOR DE PRODUCTOS QUIMICOS;Pudahuel;Región Metropolitana de Santiago;Chile;;19;;7;48;;;126546200;73101700.0;Servicios de producción y fabricación industrial / Industrias de plásticos y productos químicos / Producción farmacéutica;73101701.0;Servicios de producción de medicamentos o medicina;Servicios de producción y fabricación industrial;Industrias de plásticos y productos químicos;Producción farmacéutica;0260030010  ESZOPICLONA 3MG CM;ESZOPICLONA 3MG CM;1500;Unidad;CLP;90;0;0;0.0;135000;
47454890;2790-24-SE23;http://www.mercadopublico.cl/PurchaseOrder/Modules/PO/DetailsPurchaseOrder.aspx?codigoOC=2790-24-SE23;ORDEN DE COMPRA DESDE 2790-77-LP21;"DECRETO Nº 824 23.02.22,QUE APRUEBA CONTRATO PARA LA ADQUISICIÓN DE MEDICAMENTOS DEPTO. SALUD DE PAINE DESDE 2790-77-LP21 (MEMO Nº 09/23 QF 16.01.23).

DESPACHO: AVDA DIEGO PORTALES 1441, LOCALIDAD DE HOSPITAL- PAINE, CONTACTO: QF. SRA. Mª PAZ GOMEZ FONO: 229363300 anexo 4040-4041.";SE;Proveniente de licitación pública;No;No;8;SE;Sin emisión automática;12;Recepcion Conforme;7;Recepcion Conforme;2023-01-18;2023-01-18;2023-01-18;2023-01-18;2023-01-19;;1;3,27027027027027;37;1534564,5;CLP;1534564,5;245014,5;IVA;0;0;1289550;3779;69.072.600-9;DEPARTAMENTO DE SALUD MUNICIPAL;100728;I MUNICIPALIDAD DE PAINE;Municipalidades;OTRAS ACTIVIDADES EMPRESARIALES N.C.P.| GOBIERNO CENTRAL Y ADMINISTRACION PUBLICA;Paine;Región Metropolitana de Santiago;CL;275627;76.956.140-4;ETHON PHARMACEUTICALS SPA.;269948;ETHON PHARMACEUTICALS  COMERCIALIZADORA  IMP EXP Y DIST SPA;VENTA AL POR MAYOR DE ARTICULOS DE PERFUMERIA, COS;Rancagua;Región del Libertador General Bernardo O´Higgins;Chile;215.22.04.004.001.001;19;CL;7;2;2790-77-LP21;;126547670;51141800.0;Medicamentos y productos farmacéuticos / Medicamentos para el sistema nervioso central / Hipnóticos;51141810.0;Zopiclona;Medicamentos y productos farmacéuticos;Medicamentos para el sistema nervioso central;Hipnóticos;ZOPICLONA 7.5 MGS COMPRIMIDOS ;ZPCL07.5COMP. BEZOPICLONA 7.5MG X 1000 COMP.REC.. MINTLAB. ZOPICLONA. REG ISP F-12586 - VTO 3-2023 - LOTE C210332 Entrega en 1 dia. Se adjunta ISP, CANJE y anexos técnicos. Validez de la oferta 60 días. Sin costo por flete.;10000;Comprimido;CLP;25;0;0;0.0;250000;30 dias contra la recepcion conforme de la factura
47456407;835727-18-SE23;http://www.mercadopublico.cl/PurchaseOrder/Modules/PO/DetailsPurchaseOrder.aspx?codigoOC=835727-18-SE23;ORDEN DE COMPRA DESDE 835727-1-LE23;Adquisición de medicamentos para posta de salud rural de Visviri - Departamento de Salud DESDE 835727-1-LE23;SE;Proveniente de licitación pública;No;No;8;SE;Sin emisión automática;6;Aceptada;4;Aceptada;2023-01-18;2023-01-19;2023-01-19;2023-01-19;2023-01-19;;1;4,8;4;439162,36;CLP;439162,36;70118,36;IVA;0;0;369044;835727;69.250.700-2;Administracion Municipal;118859;Ilustre Municipalidad de General Lagos;Municipalidades;;General Lagos;Región de Arica y Parinacota;CL;658977;76.167.536-2;Medikar Ltda;1261270;Comercializadora Medikar Ltda;VENTA AL POR MAYOR DE PRODUCTOS FARMACEUTICOS| VEN;San Felipe;Región de Valparaíso ;Chile;215.22.04.004 productos farmaceuticos;19;CL;7;2;835727-1-LE23;;126551840;51141800.0;Medicamentos y productos farmacéuticos / Medicamentos para el sistema nervioso central / Hipnóticos;51141810.0;Zopiclona;Medicamentos y productos farmacéuticos;Medicamentos para el sistema nervioso central;Hipnóticos;"zopiclona 7,5mg, 12 cajas de 30 comprimidos o similar presentación (Ver Especificaciones técnicas en anexos)

";ZOPERIL 7,5 MG®, ZOPICLONA, Envase de: 30 COMPRIMIDO, EUROMED, Reg.ISP: F-16990, Vence: 2024-11-30. ;360;Comprimido;CLP;42,5;0;0;0.0;15300;30 dias contra la recepcion conforme de la factura
47456773;3019-42-AG23;http://www.mercadopublico.cl/PurchaseOrder/Modules/PO/DetailsPurchaseOrder.aspx?codigoOC=3019-42-AG23; MEDICAMENTOS BOTICA, SOLICITUD 82;SE REQUIERE LA ADQUISICIÓN DE MEDICAMENTOS PARA ABASTECIMIENTO Y FUNCIONAMIENTO DE LA FARMACIA MUNICIPAL DE LOTA, SEGÚN SOLICITUD DE COMPRA N°82 CON FECHA 13-01-2023 A PETICIÓN DE Q.F. HECTOR ROA;AG;Adquisición igual o inferior a 30 UTM (Debe presentar 3 cotizaciones);Si;Si;13;AG;Compra Ágil;6;Aceptada;4;Aceptada;2023-01-19;2023-01-19;2023-01-19;2023-01-19;2023-01-20;;1;0;0;327261,9;CLP;327261,9;52251,9;IVA;0;0;275010;3972;69.259.900-4;Departamento de Salud;113259;I MUNICIPALIDAD DE LOTA;Municipalidades;;Lota;Región del Biobío ;CL;989196;76.786.297-0;ADN FARMACÉUTICA;1580697;ADN FARMACEUTICA SPA;DROGUERIA;Pudahuel;Región Metropolitana de Santiago;Chile;34;19;CL;7;2;;;126552562;51141800.0;Medicamentos y productos farmacéuticos / Medicamentos para el sistema nervioso central / Hipnóticos;51141810.0;Zopiclona;Medicamentos y productos farmacéuticos;Medicamentos para el sistema nervioso central;Hipnóticos;ZOPICLONA 7,5 X 30 MG;;20;Unidad;CLP;1354;0;0;0.0;27080;30 dias contra la recepcion conforme de la factura
47457718;812030-106-SE23;http://www.mercadopublico.cl/PurchaseOrder/Modules/PO/DetailsPurchaseOrder.aspx?codigoOC=812030-106-SE23;ORDEN DE COMPRA DESDE 812030-30-LQ22;"ORDEN DE COMPRA DESDE 812030-30-LQ22
gestionar despacho a calendarizaciones@hospitallaflorida.cl";SE;Proveniente de licitación pública;No;No;8;SE;Sin emisión automática;6;Aceptada;4;Aceptada;2023-01-19;2023-01-19;2023-01-19;2023-01-19;2023-01-20;;1;3,8375;16;33558;CLP;33558;5358;IVA;0;0;28200;812030;65.075.485-9;medicamentos, oxigeno y trauma;1375151;HOSPITAL CLINICO METROPOLITANO DE LA FLORIDA DOCTORA ELOISA DIAZ;Salud;medicamentos, oxigeno y trauma;La Florida;Región Metropolitana de Santiago;CL;26581;91.637.000-8;LABORATORIOS RECALCINE S.A;26786;LABORATORIOS RECALCINE SA;FABRICACION DE PRODUCTOS FARMACEUTICOS, SUSTANCIAS;Providencia;Región Metropolitana de Santiago;Chile;;19;CL;7;2;812030-30-LQ22;;126555505;73101700.0;Servicios de producción y fabricación industrial / Industrias de plásticos y productos químicos / Producción farmacéutica;73101701.0;Servicios de producción de medicamentos o medicina;Servicios de producción y fabricación industrial;Industrias de plásticos y productos químicos;Producción farmacéutica;"FANN05045	ESZOPICLONA 3 MG COM
";"FANN05045	ESZOPICLONA 3 MG COM
";30;Unidad no definida;CLP;100;0;0;0.0;3000;30 dias contra la recepcion conforme de la factura
47460696;3932-29-AG23;http://www.mercadopublico.cl/PurchaseOrder/Modules/PO/DetailsPurchaseOrder.aspx?codigoOC=3932-29-AG23;Orden de Compra generada por invitación a compra ágil: 3932-18-COT23;Se requiere adquirir medicamentos para Farmacia Comunitaria, con entrega en Cesfam Placilla, Región de O'Higgins en horario de 08:30 a 12:30 y de 14:00 a 16:30 horas.-;AG;Adquisición igual o inferior a 30 UTM (Debe presentar 3 cotizaciones);Si;Si;13;AG;Compra Ágil;6;Aceptada;4;Aceptada;2023-01-19;2023-01-19;2023-01-19;2023-01-19;2023-01-19;;1;0;0;1647368,17;CLP;1647368,17;263025,17;IVA;0;0;1384343;4852;69.090.200-1;Salud Municipal;118087;I MUNICIPALIDAD DE PLACILLA;Municipalidades;;Placilla;Región del Libertador General Bernardo O´Higgins;CL;619801;76.111.113-2;CLINICAL MARKET;1217923;CLINICAL MARKET S.A.;VENTA AL POR MAYOR DE PRODUCTOS FARMACEUTICOS| VEN;Macul;Región Metropolitana de Santiago;Chile;215.22.04.004.002;19;CL;12;2;;;126571454;73101700.0;Servicios de producción y fabricación industrial / Industrias de plásticos y productos químicos / Producción farmacéutica;73101701.0;Servicios de producción de medicamentos o medicina;Servicios de producción y fabricación industrial;Industrias de plásticos y productos químicos;Producción farmacéutica;"102244	Eszopiclona 3mg x 30 comp
";;6;Comprimido;CLP;3110;0;0;0.0;18660;30 dias contra la recepcion conforme de la factura
47460957;2320-14-SE23;http://www.mercadopublico.cl/PurchaseOrder/Modules/PO/DetailsPurchaseOrder.aspx?codigoOC=2320-14-SE23;Medicamentos Farmacia Comunitaria - D003 - SAA 002;Se requiere adquirir para usuarios de la farmacia comunitaria lo siguiente: 20 Coques 200mg  x 30cp, 40 Esc 10mg 30cpr (c1) ch (nuevo pt), 20 Melatonina 3mg x 30 Comp., 30 Mio - Relax 10mg 20tab ch, 120 Tramavolta 37.5/325 x 30 Comp., 60 Zoperil 7.5mg x 30 Compr.Recub. y 60 Betina Betahistina Diclor 16mg x 30 Comp.;SE;Contratación con titulares de derecho de propiedad intelectual o industrial;Si;No;8;SE;Sin emisión automática;6;Aceptada;4;Aceptada;2023-01-19;2023-01-19;2023-01-19;2023-01-19;2023-01-23;;1;4,82222222222222;9;1260852,6;CLP;1260852,6;201312,6;IVA;0;0;1059540;3313;69.130.100-1;ADQUISICIONES SALUD MUNICIPAL;86407;I MUNICIPALIDAD DE SAN JAVIER;Municipalidades;CULTIVO DE TRIGO| CULTIVO FORRAJEROS EN PRADERAS MEJORADAS O SEMBRADAS| CULTIVO DE OTRAS OLEAGINOSAS N.C.P.| OTROS SERVICIOS AGRICOLAS N.C.P.| MUNICIPALIDADES| ESTABLECIMIENTOS DE ENSENANZA PRIMARIA| INSTITUTOS PROFESIONALES| ESTABLECIMIENTOS MEDICOS DE A;San Javier;Región del Maule ;CL;21978;79.802.770-0;Eurofarma Chile S. A.;22491;Eurofarma Chile S. A.;FABRICACION DE PRODUCTOS FARMACEUTICOS, SUSTANCIAS;Cerrillos;Región Metropolitana de Santiago;Chile;215.22.04.004;19;CL;7;2;;;126566115;51141800.0;Medicamentos y productos farmacéuticos / Medicamentos para el sistema nervioso central / Hipnóticos;51141810.0;Zopiclona;Medicamentos y productos farmacéuticos;Medicamentos para el sistema nervioso central;Hipnóticos;ZOPERIL 7.5MG X 30 COMPR.RECUB.;;60;Unidad no definida;CLP;900;0;0;0.0;54000;30 dias contra la recepcion conforme de la factura
47463350;3130-122-SE23;http://www.mercadopublico.cl/PurchaseOrder/Modules/PO/DetailsPurchaseOrder.aspx?codigoOC=3130-122-SE23;MEDICAMENTOS REQ. 21350;"LICITACIÓN N° 5839-36-LR19
1.- ""LA ORDEN DE COMPRA DEBE SER ACEPTADA EN EL PORTAL DE LO CONTRARIO SE SOLICITARÁ SU RECHAZO (ART.63 REG. LEY 19.886.)
2.- CONSULTAS SOBRE EL PAGO DE ESTE COMPROMISO:  SOLEDAD VALDERAS, FONO 61-2-207500 ANEXO 177. MVALDERAS@SANIDADNAVAL.CL
3.- ""PAGO PREVIA RECEPCIÓN CONFORME DE LOS BIENES O SERVICIOS CON LA RESPECTIVA FACTURA ADJUNTA"".";SE;Proveniente de licitación pública;No;No;8;SE;Sin emisión automática;12;Recepcion Conforme;7;Recepcion Conforme;2023-01-19;2023-01-20;2023-01-20;2023-01-20;2023-01-23;;1;3,27027027027027;37;392338,24;CLP;392338,24;62642,24;IVA;0;0;329696;4051;61.102.029-5;HOSPITAL DE LAS FF.AA. CIRUJANO GUZMAN;111875;DIRECCION DE ABASTECIMIENTO DE LA ARMADA;FFAA;FARMACIAS INDEPENDIENTES| HOSPITALES Y CLINICAS;Punta Arenas;Región de Magallanes y de la Antártica;CL;275627;76.956.140-4;ETHON PHARMACEUTICALS SPA.;269948;ETHON PHARMACEUTICALS  COMERCIALIZADORA  IMP EXP Y DIST SPA;VENTA AL POR MAYOR DE ARTICULOS DE PERFUMERIA, COS;Rancagua;Región del Libertador General Bernardo O´Higgins;Chile;122-2023;19;CL;7;48;5839-36-LR19;;126572930;51141800.0;Medicamentos y productos farmacéuticos / Medicamentos para el sistema nervioso central / Hipnóticos;51141810.0;Zopiclona;Medicamentos y productos farmacéuticos;Medicamentos para el sistema nervioso central;Hipnóticos;"ZOPICLONA  7,5 mg.	Comprimidos Recubiertos
Caja x 1000 Comprimidos
Zopiclona	COMP";"ZOPICLONA  7,5 mg.	Comprimidos Recubiertos
Caja x 1000 Comprimidos
Zopiclona	COMP";5;Caja;CLP;24000;0;0;0.0;120000;
47464376;3690-25-SE23;http://www.mercadopublico.cl/PurchaseOrder/Modules/PO/DetailsPurchaseOrder.aspx?codigoOC=3690-25-SE23;ORDEN DE COMPRA DESDE 3690-5-LQ22;"Memorándum Nro. 20 de fecha 17 de enero del 2023, emitido por Yohanna Hernández, Químico farmacéutico del CESFAM Las cabras,
donde solicita medicamentos para abastecimiento de la farmacia del CESFAM
Suministro Medicamentos DESDE 3690-5-LQ22";SE;Proveniente de licitación pública;No;No;8;SE;Sin emisión automática;6;Aceptada;4;Aceptada;2023-01-20;2023-01-20;2023-01-20;2023-01-20;2023-01-20;;1;4,23157894736842;76;2331031,5;CLP;2331031,5;372181,5;IVA;0;0;1958850;4610;69.080.800-5;Salud;116296;I MUNICIPALIDAD DE LAS CABRAS;Municipalidades;;Las Cabras;Región del Libertador General Bernardo O´Higgins;CL;550506;91.575.000-1;Socofar Division Munnich;26783;SOCOFAR S A;REPARACION DE EQUIPO MEDICO Y QUIRURGICO, Y DE APA;Quilicura;Región Metropolitana de Santiago;Chile;148;19;CL;7;2;3690-5-LQ22;;126576936;51141800.0;Medicamentos y productos farmacéuticos / Medicamentos para el sistema nervioso central / Hipnóticos;51141810.0;Zopiclona;Medicamentos y productos farmacéuticos;Medicamentos para el sistema nervioso central;Hipnóticos;ZOPICLONA 7.5 MG COMPRIMIDO ;ZOPICLONA COMPRIMIDO 5MG - ZOPLICONA - BIOEQUIVALENTE - CAJA X 1000;10000;Unidad no definida;CLP;21,73;0;0;0.0;217300;30 dias contra la recepcion conforme de la factura
47467878;1395-48-SE23;http://www.mercadopublico.cl/PurchaseOrder/Modules/PO/DetailsPurchaseOrder.aspx?codigoOC=1395-48-SE23;TD Fármacos Depresión Grave S. S. Coquimbo;"1.- Resolución Exenta N°363 Autoriza Adquisición
2.- Certificado Disponibilidad Presupuestaria Nº 15";SE;Emergencia, urgencia o imprevisto;Si;No;8;SE;Sin emisión automática;12;Recepcion Conforme;7;Recepcion Conforme;2023-01-20;2023-01-25;2023-01-20;2023-04-18;2023-01-25;;1;4,62857142857143;7;1982540;CLP;1982540;316540;IVA;0;0;1666000;2391;61.606.400-2;Servicio de Salud Coquimbo;7052;SERVICIO DE SALUD COQUIMBO;Salud;HOSPITALES Y CLINICAS;La Serena;Región de Coquimbo ;CL;69104;91.650.000-9;Laboratorios Saval S.A;67079;LABORATORIOS SAVAL S A;FABRICACION DE PRODUCTOS FARMACEUTICOS, SUSTANCIAS;Santiago;Región Metropolitana de Santiago;Chile;97;19;CL;12;2;;;126586677;51141800.0;Medicamentos y productos farmacéuticos / Medicamentos para el sistema nervioso central / Hipnóticos;51141810.0;Zopiclona;Medicamentos y productos farmacéuticos;Medicamentos para el sistema nervioso central;Hipnóticos;Eszopiclona 3 mg.;Nirvan 3 mg. x 40 Comp.;425;Caja;CLP;3920;0;0;0.0;1666000;30 dias contra la recepcion conforme de la factura
47478659;2085-91-SE23;http://www.mercadopublico.cl/PurchaseOrder/Modules/PO/DetailsPurchaseOrder.aspx?codigoOC=2085-91-SE23;MEDICAMENTOS MES ENERO 2023;"CONVENIO DE SUMINISTRO DE MEDICAMENTOS PARA EL HOS DESDE 2085-12-LQ22
res 589 
29 septiembre 2022";SE;Proveniente de licitación pública;No;No;8;SE;Sin emisión automática;12;Recepcion Conforme;7;Recepcion Conforme;2023-01-23;2023-01-23;2023-01-23;2023-01-23;2023-01-24;;1;3,27027027027027;37;3663276,96;CLP;3663276,96;584892,96;IVA;0;0;3078384;3080;61.602.226-1;Hospital Traiguén;7384;SERVICIO DE SALUD ARAUCANIA HOSPITAL DE TRAIGUEN;Salud;HOSPITALES Y CLINICAS;Traiguén;Región de la Araucanía ;CL;275627;76.956.140-4;ETHON PHARMACEUTICALS SPA.;269948;ETHON PHARMACEUTICALS  COMERCIALIZADORA  IMP EXP Y DIST SPA;VENTA AL POR MAYOR DE ARTICULOS DE PERFUMERIA, COS;Rancagua;Región del Libertador General Bernardo O´Higgins;Chile;;19;CL;7;2;2085-12-LQ22;;126615775;51141800.0;Medicamentos y productos farmacéuticos / Medicamentos para el sistema nervioso central / Hipnóticos;51141810.0;Zopiclona;Medicamentos y productos farmacéuticos;Medicamentos para el sistema nervioso central;Hipnóticos;ZOPICLONA CM 7,5  MG;ZPCL07.5COMP. (BE)ZOPICLONA 7.5MG X 1000 COMP.REC.. MINTLAB. ZOPICLONA. REG ISP F-12586. VCTO 01-2024. LOTE A220070 -- 7800063611822, Entrega en 48 hrs. Se adjunta ISP, CANJE y anexos solicitados. Sin costo por flete. Pedido mínimo 50.000. Vigencia oferta;25000;Comprimido;CLP;26;0;0;0.0;650000;30 dias contra la recepcion conforme de la factura
47480976;2395-42-AG23;http://www.mercadopublico.cl/PurchaseOrder/Modules/PO/DetailsPurchaseOrder.aspx?codigoOC=2395-42-AG23;Zopiclona 7,5mg compra ágil: 2395-30-COT23;COMPRAR MEDICAMENTOS A PACIENTES INSCRITOS EN LA FARMACIA POPULAR EN LA COMUNA DE PEDRO AGUIRRE CERDA. DESPACHAR A AV. CLOTARIO BLEST 6035 FARMACIA POPULAR, HORARIOS DE 8 A 13 HRS Y DE 15 A 16.30 HRS INTERIOR CENTRO DE SALUD VILLA SUR;AG;Adquisición igual o inferior a 30 UTM (Debe presentar 3 cotizaciones);Si;Si;13;AG;Compra Ágil;6;Aceptada;4;Aceptada;2023-01-24;2023-01-24;2023-01-24;2023-01-24;2023-01-24;;1;4,08;10;294525;CLP;294525;47025;IVA;0;0;247500;3387;69.254.900-7;DIRECCION DE SALUD;87104;I MUNICIPALIDAD PEDRO AGUIRRE CERDA;Municipalidades;MUNICIPALIDADES| OTRAS ACTIVIDADES DE SERVICIOS PERSONALES N.C.P.;Pedro Aguirre Cerda;Región Metropolitana de Santiago;CL;26897;96.026.000-7;Chemopharma S.A.;27062;CHEMOPHARMA S A;FABRICACION DE PRODUCTOS FARMACEUTICOS, SUSTANCIAS;Santiago;Región Metropolitana de Santiago;Chile;207;19;CL;7;2;;;126622278;51141800.0;Medicamentos y productos farmacéuticos / Medicamentos para el sistema nervioso central / Hipnóticos;51141810.0;Zopiclona;Medicamentos y productos farmacéuticos;Medicamentos para el sistema nervioso central;Hipnóticos;ZOPICLONA 7.5 MG X 30 COMPRIMIDOS RECUBIERTOS CON FECHA DE VENCIMIENTO NO INFERIOR A 12 MESES- INCLUIR FECHA DE VENCIMIENTO Y REGISTRO ISP;;250;Caja;CLP;990;0;0;0.0;247500;30 dias contra la recepcion conforme de la factura
47482811;3789-38-SE23;http://www.mercadopublico.cl/PurchaseOrder/Modules/PO/DetailsPurchaseOrder.aspx?codigoOC=3789-38-SE23;MEDICAMENTOS FARMACIA DEL PUEBLO;Suministro Medicamento Farmacia Popular DESDE 3789-25-LP21;SE;Proveniente de licitación pública;No;No;8;SE;Sin emisión automática;6;Aceptada;4;Aceptada;2023-01-24;2023-01-26;2023-01-25;2023-01-25;2023-01-26;;1;4,40377358490566;53;1715931,21;CLP;1715931,21;273972,21;IVA;0;0;1441959;4709;69.200.900-2;Dpto. Salud;116744;I MUNICIPALIDAD DE PAILLACO;Municipalidades;;Paillaco;Región de Los Ríos;CL;106395;77.596.940-7;LABORATORIO CHILE S.A.;103860;LABORATORIO CHILE S A;FABRICACION DE PRODUCTOS FARMACEUTICOS, SUSTANCIAS;Ñuñoa;Región Metropolitana de Santiago;Chile;2152204005004;19;CL;7;2;3789-25-LP21;;126645851;51141800.0;Medicamentos y productos farmacéuticos / Medicamentos para el sistema nervioso central / Hipnóticos;51141810.0;Zopiclona;Medicamentos y productos farmacéuticos;Medicamentos para el sistema nervioso central;Hipnóticos;"120-10-74721	ZOPINOM 3 MG 30 CR	Eszopiclone	30	 $5.553 
";"120-10-74721	ZOPINOM 3 MG 30 CR	Eszopiclone	30	 $5.553 
";5;Unidad no definida;CLP;5533;0;0;0.0;27665;30 dias contra la recepcion conforme de la factura
47482811;3789-38-SE23;http://www.mercadopublico.cl/PurchaseOrder/Modules/PO/DetailsPurchaseOrder.aspx?codigoOC=3789-38-SE23;MEDICAMENTOS FARMACIA DEL PUEBLO;Suministro Medicamento Farmacia Popular DESDE 3789-25-LP21;SE;Proveniente de licitación pública;No;No;8;SE;Sin emisión automática;6;Aceptada;4;Aceptada;2023-01-24;2023-01-26;2023-01-25;2023-01-25;2023-01-26;;1;4,40377358490566;53;1715931,21;CLP;1715931,21;273972,21;IVA;0;0;1441959;4709;69.200.900-2;Dpto. Salud;116744;I MUNICIPALIDAD DE PAILLACO;Municipalidades;;Paillaco;Región de Los Ríos;CL;106395;77.596.940-7;LABORATORIO CHILE S.A.;103860;LABORATORIO CHILE S A;FABRICACION DE PRODUCTOS FARMACEUTICOS, SUSTANCIAS;Ñuñoa;Región Metropolitana de Santiago;Chile;2152204005004;19;CL;7;2;3789-25-LP21;;126645704;51141800.0;Medicamentos y productos farmacéuticos / Medicamentos para el sistema nervioso central / Hipnóticos;51141810.0;Zopiclona;Medicamentos y productos farmacéuticos;Medicamentos para el sistema nervioso central;Hipnóticos;"120-10-80708	ZOPICLONA 7.5 MG 30 CR	Zopiclone	30	 $850 
";"120-10-80708	ZOPICLONA 7.5 MG 30 CR	Zopiclone	30	 $850 
";50;Unidad no definida;CLP;850;0;0;0.0;42500;30 dias contra la recepcion conforme de la factura
47483131;3636-19-SE23;http://www.mercadopublico.cl/PurchaseOrder/Modules/PO/DetailsPurchaseOrder.aspx?codigoOC=3636-19-SE23;ORDEN DE COMPRA DESDE 3636-1-LE23;COMPRA DE MEDICAMENTOS CANASTA BASICA DESDE 3636-1-LE23;SE;Proveniente de licitación pública;No;No;8;SE;Sin emisión automática;6;Aceptada;4;Aceptada;2023-01-24;2023-01-24;2023-01-24;2023-01-24;2023-01-24;;1;3,69354838709677;62;13478344,6;CLP;13478344,6;2152004,6;IVA;0;0;11326340;4556;69.081.500-1;I. Municipalidad de Malloa - Departamento de Salud;115609;I MUNICIPALIDAD DE MALLOA;Municipalidades;;Malloa;Región del Libertador General Bernardo O´Higgins;CL;261744;76.830.090-9;Caribean Pharma Ltda;256360;FARMACEUTICA CARIBEAN LTDA;VENTA AL POR MAYOR DE ARTICULOS DE PERFUMERIA, COS;Renca;Región Metropolitana de Santiago;Chile;2152204004;19;CL;12;39;3636-1-LE23;;126628800;51141800.0;Medicamentos y productos farmacéuticos / Medicamentos para el sistema nervioso central / Hipnóticos;51141810.0;Zopiclona;Medicamentos y productos farmacéuticos;Medicamentos para el sistema nervioso central;Hipnóticos;Zopiclona 7,5 mg.;MIN0215 ZOPICLONA 7,5  COMP. CAJA X 1000, Zoplicona 7,5 mg, F-12586/17, MILAB, 30-06-2024, venc: 30-06-2024, Plazo de entrega de 24-48 hrs;50000;Comprimido;CLP;22,37;0;0;0.0;1118500;Otro, Ver Instrucciones
47484642;4738-26-SE23;http://www.mercadopublico.cl/PurchaseOrder/Modules/PO/DetailsPurchaseOrder.aspx?codigoOC=4738-26-SE23;MEDICAMENTOS DESDE 4738-2-LQ22 (PEDIDO 10);SUMINISTRO DE MEDICAMENTOS POR 12 MESES DESDE 4738-2-LQ22;SE;Proveniente de licitación pública;No;No;8;SE;Sin emisión automática;6;Aceptada;4;Aceptada;2023-01-24;2023-01-24;2023-01-24;2023-01-24;2023-01-24;;1;3,27027027027027;37;1798923;CLP;1798923;287223;IVA;0;0;1511700;5653;69.080.400-K;Salud;165106;I MUNICIPALIDAD DE CODEGUA;Municipalidades;;Codegua;Región del Libertador General Bernardo O´Higgins;CL;275627;76.956.140-4;ETHON PHARMACEUTICALS SPA.;269948;ETHON PHARMACEUTICALS  COMERCIALIZADORA  IMP EXP Y DIST SPA;VENTA AL POR MAYOR DE ARTICULOS DE PERFUMERIA, COS;Rancagua;Región del Libertador General Bernardo O´Higgins;Chile;215.22.04;19;CL;7;2;4738-2-LQ22;;126633748;51141800.0;Medicamentos y productos farmacéuticos / Medicamentos para el sistema nervioso central / Hipnóticos;51141810.0;Zopiclona;Medicamentos y productos farmacéuticos;Medicamentos para el sistema nervioso central;Hipnóticos;"ZOPICLONA 7,5mg COMPRIMIDO
";ZPCL07.5COMP. (BE)ZOPICLONA 7.5MG X 1000 COMP.REC.. MINTLAB. ZOPICLONA. REG ISP F-12586. VCTO 01-2024. LOTE A220070 -- 7800063611822, Vigencia de la Oferta 370 días corridos a contar de la fecha de apertura de los antecedentes Generales;30000;Unidad;CLP;25,9;0;0;0.0;777000;30 dias contra la recepcion conforme de la factura
47485012;1058094-130-SE23;http://www.mercadopublico.cl/PurchaseOrder/Modules/PO/DetailsPurchaseOrder.aspx?codigoOC=1058094-130-SE23;JM FARMACOS;ENVIAR A NUESTRA BODEGA DE LUNES A VIERNES DESDE LAS 8:30  HASTA LAS 13:00 HRS. CONTACTO: JENNIFER MARQUEZ FONO:225767298 LA FACTURA O GUIA DE DESPACHO DEBE VENIR ACOMPAÑADA CON LA COPIA DE ORDEN DE COMPRA EN ESTADO ACEPTADA EN EL PORTAL DEL MERCADO PUBLICO, DE LO CONTRARIO SERA RECHAZADO.;SE;Emergencia, urgencia o imprevisto;Si;No;8;SE;Sin emisión automática;12;Recepcion Conforme;7;Recepcion Conforme;2023-01-24;2023-01-24;2023-01-24;2023-02-22;2023-01-25;;1;0;0;2791841,15;CLP;2791841,15;445756,15;IVA;0;0;2346085;1058094;61.608.107-1;Fármarcos;7390;SERVICIO DE SALUD SUR HOSPITAL SANATORIO EL PINO;Salud;Servicio Público;San Bernardo;Región Metropolitana de Santiago;CL;1124621;76.985.933-0;Droguería Aconcagua SpA;1714883;DROGUERÍA ACONCAGUA SPA;VENTA AL POR MAYOR DE PRODUCTOS FARMACEUTICOS Y ME;La Granja;Región Metropolitana de Santiago;Chile;;19;CL;7;2;;;126635135;51141800.0;Medicamentos y productos farmacéuticos / Medicamentos para el sistema nervioso central / Hipnóticos;51141810.0;Zopiclona;Medicamentos y productos farmacéuticos;Medicamentos para el sistema nervioso central;Hipnóticos;ZOPICLONA 7,5 MG         ;ZOPICLONA 7,5 MG         ;3000;Unidad no definida;CLP;27;0;0;0.0;81000;30 dias contra la recepcion conforme de la factura
